"oclc编号 - oclcNumber","书号 - isbns","书名 - title","作者 - creator","出版日期 - publicationDate","语言 - catalogingLanguage","格式 - generalFormat","详细格式 - specificFormat","版本 - edition","总版本数 - totalEditions","出版社 - publisher","出版地 - publicationPlace","主题 - subjects","简介 - summaries","是否同行审阅 - peerReviewed"
"1259591704","9787999199724,7999199729","机器人钢铁侠","刘鑫主编.","2019","chi","Book","Digital",,1,"安徽人民出版社","Hefei","","","否"
"1314626741","9787227071082,7227071081","人民楷模王有德","《人民楷模王有德》编委会编.","2019","chi","Book","Digital",,1,"宁夏人民出版社","Yinchuan","","","否"
"1347064205","9787213100734,7213100734","唐潮 : 唐朝人的家常与流行","李永志, author","2022","chi","Book","PrintBook","Di 1 ban",1,"浙江人民出版社","Hangzhou","Manners and customs,Social conditions,Tang Dynasty (China),China History Tang dynasty, 618-907,China History Tang dynasty, 618-907 Social life and customs,China History Tang dynasty, 618-907 Social conditions,Chine Histoire 618-907 (Dynastie des Tang),Chine Histoire 618-907 (Dynastie des Tang) Mœurs et coutumes,Chine Histoire 618-907 (Dynastie des Tang) Conditions sociales,China,History,618-907","本书作为一本了解中国唐代日常生活的入门读物,尝试从美食文化,服饰美妆,居家生活,出行宝典,婚丧嫁娶,人际职场,文教娱乐,佳节风俗,城市建设,制度保障等十个方面,透过近百个与普通百姓生存,生活相关的实际问题,力图重现数百年前唐人的真实生活状态,进而探寻那个时代的本来面貌.作者从读者的兴趣点出发,翻阅大量史料以及后人对唐代的研究成果,用简洁风趣的笔调,条分缕析地讲述每个问题,试图勾勒出一幕幕升斗小民在唐朝的点滴日常","否"
"1274191094","9787220119033,7220119038","回顾展的回顾","陈丹青, 1953- author","2020","chi","Book","PrintBook","Di 1 ban",2,"四川人民出版社","Chengdou","Art criticism,Critique d'art,art criticism","","否"
"1378354945","9787208181298,7208181292","汉魏六朝文人身份的变迁与文学演进 = The changing of literati's identifications and the evolution of literature in the Han, Wei and six dynasties","徐俪成 (Writer on literature), author","2023","chi","Book","PrintBook","Di 1 ban",2,"上海人民出版社","Shanghai Shi","Intellectuals China,Chinese literature Qin and Han dynasties, 221 B.C.-220 A.D. History and criticism,Chinese literature 220-589 History and criticism,Intellectuels Chine,Littérature chinoise 221 av. J.-C.-220 (Dynasties des Qin et des Han) Histoire et critique,Littérature chinoise 220-589 Histoire et critique,China Intellectual life 221 B.C.-960 A.D,Chine Vie intellectuelle 221 av. J.-C.-960","本书集中梳理了汉魏六朝不同历史阶段中文人社会身份与政治角色的变化过程,并从文学创作与文人身份的关系出发,对汉魏六朝文学发展中创作生态,文类选择,风格演进,批评范式等诸多问题提出了新的看法.本书选择了较长时段的研究,摆脫了断代文学的限制,以一个宽广的视角,整体梳理了唐代以前文人身份变化的历程,以及随之产生的文学生态的变化与文学创作,批评的发展","否"
"1338630256","9787203120339,7203120333,9787203120322,7203120325,9787203120711,7203120716,9787203120728,7203120724,9787203120735,7203120732,9787203120742,7203120740,9787203120759,7203120759,9787203120766,7203120767","鲁迅辑印美术图录全集","刘运峰","2021","chi","Book","PrintBook","Di 1 ban",1,"山西人民出版社","Taiyuan Shi","Lu, Xun, 1881-1936 Art collections Catalogs,Lu, Xun, 1881-1936,Art, Chinese Catalogs,Art Private collections China Catalogs,Art chinois Catalogues,Art Collections privées Chine Catalogues,Art, Chinese,Calligraphy, Chinese,Inscriptions, Chinese,Art,1900-1999","本丛书是对鲁迅先生在中外艺术引进,介绍和整理方面进行的首次整理,它反映了这位文化巨人非凡成就的一个侧面,同时,在很大程度上来说,它也是最完整意义上的""鲁迅全集""的重要组成部分.本书为其中的第一卷,收录了""寰宇贞石图"",共291幅,鲁迅在北京教育部时期亲手编订,是中国清代汇集历代重要石刻拓本的影印图录.该书初版收入周,秦,汉,唐,金等朝代及高丽,日本等地碑刻共300余种.鲁迅曾以所得""寰宇贞石图""散页,于1916年重新排列顺序,并编写了总目及分册目录.本书将鲁迅所编订的石刻拓本重新整理成一卷影印出版","否"
"1382727115","9787214271600,7214271605","战时西北国际交通线","陈橹, 1962- author","2023","chi","Book","PrintBook","Di 1 ban",2,"江苏人民出版社","Nanjing Shi","Sino-Japanese War, 1937-1945 Participation, Russian,Military assistance, Russian China,Assistance militaire russe Chine,China Military relations Soviet Union,Soviet Union Military relations China","","否"
"1258070243","9787214257291,7214257297","转型期城市社会治理研究 : 民国山东城市下层社会调控透视","郭谦, 1973- author","2021","chi","Book","PrintBook","Di 1 ban",2,"江苏人民出版社","Nanjing Shi","Social change China Shandong Sheng History,Social classes China Shandong Sheng History,Social change China History,Classes sociales Chine Shandong Histoire,Social change,Social classes,Social conditions,Shandong Sheng (China) Social conditions 19th century,Shandong (Chine) Conditions sociales 19e siècle,China,China Shandong Sheng,History,1800-1899","本书以民国时期山东城市为切入点,通过对大量史料的深入挖掘整理和系统分析整合,将社会学,城市学,行政学等学科理论与史学的分析论证结合起来,大量运用社会学和相关学科的理论,概念和方法,全面系统深入地揭示民国时期城市社会阶层结构和城市下层社会的构成与状况;对北洋军阀政府时期,南京国民政府时期和日伪侵占时期的统治者对山东城市下层社会的社会调控机构,法律与规章,思想文化与社会规范控制以及社会救济与慈善活动等进行了深入研究","否"
"1152473360","9787222169203,7222169202","云南少数民族非纸质典籍聚珍. 金石器物类 = Yunan shaoshu minzu feizhizhi dianji juzhen. Jinshi qiwu lei","和六花","2020","chi","Book","PrintBook","Di 1 ban",1,"云南人民出版社","Kunming","Rare books China Yunnan Sheng,Livres rares Chine Yunnan (Sheng),Antiquities,Rare books,Yunnan Sheng (China) Antiquities History,China Yunnan Sheng,History","云南少数民族非纸质典籍以种类多, 历史久, 载体多样而独具优势, 是云南省人无我有, 人有我优的一宗重要文化资源和遗产.该卷主要收录金石器物类典籍, 包括刻于金银器物之上的文书, 石刻, 骨刻历算书等","否"
"1267584461","9787215126756,7215126757","腹地的边缘化 : 近代南阳盆地社会变迁研究(1906-1937) = Fudi de bianyuanhua : jindai Nanyang Pendi shehui bianqian yanjiu","刘振华, 1979- author","2021","chi","Book","PrintBook","Di 1 ban",1,"河南人民出版社","Zhengzhou Shi","Social conditions,Nanyang Shi (China) Social conditions 20th century,China Nanyang Shi,1900-1999","该书稿聚焦于1906-1937年汉水流域的南阳盆地,旨在透过南阳管窥近代中国社会转型中的""边缘化""问题.20世纪前期,随着水运的衰落,生态环境的恶化,社会环境的衰败以及东部沿海工商业的崛起和扩张,南阳同整个北方内陆地区一起急剧衰退,并在河南乃至全国经济的层级体系中迅速向边缘位置滑落.南阳地区的""边缘化""是近代中国社会转型期间局部地区衰败的一个缩影,也是近代中国社会政治秩序失衡的牺牲品","否"
"1346062315","9787214257772,7214257777","中国哲学通史 : 学术版. 魏晋南北朝卷 = A history of Chinese philosophy","麻天祥, 1948- author","2020","chi","Book","PrintBook","Di 1 ban",1,"江苏人民出版社","Nanjing","Philosophy, Chinese 221 B.C.-960 A.D,Philosophie chinoise 221 av. J.-C.-960,Philosophy, Chinese,221 B.C.-960 A.D","本卷主要涵盖魏晋南北朝时期的哲学历程,主张将魏晋南北朝时期以魏晋玄学为核心的整个哲学发展进程视作一个完整的""时代思潮"".随着玄学的形成,发展与流变,其影响辐射开来,促进了玄学化的道教,玄学化的佛教和玄学化的儒学的陆续涌现.这些共同构成了魏晋南北朝时期丰富而绚烂的哲学思想图景.具体看,总论部分探讨了体用之辨,言意之辨的魏晋风度与魏晋哲学之间的关系.正文部分分为三篇:第一篇讨论了""易""""老""""庄""会通的玄学,第二篇论述了魏晋时期的佛教哲学,第三篇梳理了玄化的儒家哲学与儒家经典","否"
"1338630590","9787010246666,7010246661","近代以来中国城乡关系演进与新型城乡关系的形成研究 = Research on the evolution of urban-rural relations in China since modern times and the formation of new urban-rural relations","吴丰华, 1985- author","2022","chi","Book","PrintBook","Di 1 ban",1,"人民出版社","Beijing Shi","Rural-urban relations China,Urbanization China,Rural development China,Cities and towns China,Relations villes-campagnes Chine,Urbanisation Chine,Développement rural Chine,Villes Chine,Cities and towns,Economic history Regional disparities,Rural development,Rural-urban relations,Urbanization,China Economic conditions Regional disparities,Chine Conditions économiques Disparités régionales,China","本书聚焦""中国近代城乡关系演进""以及正在推进构建的""新型城乡关系""作为研究对象, 通过分析人类社会城乡关系演变的一般规律和发展中国家城乡关系演变的特殊性, 立足马克思主义政治经济学和中国特色社会主义政治经济学, 构建""生产力发展+发展战略+制度选择→城乡制度和政策安排→城乡居民行为和城乡关系""的城乡关系演进分析框架, 考察中国近代以来三大阶段城乡关系演变的过程, 原因和特点. 从中国整体, 区域和省域三方面分析刻画中国城乡关系发展的现状, 并构建指标体系, 全面评价中国城乡融合发展水平. 在此基础上, 具体论证新发展阶段下构建城乡关系的理想状态一新型城乡关系的总体思路, 原则遵循和目标, 并重点分析构建新型城乡关系的六个关键问题, 展望到2050年中国形成新型城乡关系的三步走战略","否"
"1102976898","9787220112553,7220112556","巴蜀旧影 : 百年前一个日本人的巴蜀行纪","山川早水, author","2019","chi","Book","PrintBook","Di 1 ban",6,"四川人民出版社","Chengdu","Yamakawa, Sōsui Travel China Sichuan Sheng,Travel,Sichuan Sheng (China) Description and travel,Sichuan Sheng (China) History,Sichuan (Chine) Descriptions et voyages,Sichuan (Chine) Histoire,China Sichuan Sheng,History","《巴蜀旧影-百年前一个日本人的巴蜀行纪》是清末四川高等学堂日文教师山川早水在川游历期间撰写的日记.虽是游记, 但本书并不是一本简单的流水账, 不像清代一般的国内游记多以记载沿途古迹名胜为主, 而是以日记体的形式, 用二十余万字记录了沿途的风土人情, 名胜古迹, 社会交往等, 重现了百年前的巴蜀大地.同时, 书中收录了百余幅图片, 读来趣味横生, 让今人读起来恍如重新走进了百年前的生活.让人惊叹的是, 虽然经历了百年的时光, 你会发现身边的景致却依然生动地呈现在我们面前","否"
"1152408924","9787222169227,7222169229","云南少数民族非纸质典籍聚珍. 丝帛素书类. 一 = Yunna shaoshu minzu feizhizhi dianji juzhen. Sibo shushu lei. Yi","和六花","2020","chi","Book","PrintBook","Di 1 ban",1,"云南人民出版社","Kunming","Rare books China Yunnan Sheng,Livres rares Chine Yunnan (Sheng),Antiquities,Rare books,Yunnan Sheng (China) Antiquities History,China Yunnan Sheng,History","云南少数民族非纸质典籍以种类多, 历史久, 载体多样而独具优势, 是云南省人无我有, 人有我优的一宗重要文化资源和遗产.该卷主要收录丝帛素书类典籍","否"
"1312268618","9787010226460,7010226466","民国时期农村职业教育研究","罗银科, 1982- author","2021","chi","Book","PrintBook","Di 1 ban",1,"人民出版社","Beijing Shi","Agricultural education China History,Agriculture Study and teaching China History,Education, Rural China History,Vocational education China History,Enseignement agricole Chine Histoire,Agriculture Étude et enseignement Chine Histoire,Enseignement en milieu rural Chine Histoire,Enseignement professionnel Chine Histoire,Agricultural education,Agriculture Study and teaching,Education, Rural,Vocational education,China History Republic, 1912-1949,Chine Histoire 1912-1949 (République),China,History,1912-1949","农村职业教育是当下破解""三农问题""的有效途径之一.在关注当前农村职业教育的同时,有必要对其进行历史的回溯.书稿将研究范围内农业教育的发展分为北洋政府时期,军阀混战时期,南京国民政府时期和抗战及内战时期四个阶段,每个阶段主要从农业学校的设置与修订,农业学校课程与教材,农业学校师资,农业学校经费,农业学校与学生五个方面进行梳理.并就以上各方面做前后的对比,标明特异之点,给予简要评价,提出一些不同的解释,希望这样的尝试对后继研究者有所帮助","否"
"1267585378","9787010234717,701023471X","蘭州通史. 中华人民共和国卷 = Genearl history of Lanzhou city","田澍","2021","chi","Book","PrintBook","Di 1 ban",1,"人民出版社","Beijing Shi","Lanzhou Shi (China) History,China History 1949-,Chine Histoire 1949-,China,China Lanzhou Shi,History,Since 1949","本卷书稿主要考察了中华人民共和国成立以来兰州地区的历史.书稿分""建立和巩固新生人民政权时期""""社会主义制度确立时期""""全面建设社会主义时期""""'文化大革命'时期""""拨乱反正与历史转折时期""""建设中国特色社会主义新时期""几个阶段, 考察了兰州新中国成立以来在政治, 经济, 文化, 风俗, 民族团结, 生态建设等方面不断发展进步的历史.作者认为, 兰州市以恢宏的气势, 巨大的成就, 默默的奉献, 深远的影响而铭刻青史.兰州对维护西北地区的民族团结, 国防安全, 人民福祉具有举足轻重的作用","否"
"1267585799","9787010234403,701023440X","蘭州通史. 民国卷 = Genearl history of Lanzhou city","田澍","2021","chi","Book","PrintBook","Di 1 ban",1,"人民出版社","Beijing Shi","Lanzhou Shi (China) History,China History Republic, 1912-1949,Chine Histoire 1912-1949 (République),China,China Lanzhou Shi,History,1912-1949","本卷主要考察民国时期兰州地区的历史.作者认为, 民国时期兰州的发展是整个中国西部城市发展的一个缩影, 传统与现代交织, 救亡与建设并存, 进步与落后共生, 发展因时, 因人, 因事的影响较大, 缺乏制度治理和长期规划.由于北洋政府和国民政府自身的制度局限性和战争环境的影响, 民国时期兰州开发建设带有很强的军事性, 政府主导性和短暂性特征.当战事吃紧之时, 政府将兰州看作战略重点, 着力加以经营, 强力推行其政策和措施, 成效显著.而当抗战胜利后, 国民政府还都南京, 企业东返, 后方大量人员回迁, 兰州建设就陷入困境.中国共产党在民国时期一直活跃在兰州地区, 把马克思主义和共产党的方针, 政策等宣达于兰州, 对激发兰州人民的爱国斗志起到了重要的作用, 为兰州最终回到新生的人民政权奠定了基础","否"
"1108654241","9787210112501,7210112502","民国江西编年史纪","朱寅健","2019","chi","Book","PrintBook","Di 1 ban",2,"江西人民出版社","Nanchang Shi","Jiangxi Sheng (China) History 20th century Chronology,China History Republic, 1912-1949 Chronology,Jiangxi (Chine) Histoire 20e siècle Chronologie,Chine Histoire 1912-1949 (République) Chronologie,China,China Jiangxi Sheng,Chronology,chronologies (lists),Chronologies,History,1900-1999","该书以""中华民国史.大事记""""中华民国史事日志""""江西省大事记""""江西苏区大事纪略""等大事记类著作和""江西通史.民国卷""""江西经济史""""江西文学史""""江西艺术史""""赣文化通典""等专门研究江西历史的学术论著以及""中华民国史档案资料汇编""""江西革命历史文件汇集""""辛亥革命前十年间民变档案史料""""南京临时政府遗存珍档""等专题史料汇编为依据, 分正文和附录两个部分, 以年系月, 以月系日, 收录了民国时期江西所发","否"
"1104700279","9787010206400,7010206406","治史清源 : 王锺翰先生学术论著自选集","王锺翰, author","2019","chi","Book","PrintBook","Di 1 ban",1,"人民出版社","Beijing","Manchus History,Mandchous Histoire,Man zu Min zu li shi Wen ji,Gu dai shi Zhong guo Qing dai Wen ji,Manchus,Qing Dynasty (China),China History Qing dynasty, 1644-1912,Chine Histoire 1644-1912 (Dynastie des Qing),China,History,1644-1912","该本书是中央民族大学'双一流'学术精品资助项目.王锺翰(1913-2007)是我国当代清史, 满族史学泰斗, 历任中央民族大学历史系及民族史研究所教授, 博士生导师, 终身教授, 兼任历史系名誉主任, 满学研究所所长, 中国社会科学院民族研究所兼职研究员, 北京市历史学会顾问和中国民族史学会顾问.本书收集王锺翰先生1998年自选的具有学术代表性的21篇文章, 分为上下两编.上编, 为民族史研究, 选收了9篇文章, 另附满","否"
"1227915503","9787224132038,7224132039","中国古代祈雨史 = A history of ancient China's rain-praying","臧志攀, author","2019","chi","Book","PrintBook","Di 1 ban",2,"陕西人民出版社","Xi'an","Rain-making rites China History,Droughts China History,Pluie Rites et cérémonies Chine Histoire,Sécheresses Chine Histoire,Droughts,Rain-making rites,China Religious life and customs,China,History","中国五千年文化源远流长, ""祈雨""古俗及其文学书写乃是天幕中一丛耀人眼目的星辰.祈雨是中国古代重要的祭祀祈年活动, 古典文献中存留着数量可观的祈雨文, 它们涉及宗教, 礼制, 民俗, 为我们了解古代文化, 社会生活提供了一面直观的镜子, 于文学而言, 也是一个重要的组成部分.考察中国祈雨史, 必须将它与整个中国古代文明联系在一起, 甚至可以毫不夸张地说, 一部中国古代祈雨史, 同时也就是一部中国古代社会文明史的缩影.虽然学术界对祈雨这一民俗现象已经有较多的关注, 也取得了一些研究成果, 但本书作者试图以史的框架对历代祈雨文献进行有序梳理, 运用多元思维对祈雨文化进行建构.此研究在国内尚属首次","否"
"1312225946","9787214260192,7214260190","中国哲学通史 : 学术版. 现代卷 = A history of Chinese philosophy","胡治洪, 1954- author","2021","chi","Book","PrintBook","Di 1 ban",1,"江苏人民出版社","Nanjing Shi","Philosophy, Chinese 20th century,Philosophy, Chinese,1900-1999","","否"
"1337575131","9787010246659,7010246653","中国历史上的人口增长与经济的长期演进研究 = the studies on the population growth and the long-term economic evolution in Chinese history","豆建春, author","2022","chi","Book","PrintBook","Di 1 ban",1,"人民出版社","Beijing","Economic development China,Développement économique Chine,Economic development,Population,China Population,China","相对于西方世界,古代中国在经济上的成功实际上是一种总量上的繁荣,以人均收入衡量的经济发展水平与世界其他文明地区相差无几.这种规模上的优势得益于中华帝国庞大的人口.同时,过多的人口也被认为是妨碍传统中国向现代经济转型的一个重要因素.该书稿即是对影响传统中国人口增长的一些因素及其长期效应的经济学分析.首先,通过东,西方(中国与欧洲)两大文明历史人口增长的比较,中国南方与北方人口史的比较,""两稅法""前后中国人口增长与经济增长的比较,东,西方人口增长与经济增长的综合性比较,突出中国历史人口增长中的几个特征.然后,应用现代经济学理论和分析方法,结合人口史,经济史,社会史与科技史的最新研究成果,深入分析了自然地理环境,中国历史上的技术进步,土地分配制度以及稅制变革通过人口增长对中国传统经济的演进产生的长期影响","否"
"1241664037","9787010218908,7010218900","夏商西周散文传播研究 : 基于先秦文献的考察","王浩, 1982 November- author","2020","chi","Book","PrintBook","Di 1 ban",1,"人民出版社","Beijing Shi","Chinese essays To 221 B.C. History and criticism,Essais chinois Jusqu'à 221 av. J.-C. Histoire et critique,Chinese essays,Criticism, interpretation, etc,To 221 B.C","","否"
"1156631198","9787010211817,7010211817","中国出版家. 黄洛峰 = Zhongguo chubanjia. Huang Luofeng","汪耀华 (Editor), author","2020","chi","Book","PrintBook","Di 1 ban",1,"人民出版社","Beijing Shi","Huang, Luofeng, 1909-1980,Publishers and publishing China Biography,Publishers and publishing,China,Biography,Biographies","","否"
"1141102856","9787203111597,7203111598","近代中国分省人文地理影像采集与研究. 西藏 = The collection and research of human geography images in modern China. Tibet","""近代中国分省人文地理影像采集与研究""编委会","2019","chi","Book","PrintBook","Di 1 ban",1,"山西人民出版社","Taiyuan Shi","Human geography China Tibet Autonomous Region,Human geography,Manners and customs,Travel,Tibet Autonomous Region (China) Description and travel,Tibet Autonomous Region (China) Social life and customs,Région autonome du Tibet (Chine) Descriptions et voyages,Région autonome du Tibet (Chine) Mœurs et coutumes,China Tibet Autonomous Region","","否"
"1338022991","9787214258618,7214258617","中国哲学通史 : 学术版. 明代卷 = A history of Chinese philosophy","丁为祥, 1957- author","2022","chi","Book","PrintBook","Di 1 ban",1,"江苏人民出版社","Nanjing","Philosophy, Chinese 960-1644,Philosophie chinoise 960-1644,Philosophy, Chinese,960-1644","宋明理学是中国传统哲学发展的高峰,但在宋明之间,又存在着""得君行道""与""觉民行道""的不同追求.之所以会形成这一差别,主要是由宋明两代不同的政治生态造成的.宋代皇室尊士,前越汉唐,后逾明清,因而宋代士人也就形成了一种以天下为己任的精神,表现在理论上,这就成为朱子的天理本体论体系.本书为国家基金项目""中国哲学通史""明代卷.书稿从肩负""道统之传""的曹端到提倡""诚意慎独之学""的刘宗周,全面梳理了明代哲学的发展脉络","否"
"1097610272","9787545817799,7545817796","海派映照下的江南人物","熊月之, author","2019","chi","Book","PrintBook","Di 1 ban",2,"上海人民出版社 : 上海書店出版社","Shanghai","Celebrities China, Southeast Biography,Célébrités Chine (Sud-Est) Biographies,Hai pai wen hua Wen hua yan jiu,Ren wu yan jiu Zhong guo Jin dai,Celebrities,Civilization,China, Southeast Civilization,Shanghai (China) Civilization,Chine (Sud-Est) Civilisation,China Shanghai,Southeast China,Biography,Biographies","本书为著名史学家熊月之对江南文化, 海派文化视野下江南地区著名人士在近现代进程中的历史活动, 生平业绩所做的专题研究.江南文化是海派文化的根基, 海派文化是近代上海对于江南文化的熔铸与升华.本书集中阐述海派文化, 江南文化的社会渊源与精神脉络, 并通过近现代二十余位成长, 生活在江南地区的名人事迹考述, 思想解析, 集中呈现海派文化与江南文化交融汇聚之下, 崇实, 重商, 重民, 精致, 开放, 灵活等中国传统文化滋长出来的现代性因素, 对于江南人物的影响, 及其各具特色的历史行动与精神风范","否"
"1314916795","9787218112978,7218112978","孫文全集 = Sunwen quanji","孫逸仙, 1866-1925 author","2021","chi","Book","PrintBook","Di 1 ban",1,"广东人民出版社","Guangzhou Shi","Sun, Yat-sen, 1866-1925","","否"
"1374052451","9787220127625,7220127626","被牺牲的""局部"" : 淮北社会生态变迁研究(1680-1949) 修订本","马俊亚, author","2023","chi","Book","PrintBook","Di 1 ban",1,"四川人民出版社","Chengdu Shi","Social ecology China North China Plain History,Human ecology China North China Plain History,Rivers China Regulation History,Environmental degradation China North China Plain History,Floods China North China Plain History,Cours d'eau Chine Régularisation Histoire,North China Plain (China) Social conditions,North China Plain (China) Environmental conditions,North China Plain (China) Economic conditions,China Economic policy 1644-1912,China Economic policy 1912-1949,Chine Politique économique 1644-1912,Chine Politique économique 1912-1949","本书是一部关于明清环境史,政治史的研究专著.本书结合历史文献资料和作者多年来所作的田野调查,对明清以来淮北社会生态变迁的历程及其原因进行了深入探讨;分析了治水,漕运和盐务等政策对淮北的地理,河道,水文,物产,民性及经济结构与社会结构等的塑造乃至扭曲作用.作者认为淮北地区之所以从唐宋时代的鱼米之乡演变为穷乡瘠壤,主要是来自于当时的政策影响","否"
