"oclc编号 - oclcNumber","书号 - isbns","书名 - title","作者 - creator","出版日期 - publicationDate","语言 - catalogingLanguage","格式 - generalFormat","详细格式 - specificFormat","版本 - edition","总版本数 - totalEditions","出版社 - publisher","出版地 - publicationPlace","主题 - subjects","简介 - summaries","是否同行审阅 - peerReviewed"
"1336342465","9787201175751,7201175750","我们为什么必须走中国特色社会主义道路 : 答关于中国道路的十大疑问","陈学明.","2021","chi","Book","PrintBook","Di 2 ban",3,"天津人民出版社","Tianjin","Zhong guo te se she hui zhu yi She hui zhu yi jian she mo shi Yan jiu","本书运用马克思主义,特别是当代中国马克思主义的立场,观点和方法直面产生于不同时期,不同人群的对中国特色社会主义道路的种种指责和怀疑,分析其缘起的背景,指出其片面性所在,揭示其错误的根源,破除其似是而非的迷雾.正是通过这样的回击和解惑,中国特色社会主义道路的合理性与合法性清晰地展现在我们面前,与此同时,对这条道路的自信心也油然而生","否"
"1198222339","9787010213163,9787010213163,701021316X","晚清民初教育史论稿","凌興珍, (1965- ), 著","2019","chi","Book","PrintBook","Di 1 ban",1,"人民出版社","Bei jing","Jiao yu Zhong guo Wan qing(1840-1911),Jiao yu Zhong guo Min guo(1912- ),Jiao yu shi,Jiao yu shi Yan jiu Zhong guo Jindai","晚清民初教育史問題浩如煙海, <晚清民初教育史論稿>無意全面論述, 僅選取了清末的師範教育, 清末民初的教育變革, 清末民初的教會師範教育, 民國初期的學生資助問題, 南京國民政府時期的邊疆教育五個專題中的一些典型性史事, 校例或方面作探討, 希圖通過對這些史事, 校例或方面的探討, 從側面揭示晚清民初教育歷史發展的部分面相, 演進規律和實踐經驗, 以增進人們對近代學校制度引進中國以來的教育歷史的認知和瞭解, 並為今天教育發展與改革提供一些歷史鏡鑒材料","否"
"1375139979","9787208175921,7208175926","民主的危机 = Crises of democracy","普沃斯基 (Przeworski, Adam)","2022","chi","Book","PrintBook","Di 1 ban",2,"上海人民出版社","Shanghai","Min zhu Yan jiu Xi fang guo jia","本书中,亚当·普沃斯基定义了""民主的危机"",并分析和探讨了为什么许多西方民主国家现在都面临着""民主的危机"".作者认为,当前西方民主国家面临的威胁不仅局限于政治层面,而是全面根植于政治,经济,社会和文化环境中,社会的两极分化,极右翼政党的兴起,收入不平等和收入停滞等是导致西方民主衰退的根源","否"
"1294540333","9787208172609,7208172609","个人信息保护案例评析 = Case comment on the protection of personal information","曹博.","2021","chi","Book","PrintBook","Di 1 ban",2,"上海人民出版社","Shanghai","Ge ren xin xi Fa lü bao hu An li Zhong guo","本书立足于典型案例,聚焦个人信息的客体特征和权利属性,归纳裁判倾向,把握理论源流,梳理域外经验,探明法律争议,塑造实用理论,以期深化对个人信息基本概念的理解和认知,寻找个人信息保护制度规范的改进空间","否"
"1375145553","9787213107368,7213107364","稻盛和夫的人生哲学","北康利 (196012-)","2022","chi","Book","PrintBook","Di 1 ban",4,"浙江人民出版社","Hang zhou","Dao sheng he fu (1932-2022) Ren sheng zhe xue","本书展现稻盛和夫的人生历程,剖析稻盛和夫的传奇经历,逐一讲述稻盛和夫一生的重要事件.从稻盛和夫的出生背景,家庭教育到邂逅精密陶瓷,从与朝子结婚到带领京瓷走向世界,从成立第二电到重建日航.描述了稻盛和夫的人生哲学,始终将""作为人,何谓正确""作为第一判断基准,胸怀""利他之心"",一心一意""极度认真地""生活","否"
"1178864608","9787213094262,7213094262","AI的25种可能 : 世界顶尖思想家对于人工智能未来的想象 = Possible minds","布罗克曼 (Brockman, John)","2019","chi","Book","PrintBook","Di 1 ban",1,"浙江人民出版社","Hang zhou","Ren gong zhi neng Yan jiu","本书作者组织了25位在人工智能领域额最有影响力的科学家,请他们谈一下他们心目中的人工智能,并进行了收录","否"
"1375143757","9787208176430,7208176434","文化的世界史 : 一种文化社会学阐释 = Kulturgeschichte als Kultursoziologie","韦伯 Weber,Alfred 1868-1958","2022","chi","Book","PrintBook","Di 1 ban",1,"上海人民出版社","Shanghai","Wen hua she hui xue Yan jiu Shi jie,Wen hua shi Yan jiu Shi jie","本书作者致力于从文化社会学的角度考察不同文化的历史,对世界文化的变迁做出历史哲学层面的解释,也即解释各个文化在其本身的成长和发展区域中的本质和真实情况.他将文化的发展分为不同层级和阶段,完整描绘了从原始文化到古典文化,再到亚洲,欧洲等发达文化,直至现代文化的人类历程.他将文化放归其原生土壤,强调人的自发性创造对历史的推动作用","否"
"1336347622","9787214257406,7214257408","毛福轩 蔡寿民传","徐文奇.","2021","chi","Book","PrintBook","Di 1 ban",2,"江苏人民出版社","Nanjing","Mao fu xuan (1897-1933) Chuan ji,Cai shou min (1899-1934) Chuan ji","本书为烈士毛福轩,蔡寿民的合传.两位传主都出生在中国湖南省,他们的故事带有那个时代牺牲的烈士的共性,也有自己个人历程的独特性,他们都为共产主义事业贡献了宝贵的生命","否"
"1178858783","9787509911273,7509911273","建设社会主义法治国家","陈一新","2019","chi","Book","PrintBook","Di 1 ban",1,"党建读物出版社人民出版社","Beijing","She hui zhu yi fa zhi Jian she Gan bu jiao yu Zhong guo Jiao cai","本书共八章,内容包括建设社会主义现代化法治强国,全面依法治国的总目标,加强宪法实施和监督,维护宪法权威,完善法律体系,推进良法善治,深化行政改革,建设法治政府,深化司法改革,提高司法公信力等","否"
"1112279340","9787221149503,722114950X","山之民","林贤治.","2019","chi","Book","PrintBook","Di 1 ban",1,"贵州人民出版社","Guiyang","Sui bi Zuo pin ji Zhong guo Dangdai","本书收录了<人间鲁迅>一书的节选内容,<沉思与反抗><一个人的爱与死><五四之魂>等林贤治代表作的自序,后记,以及<论散文精神><关于""思想者文学""><关于""底层文学"">等文学评论作品","否"
"1126337445","9787010212180,701021218X","中国协商民主体系及其运行机制研究 = Consultative democracy in China : system and mechanisms","孙照红, author","2019","chi","Book","PrintBook","Di 1 ban",1,"人民出版社","Beijing Shi","Deliberative democracy China,Political participation China,Démocratie délibérative Chine,Participation politique Chine,Deliberative democracy,Political participation,Politics and government,China Politics and government 2002-,China,Since 2002","中国共产党第十九次全国代表大会报告将协商民主进一步定位为实现党的领导的重要方式, 再次从坚持和完善党的领导的高度为协商民主提供价值合法性根据;协商民主是中国共产党治国理政的重要民主形式, 运用协商民主解决好与群众切身利益相关的实际问题, 有利于推进党的建设科学化和国家治理体系, 治理能力的现代化.新时代的中国道路, 需要系统认识和充分发挥协商民主的价值功能和时代意义, 需要从协商民主作为一种民主形式, 一种治理方式和一种转型机制的角度来加深协商民主在治国理政全过程中的理论定位, 进一步增强协商民主制度建设的政治性, 科学性, 有效性, 运用协商民主工作机制来提升党的执政能力和治理效能.本书以党的全国代表大会精神为指导, 探讨了党的十八大以来我国社会主义协商民主体系的发展状况, 分析了我国协商民主的本质和意义, 协商民主的七种形式:政党协商, 人大协商, 政协协商, 政府协商, 基层协商, 人民团体协商, 社会组织协商, 在深入论证这七种协商形式的基础上, 结合丰富案例, 对中国各地在改革实践中探索和创新出来的民主恳谈会, 民主听证会, 乡村论坛, 社区论坛等协商民主案例, 进行了深度的分析和客观的点评, 现实性, 针对性非常强, 具有一定的理论意义和现实意义","否"
"oclc编号 - oclcNumber","书号 - isbns","书名 - title","作者 - creator","出版日期 - publicationDate","语言 - catalogingLanguage","格式 - generalFormat","详细格式 - specificFormat","版本 - edition","总版本数 - totalEditions","出版社 - publisher","出版地 - publicationPlace","主题 - subjects","简介 - summaries","是否同行审阅 - peerReviewed"
"1178960419","9787208157156,7208157154","荀子解读 : 人生修养的儒家宝典","魏承思.","2019","chi","Book","PrintBook","Di 1 ban",2,"上海人民出版社","Shanghai","< xun zi> Yan jiu,Ru jia","本书分为十讲,包括:荀子论儒家理想人格,荀子论学,荀子论修身,荀子论思想修养,荀子的社会观,荀子的治国蓝图,荀子论治国之道等","否"
"1178865145","9787208153981,7208153981","社会民主主义的基础","贡贝特 (Gombert, Tobias)","2019","chi","Book","PrintBook","Di 1 ban",1,"上海人民出版社","Shanghai","She hui min zhu zhu yi Yan jiu","本书探寻的是,社会民主主义在2l世纪有着什么样的意义;它以哪些价值为基础;它追寻哪些目标以及如何才能够落实这些目标","否"
"1178815106","9787201143286,720114328X","历史的面孔 : 古代中国的生存路径与人性解读 = Faces of history","宗承灏.","2019","chi","Book","PrintBook","Di 1 ban",1,"天津人民出版社","Tianjin","Li shi ren wu Ren wu yan jiu Zhong guo Gudai Tong su du wu","本书共分3辑,内容包括:变法者的春梦----成于霸道,败于霸道;英雄者的命运----风波亭外的玄机;爱国者的视野----钦差大臣与西方世界的交锋等","否"
"1336373373","9787205103910,7205103916","荣与辱 : 曾国藩的多面人生","董蔡时.","2022","chi","Book","PrintBook","Di 1 ban",1,"辽宁人民出版社","Shenyang","Ceng guo fan (1811-1872) Ren wu yan jiu,Zheng zhi jia Ren wu yan jiu Zhong guo Jindai","本书作者董蔡时先生致力于中国近代史研究,对曾国藩和他所在的时代有深入的研究,资料搜集完整,客观是本书的特点,也是优势.曾国藩是湘军的头领,是中国近代史上第一个军阀.他一生逆流而动,镇压了反封建,反侵略的太平天国革命,捻军,办理天津教案时,影响到民族荣辱,国家的安危.这个人的是非功罪,值得深入研究.作者对曾国藩的""评"",与近些年市面同类书有所不同,他将曾国藩本人的书信,奏折等资料与当时的官方资料,文人笔记等做比较,得出曾国藩""伪君子,伪道学""""善于权谋""""善于搞派系斗争""等人格特征.这样的评价虽与近些年相关题材的畅销书对曾国藩的评价有出入,但是以史料为证,令人信服","否"
"1243222659","9787201163413,7201163418","完美嫌疑人","陈研一.","2020","chi","Book","PrintBook","Di 1 ban",1,"天津人民出版社","Tianjin","Fan zui xiao shuo Zhong guo Xiandai","Ben shu jiang shu xing gang shi er tong shi zong an pin fa,Hai zi men shi zong shi jun shen chuan hong se wai tao,Xiao shi yu jian kong mi bu de gong gong chang he,Xian chang liu you a la bo shu zi bian hao.Chu ci zhi wai,Mei you si hao po zhan.Xing zhen dui zhang zhang yi ming yi chou mo zhan,Xiang qian da dang,Xing gang jing jie chuan qi zhong ning qiu zhu.Zhong ning fu yi jie shou,Bian fa xian suo you xian suo dou wan mei zhi xiang zi ji xiang jiao duo nian,Jing zhong you jia de en ren nao wai ke zhuan jia liao bo yan.Liao bo yan tan ran yao qing zhong ning diao cha zi ji,Shen zhi jiang""zuo an dong ji""he pan tuo chu.Zhei shi yi chang yin mou,Hai shi yi ge xian jing?Bei hou shi fou zang zhe shen me bu wei ren zhi de mi mi?","否"
"1336374950","9787222205369,7222205365","景颇族史话","张建云.","2021","chi","Book","PrintBook","Di 1 ban",2,"云南人民出版社","Kunming","Jing po zu Min zu li shi Yun nan","本书共八章,内容包括:景颇族族源与迁徙路线,景颇族地域分布与人口分布现状,景颇族的历史文化,景颇族社会经济发展概况,景颇族家庭婚姻发展变化情况,景颇族的宗教信仰概况,景颇族历史文化名人,景颇族未来发展展望","否"
"1178832438","9787209121057,7209121056","城市基层社区治理新探","苏爱萍.","2019","chi","Book","PrintBook","Di 1 ban",1,"山东人民出版社","Jinan","Cheng shi She qu guan li Yan jiu Zhong guo","本书以习近平新时代中国特色社会主义思想和最新基层社区治理讲话与党的十九大精神为指导,深入诠释了新时代我国城市基层社区治理新格局的时代背景,丰富内涵和重大意义,重点阐述了政府治理和社会调节,居民自治良性互动的社区治理新格局以及政府与居民委员会,社会组织之间的新型社会关系;并以案例和第一手资料,概括了全国各地尤其山东省城市基层社区治理的新理念新探索新经验.在理论分析的基础上结合个案调研,对省内外城市社区自治现状有深入了解,并对其得失有所判断.综合现代政治学理论诠释新型自治格局,注重历史维度的探讨,分析我国城市社区变迁和体制建设.此外,分析了新时代城市基层社区治理的发展趋势和存在的问题及其对策建议","否"
"1178922578","9787010210308,7010210306","从生物人到社会人 : 道德实践的人性基础研究 = From an animal man to a social man","戴贝钰 女, 1989-.","2019","chi","Book","PrintBook","Di 1 ban",1,"人民出版社","Beijing","She hui ren lei xue Yan jiu","本书从个体行为与社会行为的双重维度对人性问题进行研究,通过对人性进行马克思主义视角的揭示阐释人的行为的社会发生机制.本书旨在通过对道德的人性基础的研究,探究人从生物人跃迁成为社会人的生理基础,论证劳动实践在人的社会化进程中的重要作用","否"
"1178938036","9787203109815,720310981X","近代中国分省人文地理影像采集与研究 = The collection and research of human geography images in modern China / 内蒙古Inner Mongolia",,"2019","chi","Book","PrintBook","Di 1 ban",2,"山西人民出版社","Taiyuan","Ren wen di li Yan jiu Zhong guo Jindai,Ren wen di li Yan jiu Nei meng gu Jindai","本书从内蒙古地域特色出发,最大程度反映了该区域的地理,历史及社会生活状态.内文细分为""风光·名胜""""城市·乡村""""民俗·宗教""""生活·百业""四个大的章节","否"
"1375141381","9787556128297,7556128296","我之为我,只在异人处 : 众说木心","夏春锦","2022","chi","Book","PrintBook","Di 1 ban",1,"湖南人民出版社有限责任公司","Zhangsha","Zuo jia Ren wu yan jiu Zhong guo Xiandai,Wen yi ping lun Zhong guo Xiandai Wen ji,Mu xin(1927-2011)","本书第一辑收入对木心生平往事的回忆与解说,第二辑收入孙郁,李静等人对木心的综合性评述,第三,四辑收入对木心具体作品的学术性评论,第五辑收入对其画作与音乐作品的解析,第六辑收入关于木心纪念馆与美术馆的篇什","否"
"1336387344","9787010232379,7010232377","道路自信 : 中国特色社会主义道路的历史根基","何霜梅.","2021","chi","Book","PrintBook","Di 1 ban",1,"人民出版社","Beijing","Zhong guo te se she hui zhu yi She hui zhu yi jian she mo shi Yan jiu","本书着眼于中国特色社会主义道路的历史根基,以马克思主义中国化为主线,紧紧围绕中国特色社会主义道路""何以自信""这一主题,介绍了中国特色社会主义道路自信研究的现实意义,中国特色社会主义道路的发展历程,重点阐述了中国特色社会主义道路的历史必然性,特色和优势,实现路径,世界历史意义,分析了马克思主义中国化和中国特色社会主义道路之间的内在关系","否"
"1294612162","9787010232201,7010232202","我国社会保障城乡一体化制度创新研究","汪宗田.","2021","chi","Book","PrintBook","Di 1 ban",1,"人民出版社","Beijing","Cheng xiang yi ti hua She hui bao zhang zhi du Yan jiu Zhong guo","本书按照理论梳理,比较借鉴,历史分析,调查研究,综合分析,对策研究的思路展开我国社会保障制度城乡一体化研究.本书梳理了马克思主义,西方社会保障城乡一体化思想理论,比较借鉴了德国,韩国和俄罗斯社会保障制度建设经验教训,总结了我国城乡社会保障建设的历史经验和教训,提出我国社会保障城乡一体化制度创新理念,原则,目标和路径的总体构想以及对策措施,并对湖北省农村社会保障状况进行了调查研究,提出有针对性的对策和建议","否"
"1375131897","9787211088676,7211088672","中国经史关系通史 / 清代民国卷","汪高鑫","2022","chi","Book","PrintBook","Di 1 ban",1,"福建人民出版社","Fu zhou","Jing xue Guan xi Shi xue Zhong guo,Jing xue Guan xi Shi xue Zhong guo Qingdai,Jing xue Guan xi Shi xue Zhong guo Minguo","本书从学术发展的内在理路和社会存在的制约作用两个方面进行观照,纵向考察经史关系的演变发展过程,横向分析经史关系的纠结及其对当时学术观念的影响,以揭示传统经史之学的意蕴,本质以及由传统进入近代以后学术发展的真实面相","否"
"1135921043","9787010199153,7010199159","新时代中国特色社会主义发展战略","李海涛","2019","chi","Book","PrintBook","Di 1 ban",1,"人民出版社","Beijing","Zhong guo te se she hui zhu yi Fa zhan zhan lüe Yan jiu","本书以习近平新时代中国特色社会主义思想为指导,全面贯彻党的十九大精神,坚持理论与实践的统一,坚持历史与逻辑的统一,紧紧围绕新时代中国特色社会主义发展战略这一基本问题,全面阐述以习近平同志为核心的党中央在新时代坚持和发展中国特色社会主义的战略谋划和决策部署","否"
"1262745813","9787010183985,7010183988","新中国民族关系的回顾与前瞻 = The relations among ethnic groups in China","李俊清.","2021","chi","Book","PrintBook","Di 1 ban",1,"人民出版社","Beijing","Min zu guan xi Yan jiu Zhong guo","本书以云南跨境民族为例,探讨了跨境民族的宗教认同与国家安全的关系.内容包括:中国的民族与民族关系,民族区域自治制度的创立,保护少数民族利益的制度与行动,""文革""时期民族关系的曲折发展,民族区域自治制度的法制化等","否"
"1178930088","9787010216461,7010216460","中国社会保障改革与发展报告 = Reform and development of social security report / 2018 2018","邓大松.","2020","chi","Book","PrintBook","Di 1 ban",1,"人民出版社","Beijing","She hui bao zhang ti zhi Ti zhi gai ge Yan jiu bao gao Zhong guo 2018,She hui bao zhang Fa zhan zhan lüe Yan jiu bao gao Zhong guo 2018","本书内容包括九个部分,分别是:社会保障制度40年发展历程与未来展望,城镇职工基本养老保险财务可持续性研究,城乡居民基本养老保险公共财政支出规模预测,中国医疗保障制度的发展及其保障效果评估,退役军人管理保障研究等","否"
"1336355899","9787208174672,7208174679","静悄悄的革命 : 西方民众变动中的价值与政治方式 = The silent revolution","英格尔哈特 Inglehart, Ronald 1934-.","2022","chi","Book","PrintBook","Di 1 ban",2,"上海人民出版社","Shanghai","Ren sheng guan Yan jiu Xi fang guo jia","本书作者通过对英国,法国,联邦德国,意大利,荷兰,比利时等6个国家的调查,率先指出了西方发达工业社会中民众价值观的重大代际转变,从而开辟了一片新的研究领域,即""物质主义""价值观向""后物质主义""价值观转型的研究领域.英格尔哈特认为,这一价值观转型是一场更为广泛的文化转型的组成部分,而且这场文化转型正在逐步改造这些社会的政治生态","否"
"1294574995","9787220124440,7220124449","财德仁心永留传 : 财富传承智慧","潘席龙","2021","chi","Book","PrintBook","Di 1 ban",1,"四川人民出版社","Chengdou","Zhong nian ren Cai wu guan li,Lao nian ren Cai wu guan li","本书是""国民金融教育之中老年五德财商智慧丛书""之四,主要针对中老年人物质与精神财富的传承问题,包括民法典中对继承问题的规定,遗嘱的订立,修改和执行,以及如何防止子女不孝,如何在不同继承人之间做好平衡,如何防止""败家子""等社会现象和问题","否"
"1336343858","9787208174351,7208174350","大城数治 : 上海超大城市社区治理数字化研究","张锋.","2021","chi","Book","PrintBook","Di 1 ban",1,"上海人民出版社","Shanghai","Cheng shi She qu guan li Shu zi hua Yan jiu Shang hai","本书在进行社区治理数字化文献研究的基础上,以上海各区的重点街镇和居村调研结果为材料,梳理出当前上海超大城市社区治理数字化的基本情况,主要问题,典型案例,进一步提出了上海超大城市社区治理数字化的理论逻辑,功能机制,实证考察,影响因素和路径建构","否"
"1178925626","9787203109853,7203109852","近代中国分省人文地理影像采集与研究 = The collection and research of human geography images in modern China / 云南Yunnan",,"2019","chi","Book","PrintBook","Di 1 ban",1,"山西人民出版社","Taiyuan","Ren wen di li Yan jiu Zhong guo Jindai,Ren wen di li Yan jiu Yun nan Jindai","本书从云南地域特色出发,反映了该区域的地理,历史及社会生活状态.全书分为""风光·名胜""""城市·乡村""""民俗·宗教""""生活·百业""四大章节,从时代,地域,专题三个维度进行历史影像的呈现","否"
"1336362431","9787222202566,7222202560","峡谷骄子的战歌","罗世保 (1954-)","2021","chi","Book","PrintBook","Di 1 ban",1,"云南人民出版社","Kunming","Bao gao wen xue Zhong guo Dangdai,Li su zu Min zu di qu Fu pin Gong zuo gai kuang Yun nan","本书为纪实类长篇报告文学,记录了傈僳族从贫穷落后到富裕文明的历程.全书分为""三江园里傈傈情""""傈僳族汉子的斗志""""书写文明的影像""""怒江的路""""决不让一个民族掉队""五章","否"
"1178928521","9787203109860,7203109860","近代中国分省人文地理影像采集与研究 = The collection and research of human geography images in modern China / 河南Henan",,"2019","chi","Book","PrintBook","Di 1 ban",1,"山西人民出版社","Taiyuan","Ren wen di li Yan jiu Zhong guo Jindai,Ren wen di li Yan jiu He nan Jindai","本书从近代中国人文地理角度出发,精选历史影像,由地理学,历史学及影像学,翻译学等方面专家协同,对这些影像资料进行研究考证.本卷为河南卷,从河南地域特色出发,最大程度反映了该区域的地理,历史及社会生活状态.内文细分为""生活·百业""""民俗·宗教""""城市·乡村""""风光·名胜""四个大的章节板块","否"
"1178921852","9787208160965,7208160961","国外社会保障制度典例","黄安余 (196312-)","2020","chi","Book","PrintBook","Di 1 ban",1,"上海人民出版社","Shanghai","She hui bao zhang zhi du Guo wai","本书涉及主要国家社会保障制度建立的背景,制度结构,以及改革与发展的基本情况,再将主要国家的社会保障制度模式进行分类与比较,在此基础上,对我国社会保障制度改革与发展提出建议与设想","否"
"1178943840","9787208159730,7208159734","从涂尔干到莫斯 : 法国社会学派的总体主义哲学","谢晶.","2019","chi","Book","PrintBook","Di 1 ban",1,"上海人民出版社","Shanghai","Fa guo she hui xue pai Yan jiu","本书采用社会哲学的视角,旨在证明法国社会学派具有坚实的哲学内核,并呈现这一内核渐渐完善自身的过程:从涂尔干到莫斯,一种总体主义的立场渐渐摆脱了有机主义与实体主义的束缚,并最终实现了向着结构本体论的转型.通过细究这一转型,本书不仅希望澄清""社会总体""这一复杂概念,而且也希望呈现法国社会学的批判维度:""总体""不仅是涂尔干与莫斯用来反驳个体主义方法论的理论工具,更是他们用来分析现代性并指出其弊病的策略","否"
"1336379131","9787205103583,7205103584","无障碍与残疾人社会融合","叶静漪.","2021","chi","Book","PrintBook","Di 1 ban",1,"辽宁人民出版社","Shenyang","Can ji ren She hui gong zuo Yan jiu Zhong guo","本书研究了无障碍与残疾人社会融合的理论基础,实现路径,实践探索和法治保障等问题,拓展了无障碍环境的社会价值,把无障碍环境的人文价值提升到一个新的高度","否"
