"oclc编号 - oclcNumber","书号 - isbns","书名 - title","作者 - creator","出版日期 - publicationDate","语言 - catalogingLanguage","格式 - generalFormat","详细格式 - specificFormat","版本 - edition","总版本数 - totalEditions","出版社 - publisher","出版地 - publicationPlace","主题 - subjects","简介 - summaries","是否同行审阅 - peerReviewed"
"1257287230","9787218147352,7218147356","民国粤人赴澳大利亚留学档案全述. 开平卷","粟明鲜, author","2021","chi","Book","PrintBook","Di 1 ban",2,"广东人民出版社","Guangzhou Shi","Chinese students Australia History Sources,Foreign study China Kaiping (Guangdong Sheng) History Sources,Education China History 1912-1949 Sources,Éducation Chine Histoire 1912-1949 Sources,Chinese students,Education,Foreign study,Australia,China,China Kaiping (Guangdong Sheng),History,Sources,1912-1949","中国向西方学习的留学潮,始于中国近代洋务运动时期.自那时起,广东尤其是珠江三角洲各市县,就一直是这一留学潮的领先者.澳大利亚政府所藏之档案资料显示,民国时期有不少中国人选择到澳大利亚自费留学,主要以珠江三角洲的广东人为主,而以香山(中山)县,新宁(台山)县,新会县和开平县最为集中.该书属""广东华侨史丛书""一种,主要是根据澳大利亚国家档案馆所藏之档案资料,将民国时期,主要是将北洋政府包括广州军政府时期及南京国民政府时期,广东省开平县青少年儿童赴澳留学的档案宗卷资料作一整理,并对其中的一些问题加以考证,编写成篇,对研究早期中外教育交流和大洋洲华侨华人生活状态,具有极为重要的史料价值","否"
"1381093494","9787227074182,7227074188","我是移民","马凤鸣著.","2020","chi","Book","Digital",,1,"宁夏人民出版社","Yinchuan","Electronic books","本书作者通过实地采访,以口述的形式讲述了闽宁镇移民的奋斗故事。这些移民背景不同,有各自的不易与艰辛,但是在中国共产党脱贫攻坚政策的指引下,易地搬迁至闽宁镇,通过努力奋斗,摆脱了贫困束缚。书中记录了移民的奋斗史,展现了他们建设新家园可歌可泣、波澜壮阔的故事,同时也向世人展示了闽宁镇扶贫模式所取得的巨大成就。","否"
"1295280432","","人生感悟","马道元, author","2020","chi","Book","Digital","Di 1 ban",1,"宁夏人民出版社","Yinchuan","","本书是作者的一部散文、诗歌作品集, 收录了作者多年来的文学创作, 有作者个人生活经历及感怀, 有游历祖国山川的感悟, 有对儿女家人教育思考及家风传承, 等等.作者文笔淳朴、真实, 语言平易近人, 情感真挚感人, 具有一定的可读性","否"
"1381093661","9787227072164,7227072169","人生感悟","马道元著.","2020","chi","Book","Digital",,1,"宁夏人民出版社","Yinchuan","Electronic books","本书是作者的一部散文、诗歌作品集,收录了作者多年来的文学创作,有作者个人生活经历及感怀,有游历祖国山川的感悟,有对儿女家人教育思考及家风传承,等等。作者文笔淳朴、真实,语言平易近人,情感真挚感人,具有一定的可读性。","否"
"1256383768","","古代宗族与社会结构史","冯尔康, author","2019","chi","Book","Digital","Di 1 ban",3,"天津人民出版社","Tianjin","Clans China History,Kinship China History,Social classes China History,Social structure China History,Clans Chine Histoire,Parenté Chine Histoire,Classes sociales Chine Histoire,Structure sociale Chine Histoire,Clans,Kinship,Social classes,Social structure,China,History","《古代宗族与社会结构史》所汇集的文章主要是关于中国古代社会史的，关注等级和社会形态等问题。通过社会形态和社会结构、古代宗族史、谱牒学·姓氏学、家族文化研究、中国古代史札记、古人的生养死葬这6个栏目，探讨了先秦至近代前期结构史、古代宗族史、谱牒史等内容。","否"
"1295275305","","出路","马慧娟, author","2021","chi","Book","Digital","Di 1 ban",3,"宁夏人民出版社","Yinchuan","","本书是一部讲述西海固妇女通过移民和自力更生找到生活出路的自传体小说.本书以作者马慧娟的个人经历为主线索, 讲述其从出生、上学、农田劳作、移民红寺堡、打工挣钱、文学创作, 一直到当选全国人大代表几十年的亲身经历、所听所见, 运用小说的艺术写法和表达技巧经过虚构、想象和加工, 将西海固贫困农民在党和国家的生态移民、脱贫富民等政策下, 通过自力更生实现脱贫致富的故事娓娓道来.该书旨在展现中国共产党带领广大人民群众决胜脱贫攻坚、全面推进乡村振兴和全面建成小康社会的奋斗历程, 为时代画像、为时代立传","否"
"1101490474","9787010194981,701019498X","民族历史的见证 : 特布信口述史","特布信, 1925-2010, author","2019","chi","Book","PrintBook","Di 1 ban",2,"人民出版社","Beijing","Töbšin, 1925-2010,Inner Mongolia (China) History,Mongolie-Intérieure (Chine) Histoire,China Inner Mongolia,History","本书为口述回忆录.述者特布信生于上世纪20年代, 经历了日伪统治, 解放战争和内蒙古自治区的成立和建设时期.早年留学日本, 开始接触马列主义, 回国后, 积极投身到民族解放和内蒙古民族区域自治运动之中, 参与内蒙古人民革命党东蒙本部的复建和东蒙古人民自治政府的成立, 并任内蒙古自治运动联合会执委委员, 兴安盟分会主任, 曾率领东蒙第一支群众工作团在兴安盟地区开展减租反霸斗争.内蒙古自治政府成立时任临时参议会驻会参议员.1949年率部赴内蒙古西部开辟工作, 为绥远和平解放做出一定贡献.之后历任乌盟政府秘书长, 第一副盟长, 内蒙古人民出版社社长, 内蒙古大学校长等职.口述史述及的内容既是一位过往者在追求国家解放, 民族昌盛的路途中个人所遭遇的起落沉浮, 也从这一视角还原了自治区成立至今七十余年的一段珍贵历史, 为后人保留了内蒙古近现代历史转折和发展时期的一些重要信息和史料","否"
"oclc编号 - oclcNumber","书号 - isbns","书名 - title","作者 - creator","出版日期 - publicationDate","语言 - catalogingLanguage","格式 - generalFormat","详细格式 - specificFormat","版本 - edition","总版本数 - totalEditions","出版社 - publisher","出版地 - publicationPlace","主题 - subjects","简介 - summaries","是否同行审阅 - peerReviewed"
"1202475516","","黎东方讲史. 细说民国创立","黎东方.","2019","chi","Book","Digital",,7,"上海人民出版社","Shanghai","","《黎东方讲史.细说民国创立》由旅美著名历史学家黎东方先生撰写. 它叙述了从孙中山创办兴中会至1912年民国成立期间的重要事件和重要人物. 作者黎东方以""讲史""的形式, 通俗而生动地讲述了孙中山领导的七次起义, ""苏报案"", 保路风潮, 武昌起义等历史事件, 以及孙中山, 黄兴, 陈天华, 秋瑾等历史人物. 全书既有生动的故事和真实的历史, 又有颇具见识的评点. 本丛书所采用的""细说体""既不像正史的艰深枯燥, 又不似野史的胡编乱造, 是别具风采的史学著作","否"
"1322041486","9787214259424,7214259427","国民政府审判日本战犯研究","严海建, author","2022","chi","Book","PrintBook","Di 1 ban",3,"江苏人民出版社","Nanjing Shi","War crime trials China History,War criminals Japan History,Trials (Crimes against humanity) China History,Sino-Japanese War, 1937-1945 Atrocities China History,Procès (Crimes contre l'humanité) Chine Histoire,Guerre sino-japonaise, 1937-1945 Atrocités Chine Histoire,Atrocities,Trials (Crimes against humanity),War crime trials,War criminals,China,Japan,History,1937-1945","","否"
"1124987040","9787010209753,7010209758","中国人口流动的云南样本 : 基于流动人口动态监测数据的分析报告","罗淳, author","2019","chi","Book","PrintBook","Di 1 ban",1,"人民出版社","Beijing","Migration, Internal China Yunnan Sheng History,Rural-urban migration China History,Rural-urban migration Social aspects China,Migration, Internal China History 20th century,Migration intérieure Chine Yunnan (Sheng) Histoire,Exode rural Chine Histoire,Exode rural Aspect social Chine,Migration intérieure Chine Histoire 20e siècle,Liu dong ren kou Dong tai jian ce Diao cha bao gao Yun nan,Migration, Internal,Population Economic aspects,Rural-urban migration,Rural-urban migration Social aspects,China Population Economic aspects,China,China Yunnan Sheng,History,1900-1999","本书是'中国流动人口动态监测调查数据'2012~2018年的云南数据, 在与全国同期流动人口为参照的前提下, 聚焦云南人口流动的生存与发展状态, 全面分析与深入揭示云南流动人口的基本特征及变化态势.它的出版能够为社会各界系统了解与全面认识云南流动人口的发展状态, 基本特征和演化态势提供一份珍贵的参考材料","否"
"1241067193","9787010220864,7010220867","中国近代东北地区城市生活兴衰与社会发展研究 (1861-1931) = Research on the rise and fall of urban life and social development in Northeast China in modern times (1861-1931)","郎元智, author","2020","chi","Book","PrintBook","Di 1 ban",1,"人民出版社","Beijing Shi","Cities and towns China Manchuria History 19th century,Cities and towns China Manchuria History 20th century,Villes Chine Mandchourie Histoire 19e siècle,Villes Chine Mandchourie Histoire 20e siècle,Cities and towns,China Manchuria,History,1800-1999","","否"
"1264134868","9787214261489,7214261480","中国哲学通史 : 学术版. 先秦卷 = A history of Chinese philosophy","郭齐勇, 1947- author","2021","chi","Book","PrintBook","Di 1 ban",1,"江苏人民出版社","Nanjing Shi","Philosophy, Chinese To 221 B.C,Philosophie chinoise Jusqu'à 221 av. J.-C,Philosophy, Chinese,To 221 B.C","本书力图揭示中国哲学之不同于西方哲学的特点及其现代价值,反映学术界研究的最新成果.本卷讨论殷商时期的宗教与政治,西周的天命论与礼乐文明,春秋时期的哲学思想,孔子,老子,墨子,孙子,子思,孟子,庄子,名辩思潮与惠子,公孙龙子,后期墨家,""易经""与""易传"",管子与稷下学宮诸家,""礼记"",郭店与上博楚简及荀子代表的战国时期儒家,法家传统与商鞅,韩非子的哲学等,并探讨中国哲学的突破","否"
"1351886751","9787201186740,7201186744","历史的地平线 : 晚清民国的多维镜像 = Multipule perspectives of the late Qing dynasty and the Republic of China","高翔宇, 1989- author","2022","chi","Book","PrintBook","Di 1 ban",2,"天津人民出版社","Tianjin","Politics and government,Social conditions,China Politics and government 1644-1912,China Politics and government 1912-1949,China Social conditions 1644-1912,China Social conditions 1912-1949,Chine Politique et gouvernement 1644-1912,Chine Politique et gouvernement 1912-1949,Chine Conditions sociales 1644-1912,Chine Conditions sociales 1912-1949,China,1644-1949","本书是一部研究近代中国政治和社会史的论文集, 由中国政法大学科研创新项目资助, 为编辑组稿. 作者从政治经济, 社会文化等多维度切入晚清民国的历史现场, 以个案解读的形式探究了近代中国百年未有之大变局视野下的历史风貌, 涉及政治人物与女性角色, 党派纷争与经济重建等话题, 既有诠释义和团运动起源的新视角, 也关涉到以黄兴为代表的民元党派领袖进京及其政治博弈的侧面. 本书通过解读史料, 对民国时期政治纷争, 女性意识有独到的见解, 因此具备较好的学术价值","否"
"1243302765","9787208168534,7208168539","中华创世神话人物图像谱系 = The Pictorial Genealogy of Chinese Creator Beings","田兆元, author","2020","chi","Book","PrintBook","Di 1 ban",3,"上海人民出版社","Shanghai","Mythology, Chinese, in art,Creation in art,Art, Chinese,Creation Mythology China,Mythology, Chinese,Folklore China,Mythologie chinoise,Folklore Chine,Mythologie chinoise dans l'art,Création dans l'art,Art chinois,Folklore,China","","否"
"1286307477","9787010217017,7010217017","明清时期湖北人才地理分布研究 = MingQingshiqi Hubeirencai dili fenbu yanjiu","张晓纪 (Cultural historian) author","2021","chi","Book","PrintBook","Di 1 ban",2,"人民出版社","Beijing","Human capital China Hubei Sheng History,Human geography China Hubei Sheng History,Human capital,Human geography,Qing Dynasty (China),Hubei Sheng (China) History,Hubei (Chine) Histoire,China,China Hubei Sheng,History,1644-1912","本书综合运用多种研究方法, 对明清两代湖北两类人才的县域分布, 面积人才密度, 人口人才密度情况进行细致透彻地剖析, 将两类人才和著作缩小地域范围按照县级行政单位来分析, 有利于研究结果的精确性. 进而对两类人才进行比较研究, 归纳总结出明清两代湖北人才地域分布的规律及其演变轨迹. 在研究明清时期湖北人才的地域分布与变迁的基础上, 进一步探讨明清湖北文化区的划分及对人才的影响, 并从从经济, 政治, 社会, 文化等各个方面分析影响人才分布的因素及影响明清之际演变的因素","否"
"1293291549","9787010218960,701021896X","中国出版家. 叶至善 = Zhongguo chubanjia. Ye Zhishan","刘耀辉, 1976- author","2021","chi","Book","PrintBook","Di 1 ban",1,"人民出版社","Beijing Shi","Ye, Zhishan,Publishers and publishing China Biography,Publishers and publishing,China,Biographies","","否"
"1371476865","9787010241579,7010241570","明清宮观山志的编纂及价值研究 = The compilation and value research on the records of the Taoist temples and mountains in the Ming and Qing Dynasties = MingQing gongguan shanzhi de bianzuan ji jiazhi yanjiu","刘永海, 1968- author","2022","chi","Book","PrintBook","Di 1 ban",1,"人民出版社","Beijing Shi","Taoism China Historiography,Taoïsme Chine Historiographie,Historiography,Qing Dynasty (China),Taoism Historiography,China History Ming dynasty, 1368-1644 Historiography,China History Qing dynasty, 1644-1912 Historiography,Chine Histoire 1644-1912 (Dynastie des Qing) Historiographie,China,History,1368-1912","","否"
"1126214993","9787201143736,7201143735","嗣樸齋叢稿","陈邦怀, 1897- author","2019","chi","Book","PrintBook","Di 1 ban",2,"天津人民出版社","Tianjin Shi","Inscriptions, Chinese History and criticism,Chinese classics History and criticism,Chinese language Etymology,Inscriptions chinoises Histoire et critique,Classiques (Littérature chinoise) Histoire et critique,Chinois (Langue) Étymologie,Chinese classics,Inscriptions, Chinese,Criticism, interpretation, etc","本书是天津文史研究馆珍藏百年已故馆员手稿系列丛书之一, 收录了我国著名的古文字学家, 青铜器专家陈邦怀先生潜心研究 '说文解字' 的手写文稿, 该书是在对比了古今各大家对 '说文解字' 的注考基础上, 结合自己深厚的国学功底, 对部分内容发表了自己的看法和理解, 反映了作者在此领域独到的学术见解和精深造诣. 这些手稿都是从其后人手中征集而来, 有着近百年的历史, 系首次公开出版, 弥足珍贵. 本书是陈邦怀先生一生重要学术成就的集大成, 是前辈大家留下的一笔丰厚学术文化遗产, 具有极高的学术和收藏价值","否"
"1273982430","9787220109898,722010989X","历代文化名人在四川","袁庭栋.","2019","chi","Book","Digital",,6,"四川人民出版社","Chengdu","","为向广大读者介绍古代四川地区有名文人墨客的活动和遗迹,书稿描述古代川籍和客寓四川省的有名文学家、艺术家,如""文翁、卓文君与司马相如、扬雄、谯周、李密、陈子昂、李白、岑参、杜甫、薛涛、白居易、刘禹锡、贾岛、李商隐""等历目前在天府之国游学、作官的名人。蜀山蜀水,人杰地灵,给我们留下许多很好的文化遗产,值得今天的我们传承和学习很好中华古蜀文明。","否"
"1294145070","9787227071556,7227071553","脱贫富民战略","狄国忠主编.","2020","chi","Book","Digital",,1,"宁夏人民出版社","Yinchuan","Electronic books","本书分为""坚决打赢脱贫攻坚战""""大力实施富民工程""两编二十五章,具体内容包括：大力实施产业扶贫、全力做好金融扶贫、深入推进健康扶贫、打好深化教育扶贫""组合拳""、配套完善基础设施等。","否"
"1280099441","","分析哲学家的智慧","沈学甫, author","2020","chi","Book","Digital",,1,"天津人民出版社","Tianjin","","本书主要介绍了语言分析哲人中的代表人物如罗素、维特根斯坦等人的思想智慧,解析了语言分析哲学的含义、研究内容及方法等常识性知识.鉴于语言哲学是现代西方哲学中影响大、成果为卓著的一个哲学流派,因此本书对于我们了解该学派,及如何通过分析日常语言解决哲学问题具有普及和启发意义,并从中汲取智慧养分","否"
"1283844477","9787201152820,7201152823","马克思主义社会建设与社会治理研究","许斗斗主编.","2019","chi","Book","Digital",,1,"天津人民出版社","Tianjin","Electronic books","《马克思主义社会建设与社会治理研究》是由福建省社科界""马克思主义社会建设理论与实践""学术年会的相关论文集结出版,内容涉及以下三方面：马克思主义社会建设理论、国外马克思主义社会治理理论；当代中国马克思主义的社会治理理论；基层社会建设、基层党建、社区治理中的具体实践问题研究。《马克思主义社会建设与社会治理研究》对于从理论层面探讨马克思主义社会建设思想、从实践层面探索中国化马克思主义的社会建设之路均具有重要参考价值。","否"
"1322487861","","新华社记者看宁夏","王磊","2019","chi","Book","Digital",,2,"宁夏人民出版社","Yinchuan","","本书分上下卷,上卷为文字性报道,分综合篇、脫贫攻坚篇、民族团结篇、高质量发展篇、民生保障篇、生态文明篇、对外开放篇、乡村振兴篇、靠前传播篇、新媒体篇.下卷为图片报道,分综合篇、脫贫攻坚篇、经济发展篇、民生改善篇、生态建设篇、乡村建设篇.辑录新华社宁夏分社记者撰写、拍摄的关于宁夏经济发展、社会动态、百姓生活等方面的新闻报道和光影,让读者通过文字和图片直观感受近年来宁夏的发展变迁","否"
"1296906496","","中国特色社会主义政治制度建设","李正华, author","2021","chi","Book","Digital",,,"河北人民出版社","Shijiazhuang","","本书包括第一章 中国特色社会主义政治制度建设的历史演进、第二章 人民代表大会制度、第三章 中国共产党领导的多党合作和政治协商制度等内容","否"
"1314628434","9787227070573,7227070573","水墨人间","赵依依著.","2019","chi","Book","Digital",,1,"宁夏人民出版社","Yinchuan","","","否"
"1314622462","9787227072751,7227072754","人间正道:李忠文学作品集","李忠著.","2020","chi","Book","Digital",,1,"宁夏人民出版社","Yinchuan","","","否"
"1147702180","9787201150581,7201150588,9787201150598,7201150596,9787201150604,720115060X,9787201150710,7201150715,9787201150666,7201150669,9787201150611,7201150618,9787201150628,7201150626,9787201150635,7201150634,9787201150642,7201150642,9787201150659,7201150650","冯尔康文集","冯尔康, author","2019","chi","Book","PrintBook","Di 1 ban",1,"天津人民出版社","Tianjin Shi","Civilization,Social sciences,China History,China Civilization,Chine Histoire,Chine Civilisation,China,History","","否"
"1325635182","9787214270214,7214270218","棘闱 : 宋代科举与社会 = The thorny gates of learning in Sung China : a social history of examinations","John W. Chaffee","2022","chi","Book","PrintBook","Di 1 ban",1,"江苏人民出版社","Nanjing Shi","Civil service China Examinations History,Fonction publique Chine Examens Histoire,Civil service Examinations,Song Dynasty (China),China Officials and employees Selection and appointment History,China History Song dynasty, 960-1279,Chine Histoire 960-1279 (Dynastie des Song),China,History,960-1279","贾志扬所著""宋代科举""代表了欧美学界目前关于宋代科举研究的最高水准.不同于国内学界常见的以制度考订为中心的研究进路,此书着重于以社会史的进路,讨论宋代科举与士绅社会的形成,地区的发展,士人生活及文化等诸多方面.全书立论审慎而精准,如对柯睿格,何炳棣与郝若贝,韩明士的争论加以总结与修正,承认宋代科举具有一定社会流动性的同时又指出其受到的限制;如指出理学家的书院教育与以科举为中心的教育之间的对抗是存在限度的:再如南宋荫补及特殊考试名额的增加,导致了科举公平性的破坏等,都颇富见地.作者运用大量历史资料,论述宋代科举制度及其历史意义,揭示宋代科举生活与士绅文化,具有较高的学术价值","否"
"1391428727","","出版笔记","杨海军, author","2021","chi","Book","Digital","Di 1 ban",2,"宁夏人民出版社","Yinchuan","","本书分为出版思索、编校点滴和编辑手记三部分, 收录了《宁夏人民出版社主题出版现状、存在问题及对策》《做好出版基金申请助力精品图书生产--宁夏人民出版社使用政府性出版基金侧记》《发挥出版对外合作优势, 助力""黄河出版""品牌影响力提升--从租型疫情防控图书谈起》等文章","否"
"1395535220","","陕北人","凡川, author","2022","chi","Book","Digital","Di 1 ban",2,"宁夏人民出版社","Yinchuan","","陕北农村青年秦海浪想走出黄土地干一番事业, 父母硬让他娶邻村青年叶红英, 新婚之夜, 他逃之夭夭.经过十年打拼, 他荣升为深州长江集团副总经理, 并且跟总经理江静月相爱.十年中, 叶红英在家乡摸爬滚打, 先后成立了六家公司, 并组建起红英集团.十年后, 秦海浪回到陕北, 一是想把老老爷爷的遗骨从内蒙古草原搬回来, 二是跟叶红英离婚.可他万万没有想到, 叶红英把事业干得风生水起, 并且被评为全国劳模.....","否"
"1283845256","9787201150581,7201150588","社会史理论与研究法","冯尔康著.","2019","chi","Book","Digital",,1,"天津人民出版社","Tianjin","Electronic books","《社会史理论与研究法》主要是对史学理论与历史研究法进行研究,分为历史学研究综论、社会史研究及其方、为史学研究新领域鼓与呼、我的习史治史、附录5个栏目。以期表明历史学主要是澄清历史事实并陈述出来,以历史知识给人以智慧的启迪,也就是强调发挥史学的社会功能,而不是政治功能。","否"
"1322487902","","中国共产党与中国文化","吴海江, author","2019","chi","Book","Digital","Di 1 ban",1,"上海人民出版社","Shanghai","","《中国共产党与中国文化》从中国共产党与中国文化的关系出发,以整体性视角,通过对文化兴盛是国家强盛的重要标志、立足中华优秀传统文化、继承革命文化、发展社会主义先进文化、加强思想道德建设、推进当代中国中西马综合创新、构筑中国精神中国价值中国力量、坚定新时代文化自信等问题的专题研究,全景展现了五四运动百年,新中国70年以来中国文化的变革历程、理论特质和实践经验","否"
"1356583794","","张爱玲 : 才华是女人最大的底气","安雨, author","2020","chi","Book","Digital",,1,"天津人民出版社","Tianjin","","民国多才女,张爱玲自是那颗最闪亮的星之一,也是民国世界的临水照花人.她,拥有惊世多彩的成名过往;她,拥有痴心一片的爱情经历;她,拥有十里洋场的上海故事.她的文字决绝、独立而又情深意长,擅于洞察人性,虽然孤寂和低郁贯穿了她的一生,但在浮华远去和孤独背后,她却只是一个追寻岁月静好、现世安稳的烟火女子.作者撷取了张爱玲人生中的童年回忆、都市生活、男女饮食等,以青年女性、当下人的视角,探知张爱玲的理性思辨、华丽优雅、深刻见解的精神世界,感受她华美悲凉、淡泊、无畏的生命历程.告慰正处于焦虑、彷徨中的青年读者,漫漫人生","否"
"1281961520","9787201150598,7201150596","古代宗族与社会结构史","冯尔康著.","2019","chi","Book","Digital",,1,"天津人民出版社","Tianjin","Electronic books","《古代宗族与社会结构史》所汇集的文章主要是关于中国古代社会史的,关注等级和社会形态等问题。通过社会形态和社会结构、古代宗族史、谱牒学·姓氏学、家族文化研究、中国古代史札记、古人的生养死葬这6个栏目,探讨了先秦至近代前期结构史、古代宗族史、谱牒史等内容。","否"
