"oclc编号 - oclcNumber","书号 - isbns","书名 - title","作者 - creator","出版日期 - publicationDate","语言 - catalogingLanguage","格式 - generalFormat","详细格式 - specificFormat","版本 - edition","总版本数 - totalEditions","出版社 - publisher","出版地 - publicationPlace","主题 - subjects","简介 - summaries","是否同行审阅 - peerReviewed"
"1122799202","9787224131543,7224131547,9787886134661,7886134664","Shanbei folksongs : a crown jewel of the Chinese folk arts","刘育林, 1938- author","2019","eng","Book","PrintBook","Di 1 ban",1,"陕西人民出版社","Xi'an","Folk music China Shaanxi Sheng,Folk music,China Shaanxi Sheng","""陕北民歌:中国民间艺术的明珠""通过不同的主题,对陕北民歌进行了逻辑严谨内容深刻的整理,它从历史出发,探讨陕北民谣的产生原因,对其发展和后续的特点进行了深入浅出的研究,在带着读者了解陕北民歌的同时,对中国历史与陕北文化的关系做了积极的探讨和思考,对中国民谣与全球文化特别是西方文化在近年来的影响做了有理有据的探究和分析","否"
"1283851063","9787205094683,7205094682","最后一个莫西干人=The last of the mohicans a narrative of 1757：英文","(美)詹姆斯·费尼姆·库珀著.","2019","eng","Book","Digital",,1,"辽宁人民出版社","Shenyang","","","否"
"1283854800","9787205094607,7205094607","都柏林人=Dubliners：英文","(爱尔兰)詹姆斯·乔伊斯(James Joyce)著","2019","eng","Book","Digital",,1,"辽宁人民出版社","Shenyang","","","否"
"1283858682","9787205097981,7205097983","恋爱中的女人=WOMEN IN LOVE：英文","(英)D.H.劳伦斯著.","2020","eng","Book","Digital",,1,"辽宁人民出版社","Shenyang","","","否"
"1283844191","9787205094713,7205094712","巨人传=Gargantua and Pantagruel.下卷：英文","(法)弗朗索瓦·拉伯雷(Francois Rabelais)著","2019","eng","Book","Digital",,1,"辽宁人民出版社","Shenyang","","","否"
"1265310676","9787222177789,7222177787","人性的弱点 How to win friends and influence people : 英文","(美) 卡耐基","2019","eng","Book","PrintBook","Di 1 ban",267,"云南人民出版社","Kun ming","Ying yu Yu yan du wu,Xin li jiao wang Tong su du wu","本书从人性本质的角度,挖掘出潜藏在人们体内的弱点,使人们能够充分认识自己,并不断改造自己,从而能有所长进,直至取得最后的成功","否"
"1311461273","9787010240473,7010240477","明代人口, 经济及区域灾荒应对 = Mingdai renkou jingji ji quyu zaihuang yingdui","张民服, author","2021","chi","Book","PrintBook","Di 1 ban",1,"人民出版社","Beijing Shi","Natural disasters China,Catastrophes naturelles Chine,Population,Natural disasters,Population Economic aspects,China Population,China Population Economic aspects,China History Ming dynasty, 1368-1644,Chine Histoire 1368-1644 (Dynastie des Ming),China,History,1368-1644","Ben shu gao cong ming dai ren kou guan li zhi du, ren kou zheng ce, ren kou fen bu, ren kou fen bu dui she hui jing ji de ying xiang, ren kou yu qu yu jing ji, ren kou si xiang ji qi jing ji huo dong, qu yu zai huang ying dui deng fang mian ru shou, yan jiu ming dai ren kou yu she hui jing ji fa zhan, yu zai huang ying dui zhi jian de guan xi, zai ren kou shi yu jing ji shi, zai huang shi de jie he shang zuo liao shen ru tan tao, ti chu bu shao chuang xin xing guan dian. te bie shi jiu xue shu jie yan jiu jiao shao de ming dai ren kou yu jing ji fa zhan de guan xi jin xing yan jiu, fen xi qi nei zai lian xi he xiang hu ying xiang, duo you du dao jian jie, cheng wei ben shu yi ge te se,本书稿从明代人口管理制度,人口政策,人口分布,人口分布对社会经济的影响,人口与区域经济,人口思想及其经济活动,区域灾荒应对等方面入手,研究明代人口与社会经济发展,与灾荒应对之间的关系,在人口史与经济史,灾荒史的结合上作了深入探讨,提出不少创新性观点.特别是就学术界研究较少的明代人口与经济发展的关系进行研究,分析其内在联系和相互影响,多有独到见解,成为本书一个特色","否"
"1369993851","9787010234380,7010234388","中国当代小说理论发展史研究 = The Development of Literary Theory in Contemporary Chinese Novels = Zhongguo dangdai xiaoshuo lilun fazhanshi yanjiu","周新民, 1972- author","2022","chi","Book","PrintBook","Di 1 ban",1,"人民出版社","Beijing Shi","Chinese fiction 20th century History and criticism Theory, etc,Roman chinois 20e siècle Histoire et critique Théorie, etc,Criticism, interpretation, etc,1900-1999","","否"
"1029887275","9787218120812,7218120814","民国广州要闻录. 近代广东海关档案, 粤海关情报卷","广东省档案馆","2018","eng","Book","PrintBook","Di 1 ban",1,"广东人民出版社","Guangzhou","Guangzhou Shi (China) History Sources,China History Republic, 1912-1949 Sources,Chine Histoire 1912-1949 (République) Sources,China,China Guangzhou Shi,History,Sources,1912-1949","粤海关档案是广东省档案馆馆藏珍贵档案之一, ""民国广州要闻录""属于粤海关档案中的英文情报档案, 案卷名为""广州各项事件传闻录"", ""广州各项事件传闻录""是粤海关档案的重要组成部分, 属于'社会情报'类档案, 是粤海关外籍˰务司为了了解当时广东乃至全中国的社会政治等情况, 从各种渠道搜集来的逐日情况汇集, 其特点是内容详尽, 涉及面广, 可信度强., 史料价值高.本项目针对""各项事件传闻录""进行保护和开发, 在保护档案原件的基础上, 实现原始档案的载体转换, 进行数字化扫描, 以及专业翻译形成中英文对照的公开出版物","否"
"1375128645","9787010246314,7010246319","中华人民共和国第十三届全国人民代表大会第五次会议文件汇编","全国人民代表大会","2022","chi","Book","PrintBook","Di 1 ban",1,"人民出版社","Beijing","Quan guo ren min dai biao da hui Wen jian Zhong guo","本书收录了十三届全国人大五次会议通过的各项报告,决议,讲话,名单等重要文件,内容包括经济增速,反腐,环保,收入分配,抗疫等当前中国社会的热点话题","否"
"1131903927","9787203109822,7203109828","近代中国分省人文地理影像采集与研究. 山西 = The collection and research of human geography images in modern China. Shanxi","《近代中国分省人文地理影像采集与研究》编委会","2019","chi","Book","PrintBook","Di 1 ban",1,"山西人民出版社","Taiyuan","Human geography China Shanxi Sheng Pictorial works,Human geography,Manners and customs,Travel,Shanxi Sheng (China) Description and travel Pictorial works,Shanxi Sheng (China) Social life and customs Pictorial works,Shanxi Sheng (China) Description and travel,Shanxi Sheng (China) Social life and customs,Shanxi (Chine) Descriptions et voyages,Shanxi (Chine) Mœurs et coutumes,Shanxi (Chine) Descriptions et voyages Ouvrages illustrés,Shanxi (Chine) Mœurs et coutumes Ouvrages illustrés,China Shanxi Sheng","""近代中国分省人文地理影像采集与研究""丛书以当今中国省级行政单位为基准共分为34卷;从近代中国人文地理角度出发,精选10000多张历史影像;由地理学,历史学及影像学,翻译学等方面专家协同,科学严谨地对这些影资料进行研究考证.本卷为山西卷,从山西地域特色出发,最大程度反映了该区域的地理,历史及社会生活状态.内文细分为""风光,名胜""""城市,乡村""""民俗,宗教""""生活,百业""四个大的章节板块.从时代,地域,专题三个维度进行历史影像的呈现,既各成体系,又便于对照异同.纵向可以体现同一地区不同时代的地理,人文风貌变迁;横向可以对比同一时代中国不同地区间的异同","否"
"1248772228","9787010230092,7010230099","明清运河漕运仓储与区域社会研究","郑民德, 1982- author","2020","chi","Book","PrintBook","Di 1 ban",2,"人民出版社","Beijing","Shipping China Grand Canal History,Storage facilities China Grand Canal History,Shipping,Social conditions,Storage facilities,Grand Canal (China) History,China Social conditions 960-1644,China Social conditions 1644-1912,Da Yunhe (Chine) Histoire,Chine Conditions sociales 960-1644,Chine Conditions sociales 1644-1912,China,China Grand Canal,History,960-1912","Summary in Chinese field only,本书以明清运河沿线的京通仓,大型水次仓,基层社会漕仓为研究对象,在探讨仓储历史沿革,管理,运作的基础上,深刻论述了明清运河漕仓与区域社会之间的互动关系,分析了京杭大运河对国家与社会的辐射与影响","否"
"1157915060","9787203107729,7203107728","近代中国分省人文地理影像采集与研究. 湖北  = The collection and research of human geography images in modern China. Hubei","《近代中国分省人文地理影像采集与研究》编委会","2019","chi","Book","PrintBook","Di 1 ban",1,"山西人民出版社","Taiyuan","Human geography China Hubei Sheng Pictorial works,Ren wen di li Yan jiu Hu bei Jin dai,Human geography,Manners and customs,Travel,Hubei Sheng (China) Description and travel Pictorial works,Hubei Sheng (China) Social life and customs Pictorial works,Hubei Sheng (China) Description and travel,Hubei Sheng (China) Social life and customs,Hubei (Chine) Descriptions et voyages,Hubei (Chine) Mœurs et coutumes,Hubei (Chine) Descriptions et voyages Ouvrages illustrés,Hubei (Chine) Mœurs et coutumes Ouvrages illustrés,China Hubei Sheng","","否"
"1159806231","9787010218939,7010218935","十八大以来廉政新规定 : 2020年版","人民出版社","2020","chi","Book","PrintBook","Di 1 ban",1,"人民出版社","Beijing","Zhongguo gong chan dang Discipline,Zhongguo gong chan dang,Communist ethics China,Political corruption Government policy China Prevention 21st century,Political ethics China 21st century,Morale communiste Chine,Morale politique Chine 21e siècle,Politics and government,Political ethics,Communist ethics,Discipline,China Politics and government 2002-,China,Since 2000","Summary in Chinese field only,党的十八大以来,党中央高度重视,全面推进党风廉政建设,使党风,政风为之一新,得到了全国人民的衷心拥护和高度评价.""十八大以来廉政新规定""收录了党中央,国务院等部门近六年多来所出台的一系列关于廉政建设的重要规定,这些规定涉及强化干部监管,引导示范带头,提倡厉行节约,规范公务接待,严禁公款送礼等方面,具有极强的指导性,针对性,示范性和可操作性,是全面改进工作作风的基础.不仅方便广大领导干部和各级党政机关贯彻执行这些规定,而且有利于充分发挥人民群众的监督作用.2020年新版在2019年版的基础上,主要是收录了2018年12月以来新出台的14项廉政新规定,同时删去已修订或失效的3项规定,收录总数由68项调整为80项,以便更好地满足读者的需求","否"
"1334723426","9787010236407,7010236402","人民出版社藏名家书信 = The collected letters of celebrities by People's Publishing House","人民出版社","2021","chi","Book","PrintBook","Di 1 ban",1,"人民出版社","Beijing Shi","Chinese letters,Celebrities China Correspondence,Celebrities,China,Personal correspondence","","否"
"1120095425","9787203108962,7203108961","周恩来与国民党将领","尹家民, author","2019","chi","Book","PrintBook","Di 1 ban",4,"山西人民出版社","Taiyuan","Zhou, Enlai, 1898-1976,Generals China,Généraux Chine,Generals,China","该书稿叙述了周恩来在20世纪20年代至六七十年代和国民党将领的交往历史.在不同的历史时期,周恩来有勇有谋,有理有节,立场坚定地和国民党的重要人物既周旋斗争,又合作争取,促成了西安事变和平解决,抗日统一战线建立,北平,湖南等地和平起义,中国人民政治协商会议召开,李宗仁回归祖国大陆等历史性事件.书稿通过对重要人物,重要事件的陈述,展示了上述近50年风云变幻的中国革命历史,充分展现了周恩来大智大勇,大仁大义的无产阶级革命家的个人魅力和卓越功勋","否"
"1388270103","9787208175082,720817508X","多学科视域下的社会主义现代化研究","上海市习近平新时代中国特色社会主义思想研究中心.","2022","chi","Book","PrintBook","Di 1 ban",1,"上海人民出版社","Shanghai","She hui zhu yi jian she Xian dai hua jian she Yan jiu Zhongguo","本书是中共上海市委宣传部,中共上海市委党校联合举办的第37期青年理论骨干学习研讨班学员的集体成果.本书的作者是一群40岁左右,具有副教授以上职称和博士学历,从事哲学社会科学教学,科研的青年理论工作者,他(她)们以各自学科的学术积累和独特视觉,对全面建设社会主义现代化国家的若干问题,例如数据治理体系,产业政策演化逻辑,创新驱动发展,制造业升级等,作了深入的,富有新意的研究","否"
"1301899675","9787202094594,7202094592","河北民间文艺史 = Hebei minjian wenyishi","郑一民, 1946- author","2021","chi","Book","PrintBook","Di 1 ban",2,"河北人民出版社","Shijiazhuang Shi","Chinese literature China Hebei Sheng History and criticism,Folk art China Hebei Sheng History and criticism,Littérature chinoise Chine Hebei Histoire et critique,Art populaire Chine Hebei Histoire et critique,Chinese literature,Folk art,China Hebei Sheng,Criticism, interpretation, etc","本书是第一本梳理河北民间文艺史的图书.全书共分为河北民间文学,河北民间工艺,河北民间艺术与花会,河北民间习俗与信仰,河北民间文艺组织与机构,河北民间文艺事业大事记等六编.以河北社会历史文化发展演变为大背景,叙述河北民间文艺的发展演变,例举经典民间文艺事象,阐释民间文艺的特征,为读者讲述精彩的河北民间文艺故事,在注重史料价值的同时,注重趣味性.目前我国还没有综合性民间文艺史的写作,宏大的中国民间文艺史研究必将以各地民间文艺史研究为基础,""河北民间文艺史""为我国民间文艺史综合性研究提供了资料和素材","否"
"1375130647","9787220127311,7220127316","古人这样过日子","国家人文历史.","2022","chi","Book","PrintBook","Di 1 ban",2,"四川人民出版社","Chengdou","Sheng huo fang shi Zhong guo Gudai Tong su du wu","本书聚焦古人购物,饮食,习俗,娱乐,养生,婚姻,职场7个方面,精选了有代表性的话题,还原古人日常生活的诸多细节","否"
"1375140918","9787010239781,7010239789","以诚待人 讲信修睦","欧阳祯人.","2022","chi","Book","PrintBook","Di 1 ban",1,"人民出版社","Beijing","Zhong hua wen hua Tong su du wu","本书面向海内外读者,从<周易><尚书><论语><礼记><孟子>等典籍中,精选了关于以诚待人,讲信修睦思想的100余条典文,对其进行注释,翻译和解析,赋予其新的涵义,以帮助读者更好地理解中华优秀传统文化之于当代中国的价值,为解决当代人类面临的难题提供中国方案","否"
"1283853609","9787205093358,720509335X","论美国民主(上卷)=Democracy in America Vol. I：英文","(法)阿·托克维尔著.","2018","eng","Book","Digital",,1,"辽宁人民出版社","Shenyang","","","否"
"1283854504","9787205093389,7205093384","巨人传=Gargantua and Pantagruel：英文","(法)弗朗索瓦·拉伯雷著.","2018","eng","Book","Digital",,1,"辽宁人民出版社","Shenyang","","","否"
"1312714776","9787224142334,7224142336","西安鼓乐何家营村乐社手抄曲谱","丁科民","2021","chi","Book","PrintBook","Di 1 ban",2,"陕西人民出版社","Xi'an","","西安鼓乐所使用的乐谱全为手抄传本,谱字与宋代俗字谱同一体系,有的音符与敦煌莫高窟发掘的唐乐谱相同.综观整个乐曲名称,明显保留着唐,宋,元,明,清各种曲牌.所以说称西安鼓乐为中国古代音乐的""活化石"".现存乐谱分散保存于民间各乐社,音乐研究机构中,还有一部分散落于个人手中.本次计划出版的曲谱即为何家营村乐社原掌门人何忠信收藏的手抄曲谱,其中既有乐谱也有鼓谱,包括南词十首,北词八套,坐乐前扎子两套等大型套曲,以及鼓段,擂鼓,耍曲等小型乐曲","否"
"1274195472","9787222200906,7222200908","云南少数民族古籍珍本集成. 第九十六卷","云南省少数民族古籍整理出版规划办公室","2021","chi","Book","PrintBook","Di 1 ban",1,"云南人民出版社","Kunming","","""云南少数民族古籍珍本集成""系参照国家针对汉文古籍实施""中华再造善本工程""的做法,以影印方式编纂出版的第一套完整的大型民族文献古籍丛书.它以""善本再造""的方式真实还原了各少数民族古籍珍本,为研究云南各少数民族历史文化提供了丰富而新颖的实物原形资料,有利于各少数民族文化研究的繁荣与发展.本书是""云南少数民族古籍珍本集成""的第九十六卷,收录普米族民间典籍.所收录的普米族典籍是普米族典籍中的精品,具有较高的文化价值","否"
"1266143832","9787213092534,7213092537","深泽直人. 具象","(日) 深泽直人.","2019","chi","Book","PrintBook","Di 1 ban",1,"浙江人民出版社","Hang zhou","Chan pin she ji","""20世纪工业设计系列""之一。继《深泽直人》(NAOTOFUKASAWA)之后,深泽直人第二本书,深度诠释设计作品背后的设计思考与洞察。这本书介绍了深泽直人独到的设计哲学,并且结合多年来创作的实际产品和案例,揭示了隐藏在看似""本该如此""的设计作品背后诸多深入的设计思考与洞察,诠释了设计中Embodiment(不仅是形式,更是诠释和表达)的表达方式","否"
"1274195948","9787222200920,7222200924","云南少数民族古籍珍本集成. 第九十八卷","云南省少数民族古籍整理出版规划办公室","2021","chi","Book","PrintBook","Di 1 ban",1,"云南人民出版社","Kunming","","""云南少数民族古籍珍本集成""系参照国家针对汉文古籍实施""中华再造善本工程""的做法,以影印方式编纂出版的第一套完整的大型民族文献古籍丛书.它以""善本再造""的方式真实还原了各少数民族古籍珍本,为研究云南各少数民族历史文化提供了丰富而新颖的实物原形资料,有利于各少数民族文化研究的繁荣与发展.本书是""云南少数民族古籍珍本集成""的第九十八卷,收录纳西族民间典籍.所收录的纳西族典籍是纳西族典籍中的精品,具有较高的文化价值","否"
"1274196124","9787222200890,7222200894","云南少数民族古籍珍本集成. 第九十五卷","云南省少数民族古籍整理出版规划办公室","2021","chi","Book","PrintBook","Di 1 ban",1,"云南人民出版社","Kunming","","""云南少数民族古籍珍本集成""系参照国家针对汉文古籍实施""中华再造善本工程""的做法,以影印方式编纂出版的第一套完整的大型民族文献古籍丛书.它以""善本再造""的方式真实还原了各少数民族古籍珍本,为研究云南各少数民族历史文化提供了丰富而新颖的实物原形资料,有利于各少数民族文化研究的繁荣与发展.本书是""云南少数民族古籍珍本集成""的第九十五卷,收录藏族民间典籍.所收录的藏族典籍是藏族典籍中的精品,具有较高的文化价值","否"
"1283848688","","宁夏社会发展报告. 2018","宁夏社会科学院","2018","chi","Book","Digital","Di 1 ban",2,"宁夏人民出版社","Yinchuan","","本书是宁夏社会科学院组织的宁夏蓝皮书之一, 全书从总报告、综合战略篇、分析预测篇、财政金融篇、产业经济篇、专业研究篇和区域发展篇等各个方面, 系统地介绍了2017年宁夏回族自治区的经济发展情况及预测, 叙述全面严谨, 具有较高的社会价值和参考价值","否"
"1375161327","9787010246024,7010246025","中华人民共和国法律汇编 / 2021","全国人民代表大会常务委员会法制工作委员会.","2022","chi","Book","PrintBook","Di 1 ban",1,"人民出版社","Beijing","Fa lü Zhong guo 2021 Hui bian","本书收录了2021年全国人民代表大会及其常务委员会通过的宪法修正案,法律,有关法律问题和重大问题的决定","否"
"1408689188","9787213108860,7213108867","智库报告 : 2021浙江省社会科学决策咨询成果汇编","浙江省社会科学界联合会.","2023","chi","Book","PrintBook","Di 1 ban",1,"浙江人民出版社","Hang zhou","Zhong guo jing ji Jing ji fa zhan Wen ji,She hui fa zhan Zhong guo Wen ji","本书收录了入编2021年度<浙江社科要报>和<浙江智库要报>的部分优秀研究成果,涉及共同富裕研究,数字化改革研究,""三服务""调研,乡村振兴研究,生态文明建设研究等","否"
"1408702483","9787010255125,7010255121","中国人民政治协商会议第十四届全国委员会第一次会议文件汇编","中国人民政治协商会议","2023","chi","Book","PrintBook","Di 1 ban",1,"人民出版社","Beijing","Zhong guo ren min zheng zhi xie shang hui yi Wen jian","本书内容包括:中国人民政治协商会议第十四届全国委员会第一次会议政治决议,在中国人民政治协商会议第十四届全国委员会第一次会议闭幕会上的讲话,中国人民政治协商会议第十四届全国委员会第一次会议关于常务委员会工作报告的决议,中国人民政治协商会议章程修正案等","否"
"1408704425","9787208179967,7208179964","上海社联年鉴 / 2022","上海市社会科学界联合会.","2023","chi","Book","PrintBook","Di 1 ban",1,"上海人民出版社","Shanghai","She hui ke xue Lian he hui Shang hai 2022 Nian jian","本书设有年度工作要览,重要活动,科研组织与决策咨询平台,成果发布和评价平台,社科普及平台,学会服务平台,学会学术交流,学术期刊等类目","否"
"1408526276","9787213107757,7213107755","文献之邦 : 江南版本文化概览图录","杭州国家版本馆.","2022","chi","Book","PrintBook","Di 1 ban",1,"浙江人民出版社","Hang zhou","Ban ben Yan jiu Zhong guo Tu lu","本书从浩如烟海的历代版本文物,文献中撷取千余件代表性实物,按照版本源流,版本内涵,版本技艺,版本审美四个主题,讲述江南版本文化故事","否"
"1408526858","9787208169647,7208169640","上海社联年鉴 / 2020","上海市社会科学界联合会.","2021","chi","Book","PrintBook","Di 1 ban",1,"上海人民出版社","Shanghai","She hui ke xue Lian he hui Shang hai 2020 Nian jian","本书设年度工作要览,重要活动,科研组织与决策咨询平台,成果发布和评价平台,社科普及平台,学会服务平台,学会学术交流,学术期刊,中美关系建设,机关栏目,大事记专栏,记述了2019年上海市社会科学界联合会工作的基本情况","否"
"1408518414","9787548619154,7548619154","牢记嘱托 孜孜践行 : 全过程人民民主的长宁实践报告","上海市长宁区推进全过程人民民主建设领导小组.","2023","chi","Book","PrintBook","Di 1 ban",1,"上海人民出版社学林出版社","Shanghai","She hui zhu yi min zhu Jian she Yan jiu bao gao Zhang ning qu","本书以近40个长宁区打造全过程人民民主最佳基层实践地的最直接,最鲜活的创新案例,生动诠释了全过程人民民主的深刻内涵和基层实践,力求不断丰富全过程人民民主的时代内涵,助力全过程人民民主在上海全面落地生根,开花结果,讲好中国故事,展示社会主义民主政治的优越性","否"
"1408499551","9787218164472,7218164471","与时俱进的理论探索 / 第六辑, 广东省习近平新时代中国特色社会主义思想研究中心重点理论文章汇编","广东省习近平新时代中国特色社会主义思想研究中心.","2023","chi","Book","PrintBook","Di 1 ban",1,"广东人民出版社","Guang zhou","Zhong guo te se she hui zhu yi Li lun yan jiu Wen ji","本书精选了广东省习近平新时代中国特色社会主义思想研究中心于2020-2021年在""三报一刊""上刊登的重点理论文章,这些文章发表后受到学界和社会各界的好评,凝聚了广东学术界权威专家的最新研究成果,对深化理论研究,拓展研究视域有重要的学术价值,对深化理论研究,拓展研究视域有较高的理论价值","否"
"1408517773","9787213108853,7213108859","智库报告 : 2020浙江省社会科学决策咨询成果汇编","浙江省社会科学界联合会.","2023","chi","Book","PrintBook","Di 1 ban",1,"浙江人民出版社","Hang zhou","Zhong guo jing ji Jing ji fa zhan Wen ji,She hui fa zhan Zhong guo Wen ji,Zhe jiang wen xian","本书收录了入编2020年度165期<浙江社科要报>的部分优秀研究成果,涉及""重要窗口""研究,高质量发展研究,文化教育研究,社会治理研究,乡村振兴研究,生态文明建设研究,疫情防控研究等","否"
"1408515782","9787010245225,7010245223","新时代农民工公共服务供需问题 : 基于城乡流动双循环视角的研究","谢建社 (1959-)","2023","chi","Book","PrintBook","Di 1 ban",1,"人民出版社","Beijing","Min gong Lao dong jiu ye She hui fu wu Yan jiu Zhong guo","本书以新时代农民工城乡流动双循环路径为探索起点,运用城乡流动研究理论与实践成果,分析农民工在城乡流动中的社会治理,身份认同,服务匹配,子女教育,诚信机制,社会心态,城乡融合,党建引领,乡村振兴与共同富裕等问题,提出了建立健全农民工市民化机制,城乡公共服务要素合理配置的体制机制,城乡人才返乡入乡激励机制","否"
