"oclc编号 - oclcNumber","书号 - isbns","书名 - title","作者 - creator","出版日期 - publicationDate","语言 - catalogingLanguage","格式 - generalFormat","详细格式 - specificFormat","版本 - edition","总版本数 - totalEditions","出版社 - publisher","出版地 - publicationPlace","主题 - subjects","简介 - summaries","是否同行审阅 - peerReviewed"
"1089990552","9787520334860,7520334864","汉语传承语素与国际汉语词汇教学","杨晓黎, 1957- author","2018","chi","Book","PrintBook","Di 1 ban",2,"中国社会科学出版社","Beijing","Chinese language Morphemics,Chinese language Word formation,Chinese language Lexicology Study and teaching,Chinois (Langue) Morphèmes,Chinois (Langue) Formation des mots,Chinois (Langue) Lexicologie Étude et enseignement","Ben shu tan tao ci de yu su hua ji qi xing cheng tiao jian, yi li shi lai yuan wei biao zhun dui han yu yu su jin xing zhong xin fen lei, jiang han yu yu su fen wei chuan cheng yu su he hou qi yu su liang da lei. zai chuan cheng yu su ben ti yan jiu de ji chu shang, ben shu wei rao chuan cheng yu su yu guo ji han yu ci hui jiao xue de guan xi kai zhan yan jiu, cha ce le xiang guan da gang zhong chuan cheng yu su de cheng xian qing kuang bing gui na chu kuo yong yu guo ji han yu ci hui jiao xue de chang yong chuan cheng yu su. ben shu shu li le chuan cheng yu su yi yu ci yi de guan xi, kao cha le han zi yu chuan cheng yu su jian de fu za qing kuang, zong jie le chuan cheng yu su de zhu yao te dian ji yong yu guo ji han yu ci hui jiao xue de gong neng, tong shi xuan ze dian xing yu su kai zhan ge an yan jiu. shu zhong bian zhi de xiang guan jiao xue yong biao, dui guo ji han yu ci hui jiao xue ju you jiao gao de can kao jia zhi,本书探讨词的语素化及其形成条件, 以历史来源为标准对汉语语素进行重新分类, 将汉语语素分为传承语素和后起语素两大类.在传承语素本体研究的基础上, 本书围绕传承语素与国际汉语词汇教学的关系开展研究, 查测了相关大纲中传承语素的呈现情况并归纳出适用于国际汉语词汇教学的常用传承语素.本书梳理了传承语素义与词义的关系, 考察了汉字与传承语素间的复杂情况, 总结了传承语素的主要特点及用于国际汉语词汇教学的功能, 同时选择典型语素开展个案研究.书中编制的相关教学用表, 对国际汉语词汇教学具有较高的参考价值","否"
"1111574706","9787520342230,7520342239","现代汉语频度副词研究","Heizhuai Guan","2019","chi","Book","PrintBook","Di 1 ban",2,"中国社会科学出版社","Beijing","Chinese language Adverb,Chinois (Langue) Adverbe","本书以现代汉语频度副词为研究对象.在已有研究基础上, 根据""能否独立地表示动作, 行为, 事件, 状态的重复量""这一标准, 确立了现代汉语频度副词的范围;并从表达功能出发, 通过一些句法环境测试项对频度副词进行了次类划分, 将频度副词分为评注性, 限制性, 描写性三大类, 并进一步将限制性频度副词分为高频, 中频, 低频三类, 描写性频度副词分为动态和静态两类, 从而构建了一个新的频度副词分类框架.以此为基础, 首先从宏观的角度探讨了频度副词量化对象的性质, 认为已往单纯依靠动词的""有界""与""无界""的做法并不能真正解决频度副词对谓语的选择限制问题.我们转而借鉴了事件语义学对""事件类别""和""个体事件""的区分, 认为频度副词修饰的对象是事件类别, 而不是个体事件;并以此为基础解释了不同类别频度副词与动态助词""了, 着, 过""的共现限制问题.其次, 本书还特别注重对不同类别频度副词之间, 同一小类频度副词之间的句法功能差异进行细致的描写, 并努力对这些功能差异的形成进行解释","否"
"1306259832","9787520358552,7520358550","中国史诗研究","江林昌, 1961- author","2022","chi","Book","PrintBook","Di 1 ban",2,"中国社会科学出版社","Beijing","Epic poetry, Chinese History and criticism,Poésie épique chinoise Histoire et critique,Epic poetry, Chinese,Criticism, interpretation, etc","本成果通过作者近二十年来参加国家""夏商周断代工程""""中华古文明探源工程""等活动所获得的系统认识,在深入总结中华文明起源路径,发展道路与西方文明有鲜明不同的规律基础之上,断定中国汉语史诗系统与西方史诗系统产生的背景不同,因而突破了西方史诗理论,概念和术语的束缚,提出了中国自己的汉语史诗概念,术语等,并总结中国汉语史诗理论体系.其中对中国汉语""颂诗""与""史诗""的对应关系还做了专题深入研究,提出了新的认识","否"
"1129246808","9787520348850,7520348857","比较文学变异学研究","王超, 1981- author","2019","chi","Book","PrintBook","Di 1 ban",2,"中国社会科学出版社","Beijing","Comparative literature","Summary in Chinese field only,比较文学变异学自2005年提出以来, 已得到哈佛大学David Damrosch, 芝加哥大学Haun Saussy, 法国索邦大学Bernard Franco等著名学者的深度评介.本书全面梳理国内外研究现状, 分两大部分进行创新阐述:第一, 二, 三章从学科外部分析变异学的学术背景, 哲学基础和创新路径;第四, 五, 六章从学科内部分析变异学的理论内涵, 外延边界和实践方法.主要创新有:第五章梳理出文学变异的四条规则, 是对变异之'度'的有效回应;第六章第一节'流传变异学'分为译介变异, 传播变异和接受变异;第二节'阐释变异学'分为错位阐释变异, 对位阐释变异和移位阐释变异;第三节'结构变异学'分为文学结构变异, 文论结构变异和文化结构变异, 这九个分支构成变异学的实践话语体系","否"
"1335109622","9787520393386,7520393380","天地之心 : 《诗纬》研究","曹建国, author","2021","chi","Book","PrintBook","Di 1 ban",2,"中国社会科学出版社","Beijing","Mysticism China,Chinese literature History and criticism,Divination China,Chinese classics History and criticism,Mysticisme Chine,Littérature chinoise Histoire et critique,Divination Chine,Classiques (Littérature chinoise) Histoire et critique,Chinese classics,Chinese literature,Divination,Mysticism,China,Criticism, interpretation, etc","","否"
"1348594690","9787522704821,7522704820","怀安诗社研究","霍建波, 1973- author","2022","chi","Book","PrintBook","Di 1 ban",2,"中国社会科学出版社","Beijing","Huai an shi she (China) History,Chinese poetry 20th century History and criticism,Poésie chinoise 20e siècle Histoire et critique","本书是研究延安时期创作旧体诗的诗社-怀安诗社的第一部学术专著,从古典诗学视角切入对其进行了较为全面系统的考察.绪论部分主要讨论了三个问题,即界定怀安诗概念,扫描研究现状以及概述中国古典诗学的基本特征.第一章探析了怀安诗社成立的社会背景与文化语境,第二章考证了怀安诗社的成员组成,编制了""怀安诗社活动年表"".第三章结合怀安诗人的论述以及诗歌创作,概括了其较为复杂的诗论主张.第四章第五章均为为个案研究,以怀安诗社社长李木庵和发起人谢觉哉为例,探讨了怀安诗社的创作成就.第六章主要运用文本细读方式,对怀安诗名篇进行了解读.第七章主要从文学与政治两个维度,阐述了怀安诗社的地位与影响.结束语部分是本研究成果的归纳总结,对怀安诗社的成功经验与历史局限性做了简要概述","否"
"1120983676","9787520334891,7520334899","汉学家《论语》英译研究 = A study of sinologists' English translation Of Lunyu","张德福, author","2018","chi","Book","PrintBook","Di 1 ban",2,"中國社会科学出版社","Beijing","Confucius. Translations History and criticism,Lun yu (Confucius),Translations,Criticism, interpretation, etc","《汉学家〈论语〉英译研究》从史学的角度出 发, 观照译者个人背景, 特定历时文化语境等因素, 运用融微观的文本分析和宏观的文化研究为一体 的综合研究方法, 围绕19世纪60年代以来汉学家英译《论语》的四个 阶段, 通过聚焦于汉学家《论语》英译本典型个案, 利用跨学科理论多维度探研汉学家《论语》英译 现象, 揭示汉学家《论语》英译本的翻译取向, 汉学家 翻译行为的内外影响因素以及汉学家译者主体性 的演变特点, 并对中国典籍外译加以思考与展望.本书既适合翻 译研究者参考, 又可供儒学, 汉学爱好者阅读与品鉴","否"
"1288520619","9787520384926,7520384926","先秦兩漢韻部演變專題研究","劉琨, 1978- author","2021","chi","Book","PrintBook","Di 1 ban",2,"中国社会科学出版社","Beijing","Chinese language Phonology,Han Dynasty (China),China History To 221 B.C,China History Han dynasty, 202 B.C.-220 A.D,Chine Histoire Jusqu'à 221 av. J.-C,Chine Histoire 202 av. J.-C.-220 (Dynastie des Han),China,History,To 220","上古韵部划分是构拟上古韵母系统的前提,一些邻近韵部的分合问题至今仍有争论,无法完整描述汉语韵部系统发展演变的情况.为能探求语音演变的线索和规律,为古音构拟提供进一步的材料和依据,本书选择了东,冬,侵诸部的分合问题;脂,微诸部的分合问题;阴,入声韵诸部关系等三个韵部演变专题进行研究.研究使用了包括两周金文,""诗经"",""楚辞"",周秦群经诸子,两汉韵文诗文等诗文用韵材料;包括谐声字,通假字等的文字材料.注重从时间,空间角度对材料进行科学,细致地划分,并在研究的过程中尽力贯彻古音研究应该考虑时空概念的原则,悉心探求上古韵部之间的关系源流及其地域走向","否"
"1273961125","9787520388092,7520388093","唐宋词流派史","刘扬忠, author","2021","chi","Book","PrintBook","Di 3 ban",8,"中国社会科学出版社","Beijing","Ci (Chinese poetry) History and criticism,Chinese poetry Song dynasty, 960-1279 History and criticism,Chinese poetry Tang dynasty, 618-907 History and criticism,Chinese poetry Five dynasties and the Ten kingdoms, 907-979 History and criticism,Ci (Poésie chinoise) Histoire et critique,Poésie chinoise 960-1279 (Dynastie des Song) Histoire et critique,Poésie chinoise 618-907 (Dynastie des Tang) Histoire et critique,Chinese poetry,Chinese poetry Five dynasties and the Ten kingdoms,Ci (Chinese poetry),Song Dynasty (China),Tang Dynasty (China),Criticism, interpretation, etc,618-1279","本书是一部以流派演变史为主的新型唐宋词史.作者打破了""豪放""""婉约""等传统词论的二分法,从文化大背景切入,从时代精神和群体审美选择的角度考察了各风格流派发展衍化之规律,全景式地把握了唐宋词的流变过程:变作者个体研究为群体研究,对群体互动及各流派互相影响,渗透及竞争进行了深入的解析;作者考察了唐宋时期哲学,政治,宗教,社会习俗和民族心理等对词人及不同的词人群体的创作观念和审美情趣的深刻影响,从而展现了唐宋词百花争妍,异彩纷呈的风格和流派形成与发展的历史","否"
"1248840309","9787520379557,7520379558","中国现代化与文学乡愁","禹建湘, 1970- author","2021","chi","Book","PrintBook","Di 1 ban",2,"中国社会科学出版社","Beijing","Chinese literature 20th century History and criticism,Homesickness in literature,Country life in literature,Littérature chinoise 20e siècle Histoire et critique,Vie rurale dans la littérature,Chinese literature,Criticism, interpretation, etc,1900-1999","","否"
"1286358313","9787520329101,7520329100","清文助语虚字注述","付勇, 1952- author","2019","chi","Book","PrintBook","Di 1 ban",3,"中国社会科学出版社","Beijing","Manchu language Function words,Manchu language Textbooks for foreign speakers Chinese,Mandchou (Langue) Mots fonctionnels,Manchu language,Textbooks for Chinese speakers","""本书对清雍正八年(1730年)出版的《满汉字清文启蒙》(宏文阁刻本)卷三《清文助语虛字》的全部满文标注了索贝特拉丁转写, 并集中整理了满文词缀(附加成分), 给出了该书全部单词的词汇表和拉丁转写索引.""--內容简介","否"
"1274195516","9787520386784,7520386783","古典小说论集","杜贵晨, 1950- author","2021","chi","Book","PrintBook","Di 1 ban",1,"中国社会科学出版社","Beijing","Chinese fiction History and criticism,Roman chinois Histoire et critique,Chinese fiction,Criticism, interpretation, etc","本书是作者四十年来发表的学术研究论文,随笔精选集,内容涉及中国古代哲学,小说,诗歌,文论,鲁迅与现代文学,外国文学,史学等较广泛领域;每篇皆具独创性.内容主要包括""天人与数理"",""罗学"",泰山与""四大奇书"",若干古今中外小说的考证与阐释,""乾隆三大小说""散论,诗文探索,史学边沿等七个方面.所涉皆经典著作的新问题,所论皆未经人道之新观念,所尝试多前所未有之新方法或新路径.本书在比较广阔的领域有较多方面深入独到的发现,展示了当代人文学者的学术视野与气度,以及尽可能博大而愈可能精深的学术方向","否"
"1353111416","9787522706825,7522706823","革命话语与中国新诗","魏天真, author","2022","chi","Book","PrintBook","Di 1 ban",1,"中国社会科学出版社","Beijing","Chinese poetry 20th century History and criticism,Revolutions in literature,Poésie chinoise 20e siècle Histoire et critique,Révolutions dans la littérature","""革命""贯穿20世纪中国社会历史文化进程,对新诗的产生,传播和接受影响极大.""革命""既是新诗研究的参照物也是研究的对象,但已有的研究成果较多处于传统革命观念的笼罩之下而缺乏超越性,缺少关于新诗革命话语复杂性,丰富性的研究.""革命""之于新诗的意义,一是作为新诗外部处境的革命,二是作为新诗写作核心语汇,表达现代汉诗之普遍性追求的革命,三是作为新诗特征后果的革命.革命话语包括以革命为核心词的一套相关语汇,也包括这一套语汇在社会中的生产传播及效用.""话语""是一种语言表达的结构,也是一种行为或实践.革命话语在中国现代文学,尤其是新诗的生成发展中的影响或作用,尚未被充分认识或阐释.该选题在综论基础上,选择何其芳,卞之琳,冯至,艾青,绿原,废名,徐玉诺,穆旦等八位具有代表性的新诗诗人,对其诗歌创作和诗学观念做细读和分析,并结合各人文学生活与诗歌创作经历,探讨革命话语对创作,传播与接受的复杂影响,由此探究新诗百年与现代汉诗革命话语诗学建构与实践问题.该选题将宏观理论与个案探究结合,历史分析与现实关怀联系,以革命话语为关键词阐释新诗百年的中国化的现代性演进轨迹,特征与启示","否"
"1330420605","9787520399630,752039963X","地域文化视野中的两湖现代文学研究","刘保昌, 1971- author","2022","chi","Book","PrintBook","Di 1 ban",2,"中国社会科学出版社","Beijing","Chinese literature 20th century History and criticism,Littérature chinoise 20e siècle Histoire et critique,Chinese literature,Literature,Hunan Sheng (China) In literature,Hubei Sheng (China) In literature,Hunan (Chine) Dans la littérature,Hubei (Chine) Dans la littérature,China Hubei Sheng,China Hunan Sheng,Criticism, interpretation, etc,1900-1999","本书综合运用历史学,文化学,民俗学,语言学,比较文学,文本细读,人文地理学,文化人类学等研究方法,遵循""文化还原""和""双重发现""的探索路径,对两湖现代文学文本,传统典籍,非物质文化遗产进行三重参证,双向考察地域文化视野中的两湖现代文学创作和两湖现代文学中的地域文化书写.作为整体感觉文化区的两湖现代文学,在历史叙事,武陵地域,中部地域及东部地域书写方面,内蕴热心向洋,九死未悔与冷眼观世,逍遥自适的张力性精神结构,兼采古今中西文化资源,具有独特的审美意义与思想价值","否"
"1350736923","9787522702995,7522702992","清末民初《说部丛书》叙录 = The descriptive catalogue of ""novel series"" at late Qing and early republic of China","付建舟, 1969- author","2022","chi","Book","PrintBook","Di 1 ban",2,"中國社會科學出版社","Beijing","Fiction History and criticism,Roman Histoire et critique","本成果首次对清末民初(1895-1927)以""说部丛书""为名或以其他名称为名的""小说丛书""(商务印书馆出版的""说部丛书""因已叙录而除外)展开叙录.采用文献考证法,对每种作品一一考辨,叙录每部作品的作者(著者与译者),版本,全录或摘录主要的章节目录,序跋,以及其他相关文献,如评述,作品广告等.全书分为二十个部分,各部分以""说部丛书""出版的先后顺序排列,各部""丛书""中的各部(编)作品以原编号排列,无编号者,以作品首字音序升序排列.本成果以不同的""说部丛书""为对象,根据出版时间的先后,采用文献考证法,对每部""说部丛书""的每种作品一一考辨,叙录每部作品的作者(著者与译者),版本,全录或摘录主要的章节目录,序跋,以及其他相关文献,如评述,作品广告等,由此形成一部内容翔实可信的集成性文献著作,具有重要的学术价值","否"
"1150880285","9787520345958,7520345955","西北少数民族地区国家通用语言文字教学问题研究 = Xibei shaoshu minzu diqu guojia tongyong yuyan wenzi jiaoxue wenti yanjiu","吕晓娟, author","2019","chi","Book","PrintBook","Di 1 ban",2,"中國社会科学出版社","Beijing","Chinese language Study and teaching,Minorities Education China Languages,Minorités Éducation Chine Langues,Han yu Shao shu min zu jiao yu Jiao xue yan jiu Xi bei di qu,China","","否"
"1246216227","9787520371506,7520371506","朱熹楚辞学研究","徐涓 (Researcher on Chinese philosophy), 1981- author","2021","chi","Book","PrintBook","Di 1 ban",1,"中国社会科学出版社","Beijing","Zhu, Xi, 1130-1200,Chu ci (Ancient Chinese poems),Chinese poetry History and criticism,Poésie chinoise Histoire et critique,Chinese poetry,Criticism, interpretation, etc","","否"
"1287077463","9787520390293,7520390292","""诗经""祭祀礼乐探索","张硕, author","2021","chi","Book","PrintBook","Di 1 ban",1,"中国社会科学出版社","Beijing","Shi jing,Memorial rites and ceremonies China History and criticism,Rites et cérémonies commémoratifs Chine Histoire et critique,Memorial rites and ceremonies,China,Criticism, interpretation, etc","本书以个案分析为主,在礼制时空背景下,分组还原十四首""诗经""祭祀礼乐的原始仪式功用.本书检讨传统""以礼解诗""法存在的随文求义,断章取义等弊端,提出并运用多重证据,立体,整体的""以礼解诗""法;意图在""礼""中完整地解读""诗"",而不是解剖式地""以诗证礼"".本书还尝试""以诗补礼"",由""诗""中呈现的仪式迹象,探索可能存在的祭祀礼制.如此,通过文,史,礼制结合的全方位阐释,不仅更新对""诗经""原意的认识,亦深化对""诗""与""礼""关系的研究","否"
"1125020006","9787520347334,7520347338","天府镜像与文学中国 : 当代四川多民族文学发展研究","余红艳, author","2019","chi","Book","PrintBook","Di 1 ban",2,"中國社会科学出版社","Beijing","Chinese literature China Sichuan Sheng History and criticism,Chinese literature Minority authors History and criticism,Chinese literature 20th century History and criticism,Littérature chinoise Chine Sichuan Histoire et critique,Littérature chinoise Auteurs issus des minorités Histoire et critique,Littérature chinoise 20e siècle Histoire et critique,Chinese literature,Chinese literature Minority authors,China Sichuan Sheng,Criticism, interpretation, etc,1900-1999","","否"
"1042358702","9787520321259,7520321258","浙东山区世界的审美表现 : 魏金枝小说创作研究 = Zhedong shanqu shijie de shenmei biaoxian","刘家思, author","2018","chi","Book","PrintBook","Di 1 ban",1,"中国社会科学出版社","Beijing","Wei, Jinzhi, 1900-1972 Criticism and interpretation,Chinese fiction 20th century History and criticism,Roman chinois 20e siècle Histoire et critique,Chinese fiction,Criticism, interpretation, etc,1900-1999","本书以浙东文化为视角, 对魏金枝小说创作做了较为系统的研究","否"
"1202695534","9787520365352,7520365352","传统与现代的冲突与调适 : 柳亚子文化人格研究 = The research on Liu Yazi's cultural personality : the conflict and adaptation between tradition and modernity","陈友乔, author","2020","chi","Book","PrintBook","Di 1 ban",1,"中国社会科学出版社","Beijing","Liu, Yazi, 1887-1958 Criticism and interpretation,Liu, Yazi, 1887-1958,Authors, Chinese,Écrivains chinois,Criticism, interpretation, etc","","否"
"1331300725","9787520395922,7520395928","时间困境与诗的超越 : 中国新诗的时间抒写","马春光, 1985, author","2022","chi","Book","PrintBook","Di 1 ban",2,"中国社会科学出版社","Beijing","Chinese poetry History and criticism,Poésie chinoise Histoire et critique,Chinese poetry,Criticism, interpretation, etc","本书以现代诗歌文本呈现的""时间观""为依据, 辨识出中国新诗""时间抒写""的多重取向, 在此基础上解释新诗历史发展的内在逻辑与动因. 在作者涉猎大量理论与诗歌文本的基础上, 本书提炼出新诗的若干时间主题, 对新诗的时间意象进行详细阐释, 对何其芳, 穆旦, 洛夫, 欧阳江河等个案展开深度剖析. 本书旨在阐明中国新诗与现代时间观念的深层互动关系, 以及新诗在这一过程中对生存现状的体认, 表达和对生存困境的诗意洞察, 为考察中国新诗史提供新的视野与方法, 进而总结出富有启发性的历史经验与艺术法则","否"
"1242031101","9787520310901,7520310906","二十世纪中国小说""隔膜""主题研究","郭运恒, author","2021","chi","Book","PrintBook","Di 1 ban",2,"中国社会科学出版社","Beijing","Chinese fiction 20th century History and criticism,Roman chinois 20e siècle Histoire et critique,Chinese fiction,Criticism, interpretation, etc,1900-1999","","否"
"1330420858","9787522700014,7522700019","元杂剧校勘研究","窦开虎, author","2022","chi","Book","PrintBook","Di 1 ban",2,"中國社会科学出版社","Beijing","Ju qu,Qu (Chinese literature) Yuan dynasty, 1260-1368 History and criticism,Juqu,Qu (Littérature chinoise) 1260-1368 (Dynastie des Yuan) Histoire et critique,Qu (Chinese literature),Yuan Dynasty (China),Criticism, interpretation, etc,1260-1368","本专著针对元杂剧校勘进行研究,具体内容包括九章:绪论部分,整体审视元杂剧校勘发展演变历程,总结元杂剧校勘本身所具有的文化特点;第一章是赵琦美""脉望馆钞校本古今杂剧""中校勘研究,考证赵琦美整理编选""脉望馆钞校本古今杂剧""过程,系统研究其校语;第二章是明清时期""西厢记""校勘研究,通过明清时期王骥德,凌潆初,张深之,毛奇龄""西厢记""校勘个案研究和比较研究,审视明清时期""西厢记""文本演变的一些规律;第三章是明清时期其他元杂剧校勘,主要围绕孟称舜""古今名剧合选""校语研究,何煌""脉望馆钞校本古今杂剧""校语研究和曲谱,曲论中的元杂剧校勘进行论述;第四章是王季烈""孤本元明杂剧""校勘,考证""孤本元明杂剧""整理出版过程,分析王季烈对这批杂剧的校勘;第五章是""元刊杂剧三十种""校勘研究,以郑骞,徐沁君,宁希元三家为研究个案,并对比研究;第六章是近现代以来""西厢记""校勘研究,以王季思,吴晓铃,张燕谨为个案,并对比分析;第七章为名家作品集校勘研究,对关汉卿,白朴,马致远为个案,并对关汉卿戏曲校勘进行比较分析;第八章是元杂剧选集校勘研究,以王学奇""元曲选校注""和王季思""全元戏曲""为中心进行个案研究和系统审视","否"
"1292055712","9787520391290,7520391299","孙梦雷文存","孙梦雷, author","2021","chi","Book","PrintBook","Di 1 ban",2,"中国社会科学出版社","Beijing","","孙梦雷是中国新文学开创期著名的小说家,1921年6月开始创作,1922年加入中国共产党,随后在北京加入文学研究会,并接连在""小说月报""""东方杂志""""文学周报""等报刊上发表了多篇短篇小说,初步显示了他的文学才华.1927年9月,他创作出版了长篇小说""英兰的一生"",这是新文学1922-1927年间长篇小说的时代性标志与重要收获.为新文学的长篇小说的现代转型做出了有益的贡献.小说描写细腻,寓意深刻,情节紧凑,线索清晰,结构均称完整,人物形象栩栩如生,其中的女主人公英兰,堪称那个时代无数农村青年妇女不屈服于命运的安排,向旧世界挑战抗争的悲剧典型.1937年4月5日,孙梦雷因病去逝,年仅33岁.""孙梦雷文存""搜集了孙梦雷散见于各刊的几乎全部作品,为中国新文学留下一份宝贵的文学史料","否"
