"oclc编号 - oclcNumber","书号 - isbns","书名 - title","作者 - creator","出版日期 - publicationDate","语言 - catalogingLanguage","格式 - generalFormat","详细格式 - specificFormat","版本 - edition","总版本数 - totalEditions","出版社 - publisher","出版地 - publicationPlace","主题 - subjects","简介 - summaries","是否同行审阅 - peerReviewed"
"1090488739","9787520327183,7520327183","张爱玲电影剧本研究","赵秀敏, author","2018","chi","Book","PrintBook","Di 1 ban",3,"中国社会科学出版社","Beijing","Zhang, Ailing Criticism and interpretation,Zhang, Ailing,Chang, Eileen, 1920-1995 Oeuvres Cinéma,Motion picture plays, Chinese History and criticism,Scénarios de cinéma chinois Histoire et critique,Motion picture plays, Chinese,Criticism, interpretation, etc","张爱玲于电影剧本创作的卓越成就鲜少为世人所知, 是为张爱玲创作研究的一个盲点或者'黑洞'.本书从张爱玲电影原创剧本的数量, 搬上银幕的数量, 上座率, 票房记录, 接受者的反映, 内容分析, 艺术分析, 电影技法分析等, 以翔实充分的史实, 得出综合指数判断:张爱玲是中国电影编剧家中的女性先驱, 是女性电影编剧家中杰出的'第一人'.本书引言部分对张爱玲从1946至1965凡20年间创作的电影进行爬梳和整合, 从量到质观照这位杰出电影编剧横卓一个时代的'电影神话';第一章对张爱玲电影艺术观进行梳理评价;第二章从文化分析角度, 论析张爱玲独步一时的电影人物镜像构建;第三章从艺术分析角度, 论析张爱玲电影的喜剧叙事策略;第四章从电影技巧上, 论析张爱玲之于电影创作的才禀以及对电影语言的通透.本书力将中国电影整体发展做为论述的大背景, 为张爱玲影像研究开启全新的研究领域","否"
"1103147524","9787520340199,7520340198","张爱玲晚期写作研究","程小强, 1982- author","2019","chi","Book","PrintBook","Di 1 ban",3,"中国社会科学出版社","Beijing","Zhang, Ailing Criticism and interpretation,Zhang, Ailing,Criticism, interpretation, etc","","否"
"1080342268","9787520333856,752033385X","中国新文学史写作编年研究 : 1919-1949","张军 (Writer on Chinese literature), author","2018","chi","Book","PrintBook","Di 1 ban",3,"中国社会科学出版社","Beijing","Chinese literature History and criticism 20th century,Authorship,Littérature chinoise Histoire et critique 20e siècle,Art d'écrire,authorship,Zhong guo wen xue Xian dai wen xue shi Wen xue shi yan jiu 1919-1949,Chinese literature,Criticism, interpretation, etc,1900-1999","Detailed summary in vernacular filed,广义的中国新文学史写作, 包含中国新文学史著的编纂和相关文学史论文的撰写. 本书将以编年体形式展现1919- 1949年海内外的中国新文学史写作大致历程. 一方面, 对已经搜集到的每一文学史著与文学史论文依次编年展示, 同时简介它们的著者,出版社,出版时间,版本,开本,页数,字数等, 并对其重要的创新点进行提示性评述. 另一方面, 本书将这三十年的中国新文学史写作分为三个时期, 并以此编为三章. 每章之前概论每一时段中国新文学史写作的发展概貌,范型特点, 最后一章则对中国新文学史写作进行历史规律总结. 对于影响中国新文学史写作的重大政治,经济,文化事件本书也会适当提及, 以求诠解中国新文学史写作嬗替更迭的内外部原因","否"
"1134985844","9787520354486,7520354482","钱谦益佛教文献与文学研究","王彦明, 1982- author","2020","chi","Book","PrintBook","Di 1 ban",2,"中国社会科学出版社","Beijing","Qian, Qianyi, 1582-1664 Criticism and interpretation,Qian, Qianyi, 1582-1664,Buddhist literature History and criticism,Chinese poetry Qing dynasty, 1644-1912 History and criticism,Littérature bouddhique Histoire et critique,Poésie chinoise 1644-1912 (Dynastie des Qing) Histoire et critique,Buddhist literature,Chinese poetry,Qing Dynasty (China),Criticism, interpretation, etc,1644-1912","钱谦益身为明末清初的东林党魁和文坛盟主, 受地域, 家族, 师友的影响, 他自幼深受佛教熏染, 青年缚禅, 晚明佞佛日深, 完成了""楞严经疏解蒙钞""等佛学巨著, 成为名震一时的佛教居士.钱谦益奉佛史迹老, 详细考察了钱谦益的佛教渊源, 奉佛历程, 梳理了他与禅宗, 华严宗, 天台宗, 净土宗的佛教交游, 揭示了破山寺鹤如禅师去留之争和钱氏家难之间的关系","否"
"1101516975","9787520340977,752034097X","《满洲报》小说研究","赵寰宇, author","2019","chi","Book","PrintBook","Di 1 ban",3,"中国社会科学出版社","Beijing","Manzhou bao,Chinese fiction 20th century History and criticism,Roman chinois 20e siècle Histoire et critique,Xiao shuo yan jiu Zhong guo Xian dai,Chinese fiction,China History Republic, 1912-1949,Chine Histoire 1912-1949 (République),China,History,Criticism, interpretation, etc,1900-1999","在孕育东北文学的诸多报章中, ""满洲报""占据着重要的位置, 是东北历史上一份有重要影响的报纸.在""满洲报""诸多的文学史料中, 小说创作尤其值得关注.""满洲报""的小说家新老并存, 有受传统文化浸润的旧式文人, 也有受新思潮熏陶的新派作家.""满洲报""刊载的小说面对现实, 反映现实, 描写了旧时代东北地区民众的生存状态, 反映了特殊时期的世相人情和民族文化心态.从文学史研究角度, ""满洲报""小说勾勒出东北小说发展的原生态图景, 见证了东北近现代新旧小说交融发展的历史变迁, 对了解东北地区二十世纪二三十年代这一特定历史时期的文学活动面貌有着积极的意义","否"
"1126341408","9787520349338,7520349330","当代长篇小说的桂冠 : 莫言长篇小说研究","老悟, author","2019","chi","Book","PrintBook","Di 1 ban",1,"中国社会科学出版社","Beijing","Mo, Yan, 1955- History and criticism,Mo, Yan, 1955- Criticism and interpretation,Moyan, (1955-) Xiaoshuoyanjiu,Mo, Yan, 1955-,Chinese fiction 20th century History and criticism,Roman chinois 20e siècle Histoire et critique,Xiao shuo yan jiu Zhong guo Xian dai,Chinese fiction,Criticism, interpretation, etc,1900-1999","本书对莫言的11部 (全部) 长篇小说进行了研究, 包括总体研究和个案研究两部分: 总体研究把莫言的11部长篇小说作为一个整体, 从内容, 美学特征, 主题, 艺术表现, 传承, 意义和价值等方面对之进行了研究; 个案研究对每一部小说分别从其内容梗概, 人物形象, 主题, 艺术表现, 不足之处等方面进行了研究; 既有研究者的个人心得, 又有对小说文本以及学界专家真知灼见的引述... 因此, 既具有较高的学术价值--它既是对莫言全部长篇小说的一次 '集约型', 全方位的研究, 又是对莫言长篇小说进行进一步研究的基础; 又具有普适性--它语言通俗流畅, 内容全面而又简明, 扼要","否"
"1045034892","9787520323000,7520323005","为70年代小说拼图 : 20世纪70年代小说的整理与研究","李雪, 1984- author","2018","chi","Book","PrintBook","Di 1 ban",2,"中国社会科学出版社","Beijing","Chinese fiction 20th century History and criticism,Roman chinois 20e siècle Histoire et critique,Xiao shuo yan jiu Zhong guo Dang dai,Chinese fiction,Criticism, interpretation, etc,1900-1999","本书以1972年至1977年公开发表的小说为整理,研究对象, 强调整理小说篇目,校对发表时间及版本,考察作者身份,划分小说题材等基础工作的重要性, 主张依靠第一手材料接近文学现场,考察历史细节, 从而将对七十年代文学的研究引向"" 微观"" 研究. 全书分上,下编: 上编对七十年代文学的研究意义与方法进行讨论, 依据大量史料细述关于七十年代小说的"" 故事"" , 试图绘制七十年代文学的地形图; 下篇对七十年代的文学期刊,小说篇目进行了整理,汇编和说明, 以期为其他相关研究提供资料支持","否"
"1085502107","9787520307680,7520307689","中古乐府广义","胡大雷, author","2018","chi","Book","PrintBook","Di 1 ban",2,"中国社会科学出版社","Beijing","Yue fu (Chinese poetry) History and criticism,Chinese poetry History and criticism,Yuefu (Poésie chinoise) Histoire et critique,Poésie chinoise Histoire et critique,Chinese poetry,Yue fu (Chinese poetry),Criticism, interpretation, etc","","否"
"1162233195","9787520356275,7520356272","中国新文学史上的西南联大与「鲁艺」","施新佳, 1982- author","2019","chi","Book","PrintBook","Di 1 ban",2,"中国社会科学出版社","Beijing","Xi nan lian he da xue (Kunming Shi, China),Yan'an Lu Xun yi shu xue yuan,Chinese literature History and criticism,Littérature chinoise Histoire et critique,Chinese literature,Criticism, interpretation, etc","西南联大与""鲁艺""同年成立, 两者都在战争的硝烟中守护和传承着中华民族的文化精髓, 有着共同的推动社会进步的精神向度, 但两校文学在主题内容, 文体类别, 话语风格方面大相径庭.西南联大秉承学院派的通识教育, 延续并发展精英文学传统, 希冀以优美的文学作品改造人心, 影响社会;""鲁艺""坚持实践化教育, 形塑的是解放区新生活, 新人物和新秩序, 把文学的社会动员功能放大到极致.虽然, 两校的文学取向明显不同, 很难用统一的尺度衡量, 但它们都在中国新文学史上书写了浓墨重彩的一笔, 并对此后的文学产生了深远影响.梳理和解读其背后潜隐的信息符码, 不仅有着重要的理论价值和现实意义, 也能为未来的文学创作提供话语支持","否"
"1133774391","9787520351263,7520351262","八十年代文学史料研究","程光炜","2019","chi","Book","PrintBook","Di 1 ban",3,"中國社会科学出版社","Beijing","Chinese literature 20th century History and criticism,Littérature chinoise 20e siècle Histoire et critique,Chinese literature,Criticism, interpretation, etc,1900-1999","经过三十年的历史沉淀, 八十年代文学的史料价值已经凸显出来. 从中国当代文学学科发展来看, ""史料学""建设是必不可少的. 为此, 中国人民大学程光炜教授及其研究团队近些年在这个领域花费很大精力搜集资料, 加以分类, 甄别和整理, 在国内核心学术期刊""文艺争鸣"", ""当代作家评论"", ""中国现代文学研究丛刊""发表了不少研究成果. 这些成果, 获得了学界的好评, 被认为是八十年代文学史料研究的最新成绩. 本书所选论文,采取以史料为依据, 以事实为出发点, 史论结合的研究方法, 发幽抉微, 对诸多文学现象, 思潮, 流派的史料进行了大规模的开掘, 对不少著名小说家鲜为人知的生平事迹, 也做了非常充分的调查研究, 为八十年代文学的""史料学""奠定了坚实的基础","否"
"1141103163","9787520356039,7520356035","朱熹文学与佛禅关系研究","邱蔚华, 1976- author","2019","chi","Book","PrintBook","Di 1 ban",2,"中国社会科学出版社","Beijing","Zhu, Xi, 1130-1200 Criticism and interpretation,Zhu, Xi, 1130-1200,Chinese literature Song dynasty, 960-1279 History and criticism,Zen Buddhism in literature,Zen Buddhism China History,Littérature chinoise 960-1279 (Dynastie des Song) Histoire et critique,Bouddhisme zen dans la littérature,Bouddhisme zen Chine Histoire,Song Dynasty (China),Chinese literature,Zen Buddhism,China,Criticism, interpretation, etc,History,960-1279","","否"
"1028930555","9787520314534,7520314537","简帛文献与诸子时代文学思想研究","杨隽, author","2018","chi","Book","PrintBook","Di 1 ban",2,"中國社会科学出版社","Beijing","Inscriptions, Chinese History and criticism,Manuscripts, Chinese History,Chinese literature To 221 B.C. History and criticism,Inscriptions chinoises Histoire et critique,Littérature chinoise Jusqu'à 221 av. J.-C. Histoire et critique,Chinese literature,Inscriptions, Chinese,Manuscripts, Chinese,Criticism, interpretation, etc,History,To 221 B.C","上博简, 清华简, 郭店简, 马王堆汉墓简帛集成等大量出土文献是对传世文献的补充, 并且这些简帛文献集中反映了儒, 道两家的哲学思想, 文学思想, 因此本书立足于传世文献, 充分结合简帛文献, 重点考察西周礼乐""演诗""文化对诸子时代儒道群体政治思想, 人生追求, 审美理想的深刻影响","否"
"1042362729","9787520322683,7520322688","""先锋""与""民间"" : 20世纪中国文学话语研究","刘继林, 1976- author","2018","chi","Book","PrintBook","Di 1 ban",2,"中国社会科学出版社","Beijing","Chinese literature History and criticism 20th century,Chinese poetry 20th century History and criticism,Littérature chinoise Histoire et critique 20e siècle,Poésie chinoise 20e siècle Histoire et critique,Zhong guo wen xue Dang dai wen xue Wen xue yan jiu,Chinese literature,Chinese poetry,Criticism, interpretation, etc,1900-1999","本书围绕20世纪中国文学的"" 先锋"" 和"" 民间"" 话语展开, 从话语理论的探讨和批评实践的历史出发, 结合20世纪中国文学研究, 湖北地域文学批评等前沿问题, 将经典作家作品个案解读, 特殊文学现象思潮研究, 整体社会历史文化观照等统摄起来, 为我们审视中国20世纪文学历史提供一定的学理参照和方法借鉴,本书围绕20世纪中国文学的"" 先锋"" 和"" 民间"" 话语展开, 从话语理论的探讨和批评实践的历史出发, 结合20世纪中国文学研究, 湖北地域文学批评等前沿问题, 将经典作家作品个案解读, 特殊文学现象思潮研究, 整体社会历史文化观照等统摄起来, 为我们审视中国20世纪文学历史提供一定的学理参照和方法借鉴","否"
"1143801125","9787520349840,7520349845","新中国甲骨学七十年 (1949-2019) = The 70-year study on oracle bone inscription in contemporary China (1949-2019)","王宇信, 1940- author","2019","chi","Book","PrintBook","Di 1 ban",1,"中国社会科学出版社","Beijing","Inscriptions, Chinese History and criticism,Oracle bones,Inscriptions chinoises Histoire et critique,Os divinatoires,Inscriptions, Chinese,Criticism, interpretation, etc","","否"
"1134985177","9787520350730,7520350738","20世纪初中国小说中的西方形象 = Images of the West in the Chinese fiction of the early 20th century","邹小娟 (Literature teacher) author","2019","chi","Book","PrintBook","Di 1 ban",2,"中國社会科学出版社","Beijing","Chinese fiction 20th century History and criticism,Chinese fiction Western influences,Noncitizens in literature,Foreign countries in literature,Roman chinois 20e siècle Histoire et critique,Roman chinois Influence occidentale,Pays étrangers dans la littérature,Chinese fiction,Criticism, interpretation, etc,1900-1999","本书主要研究了20世纪第一个十年中国小说中的西方形象.在中西文化碰撞的具体历史和文化语境下,通过文本细读晚清重要作家的代表作,梳理和分析了不同小说中的西方形象及其特点,以及西方形象形成的原因与自我形象的内在关系","否"
"1104275518","9787520341622,7520341623","网络文学批评理论与实践","欧阳友权","2019","chi","Book","PrintBook","Di 1 ban",2,"中国社会科学出版社","Beijing","Literature and the Internet,Chinese literature 20th century History and criticism,Littérature chinoise 20e siècle Histoire et critique,Wang luo wen xue Wen xue ping lun Zhong guo Wen ji,Chinese literature,Criticism, interpretation, etc,1900-1999","该书是一部网络文学批评论文集, 由74篇论文组成. 内容包括四个部分: 1. 网络文学批评原理(18篇); 2. 网络文学评价体系(21篇); 3. 网络文学批评标准(15篇); 4. 网络文学批评实践(20篇). 所收录文章均系国内重要学术期刊和报纸理论版公开发表的网络文学评论文章, 涉及的65位作者为我国网络文学理论批评界的一线学人. 网络文学批评标准, 评价体系研究一直是网络文学评价的焦点问题, 探讨它的基本理论, 实施网络作品的批评实践, 对网络文学健康发展意义重大. 这将是我国在该领域的第一本论文集萃, 代表了当下我国在这一领域的前沿水平","否"
"1056969659","9787520322959,7520322955","""四書化""與""去四書化"" : 儒學經典在""近世""中日兩國的不同際遇","董灝智, author","2018","chi","Book","PrintBook","Di 1 ban",3,"中国社会科学出版社","Beijing","Si shu,Chinese classics Study and teaching China History,Philosophy, Confucian China,Chinese classics Study and teaching Japan History,Philosophy, Confucian Japan,Classiques (Littérature chinoise) Étude et enseignement Chine Histoire,Philosophie confucéenne Chine,Classiques (Littérature chinoise) Étude et enseignement Japon Histoire,Philosophie confucéenne Japon,Chinese classics Study and teaching,Philosophy, Confucian,China,Japan,History","","否"
"1085500220","9787520334181,752033418X","簡牘日書文獻語言研究","張國艷 (Researcher on Chinese language), author","2018","chi","Book","PrintBook","Di 1 ban",4,"中国社会科学出版社","Beijing","Ri shu,Ri shu Yan jiu,Inscriptions, Chinese China,Occultism China,Inscriptions chinoises Chine,Occultisme Chine,Jian (kao gu) Yu yan xue Yan jiu Zhong guo,Inscriptions, Chinese,Occultism,China History Qin dynasty, 221-207 B.C. Sources,Chine Histoire 221-207 av. J.-C. (Dynastie des Qin) Sources,China,History,Sources,221-207 B.C","","否"
"1126341038","9787520341615,7520341615","当代中国网络文学批评史","欧阳友权, author","2019","chi","Book","PrintBook","Di 1 ban",3,"中国社会科学出版社","Beijing","Chinese literature 20th century History and criticism,Chinese literature 21st century History and criticism,Literature and the Internet China,Littérature chinoise 20e siècle Histoire et critique,Littérature chinoise 21e siècle Histoire et critique,Chinese literature,Literature and the Internet,China,Criticism, interpretation, etc,1900-2099","本书系统梳理了1949-2015年当代中国网络文学批评的发展情况. 全书分为上下编, 上编侧重网络文学批评的历史呈现, 从文本形态, 批评主体, 传播方式等角度, 对网络文学批评做了系统的分析; 下编则侧重以批评理论解读网络文学批评观念, 批评标准, 批评功能, 批评影响力. 同时, 本书的导言强调网络文学必须入正统文学史, 结语又对网络文学批评做了进一步追问, 对于当代中国网络文学研究来说, 批评是必不可少的环节, 而欧阳友权教授长期从事网络文学研究, 是当今学界网络文学方面研究权威","否"
"1046969692","9787520323994,7520323994","激情的样式 : 20世纪80年代女性写作","田泥, 1966- author","2018","chi","Book","PrintBook","Di 1 ban",2,"中国社会科学出版社","Beijing","Feminist literature China History and criticism,Chinese literature 20th century History and criticism,Feminist literature China,Chinese literature Women authors History and criticism,Women authors, Chinese 20th century,Féminisme Documentation Chine Histoire et critique,Littérature chinoise 20e siècle Histoire et critique,Féminisme Documentation Chine,Zhong guo wen xue Dang dai wen xue Fu nü wen xue Wen xue yan jiu,Chinese literature,Chinese literature Women authors,Feminist literature,Women authors, Chinese,China,Criticism, interpretation, etc,1900-1999","","否"
"1041906561","9787520324250,7520324257","19世纪《三国演义》英译文献研究","王燕 (College teacher), author","2018","chi","Book","PrintBook","Di 1 ban",2,"中国社会科学出版社","Beijing","Luo, Guanzhong, approximately 1330-approximately 1400. Translations into English History and criticism,San guo zhi yan yi (Luo, Guanzhong),Chinese literature Translations into English,Chinese literature,Criticism, interpretation, etc,Translations","1807年, 随着第一位新教传教士马礼逊的来华, 中国古典小说开始大规模地踏上西行之旅. 在"" 四大名著"" 中, 十九世纪英语世界对于""三国演义""的译介最为重视. 最近几年, 学界开始关注这批用英语撰写的""三国演义""文章, 只是由于相关资料或者刊载于""亚洲杂志"", ""中国丛报"", ""中国评论"", ""教务杂志""等罕见的英文报刊, 或者发表在""拾级大成"", ""中国对话""等早期汉语教材, 而这些英文报刊或汉语教材主要收藏在哈佛大学图书馆, 伦敦大学亚非学院图书馆等欧美各地, 搜集起来相当困难, 所以国内的相关研究错漏百出, 举步维艰, 作者近十年来于香港中文大学, 美国伊利诺伊大学, 英国伦敦大学, 日本关西大学等海外大学访学, 期间搜集到20余种罕见的19世纪英译""三国""资料, 并对其进行了系统整理和深入研究","否"
"1086280983","9787520323277,7520323277","20世纪中国文学理论批评的现代转型","赖大仁, author","2018","chi","Book","PrintBook","Di 1 ban",2,"中国社会科学出版社","Beijing","Chinese literature History and criticism Theory, etc,Chinese literature 20th century History and criticism,Criticism History 20th century,Littérature chinoise Histoire et critique Théorie, etc,Littérature chinoise 20e siècle Histoire et critique,Critique Histoire 20e siècle,Zhong guo wen xue Wen xue ping lun 20 shi ji,Chinese literature,Criticism,Criticism, interpretation, etc,History,1900-1999","Ben shu dui 20 shi ji zhong guo wen xue li lun pi ping de xian dai zhuan xing jin xing zheng ti guan zhao, miao shu qi xian dai zhuan xing fa zhan de li shi jin cheng, shu li he ping xi qi zhong zui you dai biao xing de li lun xing tai, ba wo xian dai wen xue li lun pi ping zhuan xing fa zhan de zhu yao qu xiang, kao cha xian dai wen xue li lun pi ping xing tai jian gou yu shi dai bian ge fa zhan yao qiu zhi jian de guan xi,本书对20世纪中国文学理论批评的现代转型进行整体观照, 描述其现代转型发展的历史进程, 梳理和评析其中最有代表性的理论形态, 把握现代文学理论批评转型发展的主要趋向, 考察现代文学理论批评形态建构与时代变革发展要求之间的关系.在此基础上, 对新时期以来文学理论批评再次变革转型的发展趋向, 以及当代文学理论批评创新建构所面临的问题进行探讨.力求用当代意识观照历史, 从历史视野观照现实, 在历史性与当代性的双向观照中","否"
"1157963846","9787520360944,7520360946","北美「留学生作家群」后期写作研究","彭贵昌, 1989-, author","2020","chi","Book","PrintBook","Di 1 ban",2,"中国社会科学出版社","Beijing","Chinese literature United States History and criticism,Chinese literature Taiwan History and criticism,Littérature chinoise États-Unis Histoire et critique,Littérature taiwanaise Histoire et critique,Chinese literature,United States,Taiwan,Criticism, interpretation, etc","","否"
"1137080272","9787520352949,7520352943","南宋孝宗时期词风嬗变研究","陈丽丽, author","2019","chi","Book","PrintBook","Di 1 ban",2,"中国社会科学出版社","Beijing","Ci (Chinese poetry) History and criticism,Chinese poetry Song dynasty, 960-1279 History and criticism,Ci (Poésie chinoise) Histoire et critique,Poésie chinoise 960-1279 (Dynastie des Song) Histoire et critique,Chinese poetry,Ci (Chinese poetry),Song Dynasty (China),Criticism, interpretation, etc,960-1279","","否"
"1032364794","9787520307208,7520307204","清代三家""诗""文献研究","房瑞丽, author","2018","chi","Book","PrintBook","Di 1 ban",2,"中国社会科学出版社","Beijing","Shi jing,Chinese poetry Qing dynasty, 1644-1912 History and criticism,Poésie chinoise 1644-1912 (Dynastie des Qing) Histoire et critique,Chinese poetry,Qing Dynasty (China),Criticism, interpretation, etc,1644-1912","本书主要由清代三家""诗""文献研究概论,清代三家""诗""文献辑佚研究,清代三家""诗遗说大义阐释和清代三家""诗""文献融合研究等几个部分组成. 本书对清代三家""诗""文献研究的前期准备和外部特征进行宏观考察, 对清代三家""诗""的文献辑佚成果进行详细的分类,成果总结和辑佚特征及辑佚观念进行深入研究. 清儒对三家""诗""大义的发挥则属于经学阐释理论, 有发挥"" 圣贤之道"" 的诗教阐释和申发三家""诗""中的"" 微言大义"" 的经世致用两种. 而清代三家""诗""文献研究的最终目的即补充和发明毛义, 因而最终四家""诗""走向融合成为清代""诗经""文献研究的必然趋势","否"
"1110668237","9787520343961,7520343960","北宋墓志碑铭撰写研究 = The research on writing epitaphs in Northern Song dynasty","仝相卿, author","2019","chi","Book","PrintBook","Di 1 ban",2,"中国社会科学出版社","Beijing","Inscriptions, Chinese History and criticism,Chinese literature Song dynastry, 960-1279 History and criticism,Inscriptions chinoises Histoire et critique,Chinese literature,Inscriptions, Chinese,Criticism, interpretation, etc,960-1279","","否"
