"oclc编号 - oclcNumber","书号 - isbns","书名 - title","作者 - creator","出版日期 - publicationDate","语言 - catalogingLanguage","格式 - generalFormat","详细格式 - specificFormat","版本 - edition","总版本数 - totalEditions","出版社 - publisher","出版地 - publicationPlace","主题 - subjects","简介 - summaries","是否同行审阅 - peerReviewed"
"1348592385","9787522707693,7522707692","洪亮吉诗歌研究","邱林山, author","2022","chi","Book","PrintBook","Di 1 ban",2,"中国社会科学出版社","Beijing","Hong, Liangji, 1746-1809,Chinese poetry Qing dynasty, 1644-1912 History and criticism,Poésie chinoise 1644-1912 (Dynastie des Qing) Histoire et critique","洪亮吉是清代的朴学大师,又是乾嘉文坛的巨子,以词章考据著称于世.本文首先从诗歌要素论,诗歌本体论,诗歌功能论,诗歌创作论四个方面阐述了洪亮吉的诗学理论体系.其次,采取知人论世,纵横比较的研究方法,结合洪亮吉的生平交游,思想个性和创作心态,对其诗歌按题材进行分类研究,揭示其诗歌创作的艺术特征和外在风貌,进而把握其诗风演变的轨迹与规律.在此基础上,对洪亮吉的其他文体创作及学术研究进行简要评析,并将其置于乾嘉文坛的背景下衡定其在文学史上的地位和影响","否"
"1128035612","9787520352215,7520352218","天津方言历史演变及相关问题研究","王临惠, -1960- author","2019","chi","Book","PrintBook","Di 1 ban",1,"中国社会科学出版社","Beijing","Mandarin dialects China Tianjin Chinese,China Tianjin","本书在对天津市10个方言点进行深入,系统调查的基础上分专题讨论了天津方言的特点及其历史演变问题,内容涉及知系字,阴平调,入声字等,并在此基础上结合历史文献深入探究了天津方言的源流关系以及'中原音韵'的基础方言等问题,认为天津方言不是移民方言,其底层是近代分布在这里的冀鲁官话,形成发展过程中受到了北京,东北等方言的影响和干扰,'中原音韵'沉淀着较为丰富的历史层次,没有单一的基础方言,并不是一时一地方言的产物,而是一个杂糅的系统等","否"
"1373814334","9787522700427,7522700426","中国新诗理论的现代品格","吴思敬, author","2022","chi","Book","PrintBook","Di 1 ban",2,"中国社会科学出版社","Beijing","Chinese poetry 20th century History and criticism Theory, etc,Chinese poetry 20th century History and criticism,Poésie chinoise 20e siècle Histoire et critique Théorie, etc,Poésie chinoise 20e siècle Histoire et critique,Chinese poetry,Criticism, interpretation, etc,1900-1999","中国新诗理论的现代品格""收录了笔者所写的有关新诗理论的文章45篇,分为5辑.第一辑:""新诗理论:回顾与思考"":本辑文章立足于新世纪大文化环境的背景,对百年来中国新诗理论的发展历程进行梳理与反思,并对其中的某些规律性的东西予以探讨,对中国新诗的传统,中国新诗理论的基本品格,中国新诗理论的历史发展,中国新诗理论的现代转型加以阐述,对相关的理论流派予以介绍,以期引起大家对新世纪中国新诗理论建设的进一步思考.第二辑:""当代诗歌:历史与现状"":本辑文章一方面结合中国诗歌通史当代卷的写作,对中国当代诗歌的发展进行梳理,并对其中涉及的理论性问题予以探讨;另一方面则把眼光投射到当代诗坛,考察当下中国的诗歌生态,对改革开放以来的当代诗歌现象予以追寻与剖析.第三辑:诗歌评论家群像:对新诗理论史上有代表性的评论家如胡风,艾青,蒲风,任钧,阿垅等加以介绍的同时,对新时期以来涌现的以谢冕,孙绍振为代表的老中青三代诗评家群体予以关注.对不同时代评论家理论的阐释与个性的介绍,可丰富与加深对中国新诗理论现代化进程的理解.第四辑:诗歌理论著作述评:选择当代诗评家有代表性的著作予以评论,力求实事求是,客观公正,从而使对中国新诗理论史的研究深入到文本的层次.第五辑:""诗探索""与我:介绍笔者与诗歌理论刊物""诗探索""的学术情缘.笔者1983年介入""诗探索""的编辑工作,1994年后任""诗探索""主编,投入了大量的精力,历经艰难,甘苦自知,所写内容可供读者了解与研究""诗探索""参考","否"
"1341046907","9787520397636,7520397637","故事机变 = The adaptive story mechanics","施爱东, author","2022","chi","Book","PrintBook","Di 1 ban",1,"中国社会科学出版社","Beijing","Chinese literature History and criticism,Littérature chinoise Histoire et critique,Chinese literature,Criticism, interpretation, etc","","否"
"1201376753","9787520371278,7520371271","桂东南粤语与壮语体貌范畴的比较研究","黄美新, author","2020","chi","Book","PrintBook","Di 1 ban",2,"中国社会科学出版社","Beijing","Cantonese dialects China Guangxi Zhuangzu Zizhiqu,Zhuang language China Guangxi Zhuangzu Zizhiqu,Cantonais (Dialectes) Chine Guangxi,Zhuang (Langue) Chine Guangxi,Cantonese dialects,Zhuang language,China Guangxi Zhuangzu Zizhiqu","","否"
"1331300372","9787520399777,752039977X","现代汉语词汇多角度探索","刘云, author","2022","chi","Book","PrintBook","Di 1 ban",2,"中國社会科学出版社","Beijing","Chinese language Lexicology,Chinese language Terms and phrases,Chinois (Langue) Lexicologie,Chinese language,Dictionaries","本书尝试从不同的角度探索现代汉语词汇的特点,从语言运用,新词新语,语言演化,统计计量和信息处理等角度多视角,多侧面地探索现代汉语词汇.主要内容为:(1)如何确定现代汉语""词""的问题,包括词与语素,短语的纠结与离析,频率对词感的制约.(2)从语言运用的视角,包括词汇的嬗变,术语的泛化,特征词的跨域使用以及词汇的语码夹用.(3)从新词新语的视角,包括""被X""词族,""裸X""词族,""X门""词族和""零X""词族.(4)从语言演化的视角,包括跨层结构""之X""的词汇化,定中""V双+N双""词汇化,新兴结构""是时候VP""以及转喻构词研究.(5)从统计计量的视角,包括词汇的统计研究,构词的计量研究和复句关系词语的离析度.(6)从信息处理的视角,包括词表研究,合成词结构数据库的开发应用以及汉语特征词的研究","否"
"1286617301","9787520387743,7520387747","体验与文学 : 比较意义上的中西方文学观 = Experience and literature : a comparative view of Chinese and western literature","张奎志, author","2021","chi","Book","PrintBook","Di 1 ban",1,"中国社会科学出版社","Beijing","Comparative literature Chinese and Western,Chinese literature History and criticism,Littérature comparée Chinoise et occidentale,Littérature chinoise Histoire et critique,Chinese literature,Comparative literature,Criticism, interpretation, etc","","否"
"1112360443","9787520346573,7520346579","畲族山歌的跨文化研究","杜丽娉, 1970- author","2019","chi","Book","PrintBook","Di 1 ban",2,"中国社会科学出版社","Beijing","Folk poetry, Chinese,She (Chinese people) Songs and music,She (Chinese people) Language,Folk songs, Chinese China History and criticism,Folk songs, Chinese,She (Chinese people),China,Criticism, interpretation, etc,Songs and music","","否"
"1264712536","9787520354233,7520354237","女作家作者身份焦虑空间性阐释 = The spatial interpretation about female writers' anxiety of authorship","沈潇, 1985- author","2019","chi","Book","PrintBook","Di 1 ban",1,"中国社会科学出版社","Beijing","Literature Women authors History and criticism,Women authors Social conditions Psychological aspects,Women and literature History,Women authors Psychology,Écrits de femmes Histoire et critique,Femmes et littérature Histoire","","否"
"1331299451","9787522700458,7522700450","现代汉语话语标记系统与认知研究 = Research on the system of discourse markers and cognition of modern Chinese","周明强, 1956- author","2022","chi","Book","PrintBook","Di 1 ban",2,"中國社会科学出版社","Beijing","Chinese language Discourse analysis,Chinese language Grammar,Discourse markers,Chinois (Langue) Analyse du discours,Chinois (Langue) Grammaire,Marqueurs du discours","本书从现代汉语的实际出发,通过对语料库大量语料的分类,统计,分析,整理完善了现代汉语话语标记系统的四大层次,两个大类,9个次类,41小类,132次小类,收入498个话语标记,揭示了各类话语标记在系统层次中的位置;利用语料库穷尽性的语料重点分析了使用频率高的话题性,衔接性,理据性,表态性,陈情性,示意性等6大类话语标记的结构特点,使用模式,语用功能;并利用问卷调查取得的数据,重点讨论了疑问性,坦言性,埋怨性,断言性,强调性等5类话语标记的语用功能与认知情况.本书超强的系统性,大量而全面的数据统计,扎实的描写,成功到位的解释对人们全面了解和深入研究现代汉语话语标记都具有重要的参考价值","否"
"1360558283","9787522710747,752271074X","汉语诗歌节奏、声韵及新诗体式建构","张中宇, 1963- author","2022","chi","Book","PrintBook","Di 1 ban",2,"中国社会科学出版社","Beijing","Chinese poetry History and criticism,Poésie chinoise Histoire et critique","本专著全面研究汉语诗歌节奏形成原理(第一部分),""声""(声调)对汉语诗歌节奏的优化作用(第二部分),汉语诗""韵""的主要功能(第三部分),以此为基础延及汉语新诗体式建构与优化(第四部分),以及总述与展望(第五部分).本专著以历代诗学及现代以来如朱光潜,王力等相关论著的成就为基础,立足于汉语语言的个性与中国诗学传统,通过中外比较,全面阐释汉语诗歌节奏类型及形成原理,首次提出依汉语声调形成的平仄律其根本功能为改善,提升汉语诗节奏平,首次系统论证汉语诗""韵""三大功能,比较系统探讨汉语新诗体式建构的多种可能性","否"
"1111646158","9787520340151,7520340155","近代汉语象声词研究 = On onomatope in morden Chinese","赵爱武, author","2019","chi","Book","PrintBook","Di 1 ban",2,"中国社会科学出版社","Beijing","Chinese language Etymology,Chinois (Langue) Étymologie","本书主要研究了近代汉语象声词的语音结构, 语义特征, 语法功能及修辞功能, 考察了汉语象声词生动形式的产生和发展, 总结了近代汉语象声词演变的动因以及象声词生动形式产生的机制.本书的研究思路是以近代汉语为基点, 结合古代汉语和现代汉语从历时和共时两个层面上对汉语象声词展开研究.研究方法是在详尽描写的基础上争取做到充分解释","否"
"1286617097","9787520383936,7520383938","满-通古斯诸语狩猎词研究","崔宝莹, author","2021","chi","Book","PrintBook","Di 1 ban",2,"中国社会科学出版社","Beijing","Manchu language,Jurchen language,Tungus-Manchu languages,Hunting China Manchuria History,Mandchou (Langue),Jürchen (Langue),Langues toungouses,Chasse Chine Mandchourie Histoire,Hunting,China Manchuria,History","","否"
"1288521350","9787520389990,7520389995","甘肃方言词汇","雒鹏","2021","chi","Book","PrintBook","Di 1 ban",1,"中国社会科学出版社","Beijing","Mandarin dialects China Gansu Sheng Phonology,Chinese language Dialects China Gansu Sheng Phonology","""甘肃方言词汇""提供41个汉语方言的词汇材料.这41个方言点包括:兰州,红古,永登,榆中,白银,靖远,天水,秦安,甘谷,武山,张家川,武威,民勤,古浪,永昌,张掖,山丹,平凉,泾川,灵台,酒泉,敦煌,瓜州,西峰,环县,正宁,镇原,定西,陇西,临洮,漳县,武都,文县,宕昌,康县,西和,临夏市,临夏县,合作,舟曲,临潭.列出北京话以资比较.全书收录甘肃方言常用词汇430个,按""方言词汇调查手册""排列顺序,用国际音标注音.本书比较完整的反映了甘肃汉语方言的词汇差别,是甘肃方言研究,普通话教学,公安刑侦的重要参考资料","否"
"1124918646","9787520349253,752034925X","新中国民族语言学研究70年","尹虎彬","2019","chi","Book","PrintBook","Di 1 ban",2,"中国社会科学出版社","Beijing","Minorities China Languages,Language and languages,Minorities Languages,China Languages,Chine Langues,China","","否"
"1263681522","9787520360210,7520360210","""《春秋》笔法""的修辞学研究","肖锋 (Professor of literature), author","2020","chi","Book","PrintBook","Di 1 ban",1,"中国社会科学出版社","Beijing","Confucius,Chun qiu (Confucius),Chinese classics History and criticism,Chinese language Rhetoric,Classiques (Littérature chinoise) Histoire et critique,Chinois (Langue) Rhétorique,Chinese classics,Criticism, interpretation, etc,Ancient,Style. Composition. Rhetoric","","否"
"1375142541","9787520396127,7520396126","百年回望与中国广播创新发展","颜春龙","2022","chi","Book","PrintBook","Di 1 ban",2,"中国社会科学出版社","Beijing","Guang bo shi ye Fa zhan Yan jiu Zhong guo","本书分四部分,收录了<从哪里来,到哪里去----百年广播漫谈><从广播史到收听史:加强以人民为中心的广播史研究><广播等音乐传播媒介与中国流行音乐的诞生><音频新蓝海:声音场景的若干种可能>等文章","否"
"1226372346","9787516152775,7516152773","现代汉语词义分类体系的建立和自动标注 = The establishment and auto-labeling for word sense taxonomy of Mandarin Chinese","柏晓鹏, author","2019","chi","Book","PrintBook","Di 1 ban",1,"中国社会科学出版社","Beijing","Chinese language Lexicology,Chinese language Semantics,Chinois (Langue) Lexicologie,Chinois (Langue) Sémantique","","否"
"1201376305","9787520350310,7520350312","宋元孝經學五種","曾海軍","2020","chi","Book","PrintBook","Di 1 ban",2,"中国社会科学出版社","Beijing","Xiao jing History,Xiao jing,Filial piety China History,Piété filiale Chine Histoire,Filial piety,China,History","","否"
"1375399618","9787520394758,7520394751","完颜氏文學家族詩集","多洛肯","2022","chi","Book","PrintBook","Di 1 ban",2,"中国社会科学出版社","Beijing","Chinese poetry Qing dynasty, 1644-1912,Poésie chinoise 1644-1912 (Dynastie des Qing)","","否"
"1150836716","9787520344340,7520344347","从话语权到公信力 : 我国媒体国际传播能力建构探索","郭光华, author","2019","chi","Book","PrintBook","Di 1 ban",2,"中國社会科学出版社","Beijing","Mass media China History,Médias Chine Histoire,Chuan bo mei jie Yan jiu Zhong guo,Mass media,China,History","","否"
"1287076535","9787520390507,7520390500","江西玉山紫湖闽南话研究","胡松柏, 1952- author","2021","chi","Book","PrintBook","Di 1 ban",1,"中国社会科学出版社","Beijing","Southern Min dialects China Yushan Xian,Chinese language Dialects China Yushan Xian,Yushan Xian (China) Dialects","赣东北东部8个县区市分布有明清以来闽南移民入迁而携来的闽南话,玉山县紫湖镇是其中规模最大的代表性闽南话方言岛.本书依据扎实的田野调查,记录了闽南本土闽语在赣东北流播和赣东北闽南话的形成过程和分布简况,对紫湖闽南话的语音,词汇,语法作了全面描写,收录了富有特色的方言语料,揭示了位于赣东北吴语,徽语,赣语交接地带的赣东北闽南话的结构规律和特点,体现了以闽南话为母语之一的主要作者对赣东北闽南话的语言系统及其所承载的文化信息的细致观察和深刻感悟","否"
"1066129346","9787520327220,7520327221","无锡宣卷仪式音声研究","李萍, author","2018","chi","Book","PrintBook","Di 1 ban",2,"中国社会科学出版社","Beijing","Bao juan (Buddhist song-tales) China Wuxi Shi,Buddhism Prayers and devotions,Qu yi Yan jiu Wu xi,Bao juan (Buddhist song-tales),Buddhism,China Wuxi Shi,Prayers and devotions","Ben shu tong guo dui wu xi di qu xuan juan huo dong de kao cha, zhi xuan juan xing wei zhong de yin sheng yu qi yi shi xin yang yu jing, yi huo de dui xuan juan ben zhi yu yi yi de li jie yu ren zhi,本书通过对无锡地区宣卷活动的考察, 置宣卷行为中的音声于其仪式信仰语境, 以获得对宣卷本质与意义的理解与认知","否"
"1236843121","9787520368834,7520368831","宇文所安的中国文学英译研究","岳曼曼, author","2020","chi","Book","PrintBook","Di 1 ban",2,"中国社会科学出版社","Beijing","Owen, Stephen, 1946- Criticism and interpretation,Owen, Stephen, 1946-,Chinese literature Translations into English History and criticism,Chinese literature Translations into English,Criticism, interpretation, etc","宇文所安是美国当代著名汉学家和翻译家, 以中国古典文学和文论研究蜚声国际汉学界. 他长期致力于对中国古典文学进行深入且广泛的编选与译介, 译研紧密结合, 成果丰硕且影响深远. 本书借助比较文学研究的他者视野理论, 结合宇文所安的汉学研究特点, 围绕宇文所安的中国古典文学与文论英译著作""诺顿中国文选""和""中国文论: 英译和评论"", 从古典文学选集的编译, 古典文论经典的诗学翻译与阐释以及超越""文本细读""的翻译创新思想这三个层面展开, 在译本对比的基础上, 深入探讨""他者视野""下宇文所安的中国文学英译思想和实践","否"
"1086272846","9787520330350,7520330354","吴忠方言研究","刘晨红, author","2018","chi","Book","PrintBook","Di 1 ban",2,"中国社会科学出版社","Beijing","Mandarin dialects China Wuzhong Shi,Chinese language China Wuzhong Shi,Chinese language,Mandarin dialects,China Wuzhong Shi","吴忠市位于宁夏回族自治区中部.南北长75 公里, 东西宽约20 公里, 总面积112 平方公里, 是自治区总面积的1.62%.吴忠共有19个民族, 其中回族最多, 汉族次之.吴忠方言根据""中国方言地图集""的区划属于北方方言兰银官话银吴片.吴忠话是银吴片话中的代表话.在其地市县方言中具有统领的地位和作用.目前, 对于吴忠方言的调查研究只有极少的资料, 缺少系统的研究.本书以吴忠利通区为调查点, 选取汉族发发音合作人","否"
"1257240080","9787520349420,752034942X","英美聊斋学研究","任增强, author","2020","chi","Book","PrintBook","Di 1 ban",1,"中國社会科学出版社","Beijing","Pu, Songling, 1640-1715,Liao zhai zhi yi (Pu, Songling)","","否"
"1257452289","9787520373777,7520373770","關氏易傳","關朗","2020","chi","Book","PrintBook","Di 1 ban",11,"中國社会科学出版社","Beijing","Yi jing","","否"
"1236386631","9787520373647,7520373649","基于语料库的""说文解字""字(词)汇隐喻模式研究","吴世雄, 1963- author","2020","chi","Book","PrintBook","Di 1 ban",1,"中国社会科学出版社","Beijing","Xu, Shen, -120?,Shuo wen jie zi (Xu, Shen),Chinese language Etymology,Chinois (Langue) Étymologie","","否"
"1129241058","9787520345774,7520345777","信息时代媒介, 受众与社会的关系研究 = Xinxi shidai meijie shouzhong yu shehui de guanxi yanjiu","马妍妍, author","2019","chi","Book","PrintBook","Di 1 ban",2,"中国社会科学出版社","Beijing","Mass media,Médias,mass media","本书列入浙江省2018年度后期资助.全书深入探讨和研究信息时代媒介与受众以及社会之间的关系变迁,研究大众传播参与主体的关系变迁,媒介的符号和意义生产中怀疑产生的原因和影响,探讨基于互动互动互驯共谋的互信型传受关系的建立框架.对传受关系的研究主要立足于怀疑的视角,有利于更好地理解媒介的转型和新媒体的崛起本质,也能促进大众传媒机构在进行传播时,更好地理解媒介及其受众,恪守新闻道德和媒介责任,塑造健康,和谐,有序,互利的传播新秩序","否"
"1141029044","9787520344746,7520344746","英语世界的巴金研究","王苗苗, author","2019","chi","Book","PrintBook","Di 1 ban",2,"中国社会科学出版社","Beijing","Ba, Jin, 1904-2005 Criticism and interpretation,Ba, Jin, 1904-2005 Translations into English,Ba, Jin, 1904-2005,Chinese literature English-speaking countries,Chinese literature 20th century History and criticism,Littérature chinoise 20e siècle Histoire et critique,Chinese literature,Criticism, interpretation, etc,Translations,1900-1999","Summary in Chinese field only,本书全面系统地对英语世界的巴金研究进行了详细的阐释与比较分析,梳理出英语世界巴金研究史的基本发展脉络,以期让中国学者更多的了解英语世界巴金译介和研究的状况,借鉴英语世界学者的""他者的眼光"",给中国的巴金研究提供有益的启示,架起东西方文学研究与文化交流沟通的桥梁.此外,本书还对国内巴金研究与英语世界巴金研究进行对比与比较,以期为中国的巴金研究提供一定的参考","否"
"1201503607","9787520368841,752036884X","上古汉语状语研究","苏颖, author","2020","chi","Book","PrintBook","Di 1 ban",1,"中國社会科学出版社","Beijing","Chinese language To 600 Adverbials,To 600","","否"
"1110679014","9787520341820,7520341828","权德舆策问思想内容研究","陈江英, author","2019","chi","Book","PrintBook","Di 1 ban",2,"中国社会科学出版社","Beijing","Quan, Deyu, 759-818,Quandeyu, 759-818 Zhengzhisixiang Yanjiu,Chinese literature Tang dynasty, 618-907 History and criticism,Intellectuals China,Littérature chinoise 618-907 (Dynastie des Tang) Histoire et critique,Intellectuels Chine,Chinese literature,Employees,Intellectuals,Tang Dynasty (China),China Officials and employees History,China,Criticism, interpretation, etc,History,618-907","本书针对权德舆的五十道'策问'文本进行系统研究与述评. 主要对三个方面的内容进行了考察和总结.首先, 对我国古代科举考试制度的起源, 形式, 种类, 内容, 以及发展到唐代的演变轨迹做以系统, 全面, 明晰的归纳梳理.其次, 在科举考试的大背景下去查询, 阐释, 评价'策问'当中出现的众多典故.第三, 在弄懂所有典故, 解读完'策问'表面反映出的大意, 归纳梳理策问大意的层次之后, 结合'安史之乱'后中唐社会动荡的政局, 凋敝","否"
"1356950093","9787522705989,7522705983","美国汉学家海陶玮的中国古典文学研究","刘丽丽, author","2022","chi","Book","PrintBook","Di 1 ban",1,"中国社会科学出版社","Beijing","Hightower, James Robert,Sinologists United States,Chinese literature History and criticism,Sinologues États-Unis,Littérature chinoise Histoire et critique","本著作以美国汉学家海陶玮的中国古典文学研究为对象,基于原始档案和文献,力求在比较文学视野下对这位重要汉学家的代表性汉学著述展开基础性,全面性,系统性的研究,并考察海陶玮从事汉学研究的人际交流和学术环境,师生传承和国际传播,分析海陶玮汉学研究的起源,动因和成果,揭示海陶玮的汉学研究在美国汉学乃至世界汉学中的贡献,地位,影响和局限","否"
"1101985385","9787520329613,7520329615","语气词""了""的隐现规律研究","王巍, author","2018","chi","Book","PrintBook","Di 1 ban",2,"中国社会科学出版社","Beijing","Chinese language Particles,Chinese language Modality,Chinois (Langue) Particules,Chinois (Langue) Modalité","","否"
"1137079248","9787520347310,7520347311","清代诗学史. 第二卷 : 学问与性情(1736-1795) = Hisotry of Qing poetics","蒋寅, 1959- author","2019","chi","Book","PrintBook","Di 1 ban",1,"中国社会科学出版社","Beijing","Chinese poetry Qing dynasty, 1644-1912 History and criticism,Poésie chinoise 1644-1912 (Dynastie des Qing) Histoire et critique,Chinese poetry,Qing Dynasty (China),Criticism, interpretation, etc,1644-1912","","否"
"oclc编号 - oclcNumber","书号 - isbns","书名 - title","作者 - creator","出版日期 - publicationDate","语言 - catalogingLanguage","格式 - generalFormat","详细格式 - specificFormat","版本 - edition","总版本数 - totalEditions","出版社 - publisher","出版地 - publicationPlace","主题 - subjects","简介 - summaries","是否同行审阅 - peerReviewed"
"1260287347","9787520376624,7520376621","杜拉尔鄂温克语会话 = Conversation in Dular Ewenki","朝克, 1957- author","2020","chi","Book","PrintBook","Di 1 ban",1,"中国社会科学出版社","Beijing","Evenki language China Morin Dawa Daurzu Zizhiqi Conversation and phrase books,Evenki language,China Morin Dawa Daurzu Zizhiqi,Conversation and phrase books","本书是对内蒙古呼伦贝尔莫力达瓦达斡尔自治旗杜拉尔鄂温克民族乡的鄂温克语进行实地调研基础上,以现场搜集整理的杜拉尔鄂温克语口语第一手会话资料为依据编写完成的成果","否"
"1285525154","9787520354479,7520354474","教化与娱乐 : 宋元戏文研究","孙敏智, author","2019","chi","Book","PrintBook","Di 1 ban",2,"中国社会科学出版社","Beijing","Chinese drama Song dynasty, 960-1279 History and criticism,Chinese drama Yuan dynasty, 1260-1368 History and criticism,Théâtre chinois 960-1279 (Dynastie des Song) Histoire et critique,Théâtre chinois 1260-1368 (Dynastie des Yuan) Histoire et critique,Chinese drama,Manners and customs,Song Dynasty (China),Yuan Dynasty (China),China History Song dynasty, 960-1279 Social life and customs,China History Yuan dynasty, 1260-1368 Social life and customs,Chine Histoire 960-1279 (Dynastie des Song) Mœurs et coutumes,Chine Histoire 1260-1368 (Dynastie des Yuan) Mœurs et coutumes,China,Criticism, interpretation, etc,History,960-1368","","否"
