"oclc编号 - oclcNumber","书号 - isbns","书名 - title","作者 - creator","出版日期 - publicationDate","语言 - catalogingLanguage","格式 - generalFormat","详细格式 - specificFormat","版本 - edition","总版本数 - totalEditions","出版社 - publisher","出版地 - publicationPlace","主题 - subjects","简介 - summaries","是否同行审阅 - peerReviewed"
"1226476163","9787520371896,7520371891","元代少数民族作家汉文诗歌的用韵特点 = Rhyme features of Chinese poems written by ethnic minority writers in Yuan dynasty","王冲 (Of Neimenggu da xue), author","2020","chi","Book","PrintBook","Di 1 ban",1,"中国社会科学出版社","Beijing","Chinese poetry Yuan dynasty, 1260-1368 History and criticism,Chinese literature Minority authors History and criticism,Poésie chinoise 1260-1368 (Dynastie des Yuan) Histoire et critique,Littérature chinoise Auteurs issus des minorités Histoire et critique,Chinese literature Minority authors,Chinese poetry,Yuan Dynasty (China),Criticism, interpretation, etc,1260-1368","","否"
"1083356656","9787520329262,7520329267","蒙古英雄史诗诗学","Bu̇rinbeki, B.","2018","chi","Book","PrintBook","Di 1 ban",3,"中国社会科学出版社","Beijing","Epic poetry, Mongolian History and criticism,Poésie épique mongole Histoire et critique,Meng gu zu Ying xiong shi shi Shi xue Yan jiu Zhong guo,Epic poetry, Mongolian,poetry,Poetry,Criticism, interpretation, etc,Poésie","""蒙古英雄史诗的诗学""汉文译本, 由序, 汉文译序, 正文 8 章, 文献目录及蒙汉术语对照表组成.8 章分别为:导论, 宇宙结构, 黑白英雄形象体系(1,2), 骏马的形象, 人与自然的深层关系, 文化变迁中的史诗发展和意像韵律风格.本书是蒙古族著名诗人, 学者巴ʺ布林贝赫先生最重要的史诗研究著作, 是蒙古英雄史诗研究经典理论著作.该书成功地运用文学, 美学, 文化人类学等多视角的方法, 展现了蒙古英雄史诗的美学特点, 建构了蒙古族英雄史诗的诗学理论, 将蒙古英雄史诗的研究上升到新的高度","否"
"1110671062","9787520345033,7520345033","明代越中心学与文学","曹诣珍, author","2019","chi","Book","PrintBook","Di 1 ban",2,"中國社会科学出版社","Beijing","Chinese literature China Zhejiang Sheng History and criticism,Chinese literature Ming dynasty, 1368-1644 History and criticism,Littérature chinoise Chine Zhejiang Histoire et critique,Littérature chinoise 1368-1644 (Dynastie des Ming) Histoire et critique,Chinese literature,Chinese literature Ming dynasty,China Zhejiang Sheng,Criticism, interpretation, etc,1368-1644","","否"
"1134986791","9787520339681,7520339688","满族说部的当代传承研究","邵丽坤, 1979- author","2019","chi","Book","PrintBook","Di 1 ban",2,"中国社会科学出版社","Beijing","Manchu literature History and criticism,Folk literature History and criticism,Oral tradition China,Littérature mandchoue Histoire et critique,Littérature populaire Histoire et critique,Tradition orale Chine,Folk literature,Manchu literature,Oral tradition,China,Criticism, interpretation, etc","Summary in Chinese field only,满族说部的传承模式发生了重要转变, 从传承方式, 传承人的身份, 传承语言和讲述形式上, 再到传承范围都发生了明显的变化.探索满族说部在当代的传承方式, 首先要尽量恢复满语的讲唱环境.其次, 开拓满族说部新的传播空间.除坚持动态保护, 静态传承, 静态与动态共同发展, 共同促进的原则外, 还要将满族说部纳入民俗.讲唱说部时, 常常选在比较隆重的场合, 尤其是在祭礼, 庆功, 寿诞, 氏族会盟等家族重要的节日中, 氏族成员按辈分围坐, 聆听.昔日讲唱说部的场合, 通常被称为'民俗场'.民间口传文学的传承不能离开民俗场, 而传承人的培育也最好在这个场域进行.如今, 随着时代的发展, 说部早已失去了当初的讲唱环境, 在重要的节日讲唱说部已经不太可能.可是, 作为非物质文化遗产保护与传承的一个事象, 说部传承人在重要节日, 对家族中的年轻人还是会有针对性地进行培养.此外, 本书还探索了传播媒介多样化选择的传承方式, 例如电视, 电影, 动漫等","否"
"1037052520","9787516193501,751619350X","陈与义诗研究","杭勇, author","2018","chi","Book","PrintBook","Di 1 ban",2,"中國社会科学出版社","Beijing","Chen, Yuyi, 1090-1138,Chinese poetry Song dynasty, 960-1279 History and criticism,Poésie chinoise 960-1279 (Dynastie des Song) Histoire et critique,Chinese poetry,Song Dynasty (China),Criticism, interpretation, etc,960-1279","本书首先综合创作心理, 主题和题材趋向, 艺术成就等因素, 将陈与义诗歌创作分为因袭期, 转变期, 高峰期, 衰退期等四个阶段, 详细描述了陈与义诗歌创作的发展与演变历程. 接着分析了确立陈与义在诗史上地位的南渡后诗歌的艺术特点, 突出了其诗歌创作成就与艺术个性. 在此基础上, 辨析了从南宋后期以来论家们一直争论不休的陈与义与江西诗派的关系, 辩驳了将陈与义划入江西诗派的谬误, 对陈与义在两宋之交的诗坛上的地位和作用给予了符合事实的评价","否"
"1193568610","9787520365666,7520365662","乡土末路与城市魅影 : 新世纪小说中农民与城市的错位及融合","黄曙光, author","2020","chi","Book","PrintBook","Di 1 ban",2,"中國社会科学出版社","Beijing","Chinese fiction 21st century History and criticism,Country life in literature,Roman chinois 21e siècle Histoire et critique,Vie rurale dans la littérature,Chinese fiction,Criticism, interpretation, etc,2000-2099","","否"
"1288522022","9787520391719,752039171X","世情小说的人物形象与性别话语嬗变研究","陈国学, 1971- b author","2021","chi","Book","PrintBook","Di 1 ban",2,"中国社会科学出版社","Beijing","Chinese fiction Ming dynasty, 1368-1644 History and criticism,Chinese fiction Qing dynasty, 1644-1912 History and criticism,Sex role in literature,Characters and characteristics in literature,Roman chinois 1368-1644 (Dynastie des Ming) Histoire et critique,Roman chinois 1644-1912 (Dynastie des Qing) Histoire et critique,Rôle selon le sexe dans la littérature,Chinese fiction,Chinese fiction Ming dynasty,Qing Dynasty (China),Criticism, interpretation, etc,1368-1912","","否"
"oclc编号 - oclcNumber","书号 - isbns","书名 - title","作者 - creator","出版日期 - publicationDate","语言 - catalogingLanguage","格式 - generalFormat","详细格式 - specificFormat","版本 - edition","总版本数 - totalEditions","出版社 - publisher","出版地 - publicationPlace","主题 - subjects","简介 - summaries","是否同行审阅 - peerReviewed"
"1088929976","9787520336079,7520336077","汉语的话语强调 = The emphasis of utterance in mandarin Chinese","鲁莹, author","2018","chi","Book","PrintBook","Di 1 ban",2,"中国社会科学出版社","Beijing","Chinese language Spoken Chinese,Chinese language Grammar,Chinois (Langue) Grammaire","强调是一种极为普遍的语言现象, 话语层面上的强调形式在语篇上表现为五种修辞方式, 如:均衡形义, 重复形式, 变化结构, 凸显意象和侧重事物;以及五类话语标记, 分别有:强调背景信息'你知道吗/吧/的', 强调言者参与'我是说'等, 强调言语的主观真实性'说实话'等, 强调言语施事行为'我跟你说'等, 强调上层语义关系'ŁƯŁƯ的是';在句子中则表现为句法异位和语用易位结构, 它们都是句法成分移位造成的'非常规'语序结构","否"
"1322164546","9787520395700,7520395707","戴庆厦先生口述史","戴庆厦, author","2022","chi","Book","PrintBook","Di 1 ban",2,"中国社会科学出版社","Beijing","Dai, Qingxia Interviews,Linguists China Interviews,Anthropological linguistics China,Linguistes Chine Entretiens,Ethnolinguistique Chine,Anthropological linguistics,Linguists,China,Interviews","","否"
"1110664324","9787520340120,7520340120","作为自我表象的文学 : 中国当代自我抒情型作家的抒情场","胡书庆, author","2019","chi","Book","PrintBook","Di 1 ban",2,"中國社会科学出版社","Beijing","Chinese literature 20th century History and criticism,Chinese literature 21st century History and criticism,Littérature chinoise 20e siècle Histoire et critique,Littérature chinoise 21e siècle Histoire et critique,Chinese literature,Criticism, interpretation, etc,1900-2099","","否"
"1159419210","9787520366069,7520366065","石刻文献与文学研究","杜海军, 1957- author","2020","chi","Book","PrintBook","Di 1 ban",2,"中國社会科学出版社","Beijing","Inscriptions, Chinese History and criticism,Chinese literature History and criticism,Inscriptions chinoises Histoire et critique,Littérature chinoise Histoire et critique,Chinese literature,Inscriptions, Chinese,Criticism, interpretation, etc","","否"
"1292056323","9787520388894,7520388891","中国现当代小说的性别叙事","降红燕, author","2021","chi","Book","PrintBook","Di 1 ban",2,"中国社会科学出版社","Beijing","Gender identity in literature,Chinese fiction 20th century History and criticism,Identité de genre dans la littérature,Roman chinois 20e siècle Histoire et critique,Chinese fiction,Criticism, interpretation, etc,1900-1999","20世纪中国文学可谓小说的世纪,而小说是文学作品分类的重要样式之一.叙事性是小说突出的本体规定性.在清代以前,中国古代小说与女性作者几乎无缘.随着我国现代化进程的展开,女性作家在五四新文化运动中以群体之势浮出历史地表,与男性作家并驾齐驱于文学的领地,小说叙事与性别之间的关系因之成为一个富于研究价值的论题.本书从性别与叙事的双重视角观照中国现当代文学中不同性别作家创作的小说,采用多种文学批评理论相融合而又以社会性别理论和女性主义叙事学为主导的批评方法,对中国现当代小说中叙事与性别的关系进行阐释和探讨,意图打通文学研究中内部研究和外部研究的通道,以期对既有的中国现当代文学创作进行某种把握,并对中国当代文学创作和理论有所助益","否"
"1103156791","9787520340083,7520340082","陈森《梅花梦传奇》笺注","叶天山, writer of added commentary","2019","chi","Book","PrintBook","Di 1 ban",2,"中國社会科学出版社","Beijing","Chen, Sen, active 1823-1849","叶天山笺注的""陈森梅花梦传奇笺注""采用笺, 注结合的方式,首次整理清代文人陈森的戏曲稿本,还原其在文学史上的完整形象.作品以较为精致的形式,呈现了明清传奇的基本体制,能够使读者明白曲牌体传奇剧本的一般写法,弥补戏曲选本的零碎节录之局限.同时,通过剖析该剧的作意、作法及理论批评,我们不仅可以加深对传奇剧的理解,而且能为专业人员从传统路径进行戏曲研究提供参照.笺语注意咀嚼稿本修改的奥妙,玩味作家的文艺趣尚,从而激发人们对传统文化的兴趣.此外,书中的诗论与诗作,亦可为后学开示旧诗写作法门.因此,本书在文献、曲学、文学三个领域,皆自有其价值","否"
"1111659462","9787520331111,7520331113","古代文字与文献研究论集","李洪财, author","2018","chi","Book","PrintBook","Di 1 ban",2,"中國社会科学出版社","Beijing","Chinese language Etymology,Chinese characters History,Chinois (Langue) Étymologie,Chinois (Langue) Caractères Histoire,Chinese characters,History","","否"
"1223018612","9787520372107,7520372103","中国古代小说中的动物形象变迁研究","张瑞芳, author","2020","chi","Book","PrintBook","Di 1 ban",1,"中國社会科学出版社","Beijing","Chinese fiction History and criticism,Animals in literature,Roman chinois Histoire et critique,Animaux dans la littérature,Chinese fiction,Criticism, interpretation, etc","","否"
"1201376613","9787520368919,7520368912","痴狂叙事与现代中国小说","裴争, author","2020","chi","Book","PrintBook","Di 1 ban",2,"中國社会科学出版社","Beijing","Chinese fiction 20th century History and criticism,Roman chinois 20e siècle Histoire et critique,Chinese fiction,Criticism, interpretation, etc,1900-1999","","否"
"1053904631","9787520328968,7520328961","《周易》为君为臣之道研究","孙亚丽, 1986- author","2018","chi","Book","PrintBook","Di 1 ban",2,"中国社会科学出版社","Beijing","Yi jing","""周易""不仅是一部通过变易预测未来的占筮书, 而且还是一部蕴含着丰富的政治, 社会, 人生哲理的经典."" 易之为书, 推天道以明人事者也"", 天道是人道的根据. ""乾""""坤""两卦上承天地之象, 下载君臣之道. 君王受天所命, 尚贤使能, 观民设教; 臣子顺承君王, 择善而随, 宽容厚德. 本书选取具有代表性的十七卦, 将象数思维与义理分析相结合, 辨析卦爻分歧, 考证卦爻之义, 阐发""周易""的为君为臣之道, 以期更多人读懂""周易.""","否"
"1337031797","9787522702292,7522702291","戰國秦漢簡帛古書訓釋研究 = Study on the explaining of bamboo and silk books in warring states and Qin-Han periods","王挺斌, author","2022","chi","Book","PrintBook","Di 1 ban",2,"中國社会科学出版社","Beijing","Inscriptions, Chinese History and criticism,Wooden tablets China,Manuscripts, Chinese,Inscriptions chinoises Histoire et critique,Tablettes en bois Chine,Inscriptions, Chinese,Wooden tablets,China,Criticism, interpretation, etc","","否"
"1031309837","9787520313445,7520313441","文学世界与族群书写","梁昭 (College teacher), author","2018","chi","Book","PrintBook","Di 1 ban",2,"中国社会科学出版社","Beijing","Literature History and criticism,Littérature Histoire et critique,Literature,Criticism, interpretation, etc","","否"
"1064581480","9787520329729,7520329720","抗战大后方社团翻译文学研究","熊辉, 1976- author","2018","chi","Book","PrintBook","Di 1 ban",3,"中国社会科学出版社","Beijing","Translating and interpreting China History 20th century,Chinese literature 20th century History and criticism,Littérature chinoise 20e siècle Histoire et critique,Chinese literature,Translating and interpreting,China,Criticism, interpretation, etc,History,1900-1999","抗战大后方社团翻译文学是中国抗战文学地图上不可或缺的构成要素, 本书立意发掘其文学性,历史价值和社会影响等内容, 从翻译文学之镜中窥见抗战文学及社团文学被遮蔽的一些属性. 同时, 突破"" 启蒙/救亡"" 的阐释体系, 展示出抗战大后方社团翻译文学以及抗战文学发展的基本轨迹与本真面貌","否"
"1236386960","9787520362856,752036285X","崂山道教题刻研究","孙立涛, author","2020","chi","Book","PrintBook","Di 1 ban",1,"中國社会科学出版社","Beijing","Inscriptions, Chinese China Lao Mountains History and criticism,Stone carving China Lao Mountains,Civilization Taoist influences,Inscriptions, Chinese,Stone carving,Lao Mountains (China) Civilization Taoist influences,China Lao Mountains,Criticism, interpretation, etc","","否"
"1056247725","9787520330343,7520330346","《铁道游击队》文献史料辑","陈夫龙","2018","chi","Book","PrintBook","Di 1 ban",2,"中国社会科学出版社","Beijing","Liu, Zhixia, 1918-1991","本资料汇编由原始文献, 研究文献, 史料钩沉和附录四部分构成. 其中, 原始文献部分通过搜集整理""铁道游击队""的创作, 出版, 艺术改编以及原著作者刘知侠的有关文献, 力求多角度, 多层次, 全方位地再现作为艺术文本的""铁道游击队""的生成机制与发展历程; 研究文献部分通过搜集整理学术界对""铁道游击队""各类艺术文本进行分析, 评价的有关文献, 客观地呈现其艺术接受史的真实面相和价值意义, 展现艺术文本""铁道游击队""研究的发展脉络和既得成就; 史料钩沉部分通过考察作为历史事件的"" 铁道游击队"" 的来龙去脉, 英雄事迹, 历史贡献和历史意义, 凸显其作为历史文本的价值意义, 使其与艺术文本的""铁道游击队""形成互文性关系, 使读者在阅读中增强不忘初心, 牢记使命的自觉性与神圣感; 附录部分由文献史料编年, 铁道队组织沿革和领导人名录, 鲁南铁道大队指战员名录和铁道游击队大事记构成, 一方面展示六十多年来关于""铁道游击队""的学术研究和历史记忆的动态历程, 一方面缅怀历史上真实存在的铁道游击队英雄及其历史贡献","否"
"1056963692","9787520328814,7520328813","还原与阐释 : 20世纪30年代中国的美国文学形象构建","张宝林, 1981- author","2018","chi","Book","PrintBook","Di 1 ban",2,"中国社会科学出版社","Beijing","American literature 20th century History and criticism,Littérature américaine 20e siècle Histoire et critique,American literature,Criticism, interpretation, etc,1900-1999","","否"
"1191820030","9787520330695,7520330699","政治・学术・思想 : 汉代士人的文学世界","杨霞, 1978- author","2020","chi","Book","PrintBook","Di 1 ban",2,"中國社会科学出版社","Beijing","Intellectuals China,Chinese literature Qin and Han dynasties, 221 B.C.-220 A.D. History and criticism,Intellectuels Chine,Littérature chinoise 221 av. J.-C.-220 (Dynasties des Qin et des Han) Histoire et critique,Intellectuals,Chinese literature Qin and Han dynasties,China,Criticism, interpretation, etc,221 B.C.-220 A.D","","否"
"1032364992","9787520320405,7520320405","中国经验的文学表达","聂茂, author","2018","chi","Book","PrintBook","Di 1 ban",2,"中国社会科学出版社","Beijing","Chinese literature 20th century History and criticism,Chinese literature 21st century History and criticism,Littérature chinoise 20e siècle Histoire et critique,Littérature chinoise 21e siècle Histoire et critique,Chinese literature,Criticism, interpretation, etc,1900-2099","","否"
"1066118251","9787520316248,7520316246","当代文本诗学研究","董希文, 1969- author","2018","chi","Book","PrintBook","Di 1 ban",2,"中国社会科学出版社","Beijing","Chinese literature Criticism, Textual,Chinese literature History and criticism Theory, etc,Chinese poetry Criticism, Textual,Literature and technology,Littérature chinoise Histoire et critique Théorie, etc,Littérature et technologie,Shi xue Yan jiu,Chinese literature,Chinese poetry,Criticism, interpretation, etc","本书立足现代性视野, 深入细致地梳理了20世纪西方文本诗学存在形态及演变轨迹; 在此基础上, 探究了各形态文本诗学的基本理论主张及其相互间复杂联系, 并进一步剖析了当下中国文本诗学发展过程中存在问题及发展态势. 该研究成果对于深入探究当代西方文学理论, 规范当下中国文学文化研究极具启发价值, 能够有效避免"" 脱离文本, 直奔主题"" 的不良批评之风","否"
"1029825400","9787520309967,7520309967","中国当代动物叙事的类型学研究","陈佳冀, 1982- author","2018","chi","Book","PrintBook","Di 1 ban",2,"中国社会科学出版社","Beijing","Chinese literature 20th century History and criticism,Chinese literature 21st century History and criticism,Animals in literature,Description (Rhetoric),Littérature chinoise 20e siècle Histoire et critique,Littérature chinoise 21e siècle Histoire et critique,Animaux dans la littérature,Discours descriptif,Chinese literature,Criticism, interpretation, etc,1900-2099","该研究成果立足于以中国当代文学中的"" 动物叙事"" 作为研究对象, 实则是基于将当代动物叙事作为一个叙事学意义上的类型整体为考察前提, 重心是在对动物叙事这一特殊的叙事类型其具体的功能形态与历史根源的考察. 也就是从类型的本质属性与发生两个最为基础的向度衍生而出, 包含了对当代动物叙事的概念诠释, 伦理资源, 叙事传承, 类型衍生, 功能形态, 深层结构, 基本叙述模式以及神话根源等多个层面的探讨","否"
"1090861708","9787520327749,7520327744","乡村传播网络与共同体重建 : 少数民族乡村文化发展的传播社会学分析","谭华, author","2018","chi","Book","PrintBook","Di 1 ban",2,"中国社会科学出版社","Beijing","Mass media China,Minorities China Social life and customs,Minorities Political activity China,Minorities in mass media,Rural development China,Médias Chine,Minorités Activité politique Chine,Minorités dans les médias,Développement rural Chine,Mass media,Minorities Political activity,Minorities Social life and customs,Rural development,China","","否"
"1084338425","9787520330381,7520330389","现代汉语语法词汇研究 = Xiandai Hanyu yufa cihui yanjiu","张国华, author","2018","chi","Book","PrintBook","Di 1 ban",2,"中国社会科学出版社","Beijing","Chinese language Grammar,Chinois (Langue) Grammaire","本书重点研究现代汉语的核心范畴语法与词汇, 自然涉及到语义与修辞等问题. 具体包括语法范畴研究, 句式研究, 复句研究, 句法语义研究, 修辞格研究, 修辞现象研究等","否"
"1129237019","9787520351928,7520351920","自我认同与青春叙事 : ""80 后"" 作家研究","祁春风, 1980- author","2019","chi","Book","PrintBook","Di 1 ban",3,"中國社会科学出版社","Beijing","Authors, Chinese 21st century Criticism and interpretation,Chinese literature 21st century History and criticism,Écrivains chinois 21e siècle Critique et interprétation,Littérature chinoise 21e siècle Histoire et critique,Authors, Chinese,Chinese literature,Criticism, interpretation, etc,2000-2099","本书在自我认同理论视野下对'80后'作家的青春叙事进行了系统的学理的研究, 以韩寒, 郭敬明, 春树, 张悦然, 周嘉宁, 笛安, 张怡微, 文珍, 颜歌, 甫跃辉等'80后'作家为典型案例, 分析'80后'青春叙事潮流产生的原因, 重点梳理叙事主题的变迁:一是青春期'叛逆'的自我退却, 二是伦理变迁中的自我重建, 三是家族群体身份的追寻, 四是城市化过程中的文化认同.最后本书从总体上反思了'80 后'青春叙事的价值和局限","否"
"1117306719","9787520325523,7520325520","厉鹗的文学思想和诗词创作 = Li E de wenxue sixiang he shici chuangzuo","王小恒, 1974-, author","2018","chi","Book","PrintBook","Di 1 ban",2,"中国社会科学出版社","Beijing","Li, E, 1692-1752 Criticism and interpretation,Li, E, 1692-1752,Chinese poetry History and criticism,Poésie chinoise Histoire et critique,Chinese poetry,Criticism, interpretation, etc","本书对清代中期浙派诗人群体领袖人物厉鹗的文学思想和诗词等创作进行了较为系统全面的挖掘和研究.厉鹗诗词创作数量可观,取得了很高的艺术成就,在当时产生了很大影响.诗词之外,厉鹗的散文和散曲创作也颇有成就.本书对厉鹗的多方面文学创作做了深入研究;同时,对其在清代中期浙派诗人群诗文化活动中的地位,作用和影响也做了必要探究,以期引起学术界重视","否"
"1152176183","9787520359672,7520359670","怦然心动 : 中国古代文学艺术中的惊奇之美","李潇云 (Chinese literature teacher), author","2020","chi","Book","PrintBook","Di 1 ban",2,"中國社会科学出版社","Beijing","Chinese literature History and criticism,Littérature chinoise Histoire et critique,Chinese literature,Criticism, interpretation, etc","","否"
"1204343545","9787520372572,752037257X","明代戏剧唱词常用颜色词研究","吴剑, 1985- author","2020","chi","Book","PrintBook","Di 1 ban",1,"中國社会科学出版社","Beijing","Chinese drama Ming dynasty, 1368-1644 History and criticism,Color in literature,Théâtre chinois 1368-1644 (Dynastie des Ming) Histoire et critique,Couleur dans la littérature,Chinese drama Ming dynasty,Criticism, interpretation, etc,1368-1644","","否"
"1287077873","9787520380539,752038053X","《孝經》鄭玄注匯校","郭金鴻, author","2021","chi","Book","PrintBook","Di 1 ban",1,"中国社会科学出版社","Beijing","Zheng, Xuan, 127-200,Pi, Xirui, 1850-1908,Xiao jing","本书以皮锡瑞校订本""孝经郑玄疏""为底本,以陈铁凡""敦煌本孝经类纂"",龚道耕""孝经郑氏注"",曹元弼""孝经郑氏注笺释""为参校,辅之以严可均,臧庸,洪颐煊,王谟,以及日本学者冈田挺之,尾张等人辑本30馀种,佐之以敦煌,吐鲁番,和田等出土的""孝经""注本,同时借鉴当代学者最新研究成果,对""""孝经""郑注""进行堡正,集汇校,考证,辑於一体,以使之更加完善,进而为孝经学,郑学乃至于经学研究提供更为真实,详实的文献资料","否"
