"oclc编号 - oclcNumber","书号 - isbns","书名 - title","作者 - creator","出版日期 - publicationDate","语言 - catalogingLanguage","格式 - generalFormat","详细格式 - specificFormat","版本 - edition","总版本数 - totalEditions","出版社 - publisher","出版地 - publicationPlace","主题 - subjects","简介 - summaries","是否同行审阅 - peerReviewed"
"1351887064","9787573204530,7573204531","王阳明诗校注","李庆, 1948- author","2022","chi","Book","PrintBook","Di 1 ban",1,"上海古籍出版社","Shanghai Shi","Wang, Yangming, 1472-1529 Criticism and interpretation,Wang, Yangming, 1472-1529,Chinese poetry Ming dynasty, 1368-1644 History and criticism,Poésie chinoise 1368-1644 (Dynastie des Ming) Histoire et critique,Chinese poetry Ming dynasty,Criticism, interpretation, etc,1368-1644","李庆教授毕业并曾长期任教于复旦大学古籍所,并专力于明代思想史,文学史研究,于文献的整理与研究素有专攻,代表作有""顾千里研究""等;东渡日本后,长期任教于日本国立金泽大学,被聘为名誉教授,其是专攻日本汉学史,代表作有五卷本""日本汉学史""等.本书是第一部王阳明诗歌注释本.全面吸收浙古社""王阳明全集(新编本)""和束景南""王阳明佚文辑考编年""等辑佚成果,收录齐备;广参众本,精心校勘;考释部分阐明题意,辨明出处,编年,考证真伪,本事等;注释部分详注文字,典故,专门概念,时间,地点,人物,事件等,间或串讲句意;文末另附""王阳明诗赋编年""","否"
"1226467854","9787532597154,7532597156","隸變研究","赵平安, 1963- author","2020","chi","Book","PrintBook","Xiu ding ban, di 1 ban",6,"上海古籍出版社","Shanghai","Chinese language To 600 Writing,Chinese language Writing Li style,Chinese characters History,Chinois (Langue) Jusqu'à 600 Écriture,Chinois (Langue) Caractères Histoire,Chinese characters,Chinese language Writing,History,To 600","隶变是汉字发展史上的一个里程碑,标志着古汉字演变成现代汉字的起点.原书共分八部分,内容包括:隶变研究的简单回顾;对隶变和隶变阶段的基本看法;研究隶变的方法;隶变的必然性和可能性;隶变的现象和规律;隶变的巨大影响;隶变的性质;隶变阶段未识字考.此次修订了上一版的讹误","否"
"1232066230","9787532597857,7532597857","林继中文集","林继中, author","2020","chi","Book","PrintBook","Di 1 ban",1,"上海古籍出版社","Shanghai","Du, Fu, 712-770 Criticism and interpretation,Yang, Shaoheng, 1953- Criticism and interpretation,Wang, Wei, 701-761,Du, Fu, 712-770,Poets, Chinese Biography,Chinese poetry Tang dynasty, 618-907 History and criticism,Chinese prose literature Tang dynasty, 618-907 History and criticism,Chinese literature History and criticism,Manors China History,Poètes chinois Biographies,Poésie chinoise 618-907 (Dynastie des Tang) Histoire et critique,Prose chinoise 618-907 (Dynastie des Tang) Histoire et critique,Littérature chinoise Histoire et critique,Chinese literature,Chinese poetry,Chinese prose literature,Manors,Poets, Chinese,Tang Dynasty (China),China,Biographies,Criticism, interpretation, etc,History,618-907","","否"
"1255175303","9787532599080,7532599086","土族《格萨尔》研究","王国明, 1968- author","2021","chi","Book","PrintBook","Di 1 ban",2,"上海古籍出版社","Shanghai","Gesar,Epic poetry, Tibetan History and criticism,Epic poetry, Tibetan,Criticism, interpretation, etc","","否"
"1166310390","9787532595280,7532595285","古誌石華","黄本驥, 1781-1856, author","2020","chi","Book","PrintBook","Di 1 ban",3,"上海古籍出版社","Shanghai","Inscriptions, Chinese,Stone carving China,Inscriptions chinoises,Sculpture en pierre Chine,Stone carving,China","本书以黄本骥三长物斋历年所聚墓志拓本, 益以友朋所藏及金石家著录之确有可征者, 汇录成帙, 书名源自""文心雕龙, 诔碑""""石墨镌华""一语.初辑成于道光八年九月, 九年夏刻就.后以续采各志, 按年编入, 共得280种, 分为30卷.各碑后多有跋语, 考证实事求是, 注重传世典籍与金石刻辞互证","否"
"1346062616","9787573202017,7573202016","上海市志 (1978-2010). 文学・艺术分志. 文学卷","上海市地方志编纂委员会","2021","chi","Book","PrintBook","Di 1 ban",,"上海古籍出版社","Shanghai Shi","Chinese literature China Shanghai History and criticism,Chinese literature 20th century History and criticism,Chinese literature 21st century History and criticism,Littérature chinoise Chine Shanghai Histoire et critique,Littérature chinoise 20e siècle Histoire et critique,Littérature chinoise 21e siècle Histoire et critique,Chinese literature,China Shanghai,Criticism, interpretation, etc,History,1900-2099","因为首轮""上海市专志系列丛刊""未收入""文学卷"",故本卷全面,客观地记述了 1978 年至 2010 年间,上海的文学创作,翻译,思潮,争鸣等文学现象,评奖,会议,交流等文学活动,以及文学人物,创作队伍,文学报刊和出版社等文学机构形态.本卷资料来源于市作协档案馆,相关文学机构档案馆(室),上海文化年鉴全文检索数据库,以及历史文献,社会调查,部门提供的材料等.本卷是上海文学史的本真写照.上海自 1843 年 11 月 17 日开埠以来,随着都市工商业的发展和城市建设的拓展,上海吸引了全国各地的文人,开展创作和出版等文学活动. 20 世纪初到抗战爆发之前,上海事实上成为中国的文化中心,积聚起人数众多的文学人才.新中国建立后,一批解放区作家的先后抵沪,不少新作家的相继成长,使上海作家队伍得以充实壮大.特别是 1978 年以来的新时期,上海的文学创作事业重告振兴,日趋繁荣.一批青年作家接踵涌现,文学刊物相继复刊,上海文学引领文学创作潮流,""伤痕文学""""反思文学""""改革文学""""先锋文学""等创作潮流中上海作家均有力作.海纳百川正是上海文学的新气象,越来越多的作家汇聚在这座城市,记录上海,书写上海,成为新世纪十年最主要的文学主题","否"
"1347204659","9787573203625,7573203624","嵇康传","王晓毅, 1954- auther","2022","chi","Book","PrintBook","Di 1 ban",2,"上海古籍出版社","Shanghai Shi","Ji, Kang, 223-262,Poets, Chinese Biography,Philosophers China Biography,Poètes chinois Biographies,Philosophes Chine Biographies,Jin Dynasty (China : 265-419),Philosophers,Poets, Chinese,China History Jin dynasty, 265-419 Biography,Chine Histoire 265-419 (Dynastie des Jin) Biographies,China,Biographies,History,265-419","","否"
"1126218510","9787532593453,7532593452","屈子楚辭章句","劉夢鵬, author","2019","chi","Book","PrintBook","Di 1 ban",3,"上海古籍出版社","Shanghai","Qu, Yuan, approximately 343 B.C.-approximately 277 B.C. Criticism and interpretation,Qu, Yuan, approximately 343 B.C.-approximately 277 B.C,Chu ci (Ancient Chinese poems),Chinese poetry To 221 B.C. History and criticism,Chinese poetry Qin and Han dynasties, 221 B.C.-220 A.D. History and criticism,Poésie chinoise Jusqu'à 221 av. J.-C. Histoire et critique,Poésie chinoise 221 av. J.-C.-220 (Dynasties des Qin et des Han) Histoire et critique,Chinese poetry,Chinese poetry Qin and Han dynasties,Criticism, interpretation, etc,To 220","刘氏为乾隆间进士.本书又名'屈子章句'.于卷首考证屈子生平, 正文七卷全选屈原作品, 采用独特的篇章次序, 虽为四库馆臣诟病, 但亦对后世有所影响.每篇前有总论, 每段后附注释.诠释字句简明翔实, 考据阐释多有新见","否"
"1360558115","9787573205537,7573205538","徐無黨集 ; 林大中集 ; 應孟明集","徐無黨","2022","chi","Book","PrintBook","Di 1 ban",1,"上海古籍出版社","Shanghai Shi","Chinese literature Song dynasty, 960-1279,Littérature chinoise 960-1279 (Dynastie des Song)","本书为永康文献丛书一种,为三位永康文人林大中,应孟明,徐无党三人著作整理.对宋代文史研究者,浙江地方文史研究者有一定的资料参考价值","否"
"1133774026","9787532594146,7532594149","周易郑氏学阐微","林忠军, author","2019","chi","Book","PrintBook","Di 1 ban",4,"上海古籍出版社","Shanghai","Zheng, Xuan, 127-200,Yi jing","""本书的最大特点是有破有立:所谓破, 在于澄清了一些古已有之的对郑玄易学的误解, 如长期以来人们笼统地认为汉代易学只讲象数, 直到王弼才开启以义理释""""易""""之风, 本书则令人信服地呈现出, 郑玄易学并非只讲象数而不及义理, 而且郑玄的义理观与后代的义理易学迥然不同, 颇有值得参考之处.所谓立, 在于挖掘出了郑玄易注背后一整套完整的易学思想, 并厘清了其历史脉络.作者信而有征地对郑玄易学做出了如下判断:学统上, 融合今古文""""易"""";学风上, 兼收并蓄, 冲破师法家法门ʹ之见;方法上, 重象数兼顾义理, 为后代易学发展打开了一条新路. 本书作者对汉代盛行的象数易学曾有深入研究, 这就为他在汉代易学的大脉络中真切地理解郑玄易学打下了基础.他不仅充分吸收了宋代至晚清学者们利用传统文献学方法对郑玄""""周易""""注做出的辑佚成果, 还吸收了多种新材料, 新方法, 如近年来出土文献中发现的""""周易""""材料, 再如西方诠释学理论也成为作者诠释郑玄易学时的重要参照.""","否"
"1255175268","9787532598885,7532598888","古文孝經指解 : 外二十三種","張恩標","2021","chi","Book","PrintBook","Di 1 ban",2,"上海古籍出版社","Shanghai","Xiao jing","","否"
"1340388180","9787573201683,7573201680","新定杜工部草堂詩笺斠証","杜甫, 712-770, author","2021","chi","Book","PrintBook","Di 1 ban",2,"上海古籍出版社","Shanghai Shi","","","否"
"1287078424","9787573200358,7573200358","中國古典戲劇理論史","譚帆, author","2021","chi","Book","PrintBook","Zeng ding ben",9,"上海古籍出版社","Shanghai","Chinese drama History and criticism,Théâtre chinois Histoire et critique,Chinese drama,Criticism, interpretation, etc","""中国古典戏剧理论史""一书以中国古代戏剧观念的历史演进和古典戏剧理论的历史分期为""史""的线索,以""曲学""""叙事理论""和""剧学理论""为三大体系,从横向角度清理古代戏剧理论的独特思想内涵,探索中国古典戏剧的理论体系,理论特色以及价值功能,进一步揭示中国古典戏剧理论的民族性格.此次修订再版,结合十余年专业研究新成果,精益求精","否"
"1035017671","9787532583836,753258383X","王维詩集","赵殿成, 1683-1756, annotator","2018","chi","Book","PrintBook","Di 1 ban",2,"上海古籍出版社","Shanghai","Wang, Wei, 701-761 Criticism and interpretation,Wang, Wei, 701-761,Criticism, interpretation, etc","","否"
"1341324155","9787573202888,7573202881","《格萨尔》翻译与实践","才让卓玛, author","2022","chi","Book","PrintBook","Di 1 ban",2,"上海古籍出版社","Shanghai","Gesar Translations History and criticism,Epic poetry, Tibetan History and criticism,Tales China Tibet Autonomous Region History and criticism,Poésie épique tibétaine Histoire et critique,Contes Chine Région autonome du Tibet Histoire et critique","本书稿以""格萨尔""史诗的翻译实践为研究内容,分为五章:第一章总论了翻译的性质,功用,标准及翻译工作应具备的条件;第二章介绍了我国各个历史时期民族翻译,外文翻译,翻译理论以及""格萨尔""翻译史略;第三章具体介绍""格萨尔""史诗的翻译实践,从固定名词,术语,普通字词,表述性散文句子,唱词,比喻句,重叠词句,谚语等多个角度进行论述,基本涵盖了""格萨尔""翻译中的重要方面,并由此归纳""格萨尔""翻译的技巧与文学要求;第四章,第五章分别就""格萨尔""早期版本与翻译,翻译中的若干理论问题作了论述.全书内容丰富全面,对于深入挖掘,传承发扬""格萨尔""这一伟大民族史诗很有意义,值得出版","否"
"1125361836","9787532590575,7532590577","夢影紅樓 : 旅顺博物馆藏孫温繪全本紅樓夢","孫温, active 1862-1908, artist","2019","chi","Book","PrintBook","Di 1 ban",4,"上海古籍出版社","Shanghai","Cao, Xueqin, approximately 1717-1763. Illustrations,Hong lou meng (Cao, Xueqin),Illustrated works","""梦影红楼:旅顺博物馆藏孙温绘全本红楼梦""画册, 清孙温, 孙允谟绘, 原作为绢本, 纵43.3厘米, 横76.5厘米, 工笔设色, 色彩明丽, 笔法细致.该画册存画230幅, 描绘人物3700多个, 历时30多年绘成, 现藏旅顺博物馆, 国家一级文物","否"
"1048448290","9787532588411,7532588416","天竺云韵 : 《云使》蒙古文译本研究","萨其仁贵, author","2018","chi","Book","PrintBook","Di 1 ban",2,"上海古籍出版社","Shanghai","Kālidāsa,Meghadūta (Kālidāsa),Sanskrit poetry History and criticism,Sanskrit poetry Translations into Mongolian,Poésie sanscrite Histoire et critique,Xu shi shi Shi ge yan jiu Yin du Zhong shi ji Meng gu yu (zhong guo shao shu min zu yu yan),Sanskrit poetry,Criticism, interpretation, etc,Translations","本书未出版. 本书稿的主要内容为对于原印度梵文抒情长诗, 迦梨陀娑的""云使""的蒙古文译本的全面分析, 分为绪论, 版本源流, 三文翻译对照, 佛经翻译传统, 蒙古文译本研究以及附录中作者对于梵, 藏, 蒙文语译本的拉丁转写和汉译等. 古代印度最伟大的古典梵语诗人和戏剧家迦梨陀娑的长篇抒情诗""云使""于18世纪前半叶通过藏文转译成蒙古文. 作为梵文原本的目的语文本和蒙古文译本的源语文本, 藏文译本的得与失直接影响了蒙古文译本. 从蒙古文译本的语序和用词特征不难看得出其对藏文译本的依附性. 但藏文译本究竟在哪些方面如何影响到蒙古文译本, 以及这些影响与梵译藏过程中的问题又有何关联本书在""云使""的梵, 藏, 蒙古三种文本的逐字逐句比较基础上, 解析蒙古文译本所受藏文译本的具体影响, 并在梵, 藏文本的对照中找出造成这些影响的根本原因","否"
"1249000161","9787532598847,7532598845","王陽明全集補編","王陽明, 1472-1529, author","2021","chi","Book","PrintBook","Zeng bu ben, di 1 ban",7,"上海古籍出版社","Shanghai","Neo-Confucianism,Philosophy, Chinese,Néo-confucianisme,Philosophie chinoise","","否"
"1192311909","9787532595235,7532595234","八瓊室金石補正","陆增祥, 1816-1882 author","2020","chi","Book","PrintBook","Di 1 ban",10,"上海古籍出版社","Shanghai","Inscriptions, Chinese History and criticism,Inscriptions chinoises Histoire et critique,Inscriptions, Chinese,Stone carving,China","","否"
"1373935803","9787573200389,7573200382","牢山剑水 : 鲁尼文叶尼塞碑铭译注","白玉冬, author","2021","chi","Book","PrintBook","Di 1 ban",2,"上海古籍出版社","Shanghai Shi","Inscriptions, Old Turkic,Inscriptions turques anciennes","白玉冬""突厥鲁尼文文献集成与研究""专题研究的首要部分,首先依据突厥鲁尼文碑铭图版,全面系统排查叶尼塞碑铭,依据图版和前人研究成果,甄别出史料价值较高的68方墓志铭,给出录文,换写,转写与中译文.其次,对尚未被解读的原字V,以及转写意见不一的词汇,结合其他古突厥语(包括回鹘文)碑刻及写本文献,尽可能提供客观公正的答案.从对碑铭原字的认读着手,给出重点碑铭如实的摹写,换写,准确的转写,中译文,以及词注与相关考释,并将国际上关于叶尼塞碑铭的诸多研究成果与主流观点介绍给国内,最终为国内学术界提供一个翔实可信的叶尼塞碑铭文献整理成果,并对伯恩什达姆等多位学者的研究做出回应与反馈,在国内尚无先例,这在国内尚属首次,是本书在学术思想方面的特色和创新之处","否"
"1107016300","9787532591763,753259176X","六朝文絜译注","许〓","2019","chi","Book","PrintBook","Di 1 ban",6,"上海古籍出版社","Shanghai","Pian wen,Chinese essays 220-589,Chinese literature 220-589 History and criticism,Littérature chinoise 220-589 Histoire et critique,Bianwen,Essais chinois 220-589,Chinese literature,Criticism, interpretation, etc,220-589","","否"
"1133774264","9787532593774,7532593770","离骚草木史","周拱辰, active 17th century, author","2019","chi","Book","PrintBook","Di 1 ban",4,"上海古籍出版社","Shanghai","Qu, Yuan, approximately 343 B.C.-approximately 277 B.C,Chu ci (Ancient Chinese poems) Criticism and interpretation,Chu ci (Ancient Chinese poems),Li sao (Qu, Yuan),Plants China Criticism and interpretation,Plants in literature,Plantes dans la littérature,Plants,China,Criticism, interpretation, etc","""离骚草木史""继""离骚草木疏""后考释楚辞名物,识断精审,新意甚多,对于朱熹多有辨正,素称为明代""楚辞""文献之翘楚.此书始刻于清初桐乡圣雨堂,后未见再刻.今存清朱骏声家藏本,有朱骏声数百条批校,批注,文献价值甚大. 此次为该书首次整理,以清初桐乡圣雨堂原刻本为底本,参补以嘉庆八年周氏重刻本","否"
"1350736570","9787573201836,7573201834","顾随文集","顾随, 1897-1960, author","2022","chi","Book","PrintBook","Di 1 ban",7,"上海古籍出版社","Shanghai","Chinese literature History and criticism,Littérature chinoise Histoire et critique","1986年版""顾随文集"",由叶嘉莹先生与顾随之女顾之京女士负责整理,内容分为上下两编与附录,上编主要收入顾随先生的研究论作及古籍整理成果,如""东坡词说"",""稼轩词说"",""揣竽录"",""元明残剧八种(辑佚校勘)"",""佛典翻译文学选""等,下编收入顾随先生创作的诗,词及杂剧选篇,附录收入由叶嘉莹先生记录的上课笔记摘选而成的""驼庵诗话"",叶嘉莹撰写的3万余字纪念文章及顾之京撰写的后记.时隔35年,上古将""顾随文集""重新出版,将原来的繁体竖排版重排为简体横排版,内容一仍其旧,保留原貌","否"
"1292446795","9787573200532,7573200536","初唐詩格律演變研究","李斐, 1978- author","2021","chi","Book","PrintBook","Di 1 ban",2,"上海古籍出版社","Shanghai Shi","Chinese poetry Tang dynasty, 618-907 History and criticism,Chinese language Versification,Poésie chinoise 618-907 (Dynastie des Tang) Histoire et critique,Chinois (Langue) Versification,Chinese poetry,Tang Dynasty (China),Criticism, interpretation, etc,618-907","""初唐诗格律演变研究""共分五章.第一章为""导言"",就研究现状,意义及研究材料,方法,特点等进行回顾,论述.第二章""初唐诗格律及其流变""主要考察初唐诗格律的流变及形成原因,过程.第三章则列举初唐诗格律中的特别现象,如首句入韵与出句平声非韵现象,音义参差现象,王梵志诗歌异调通押现象等.第四章为结论章.第五章""余论""收录了三节内容,如""王力;<汉语诗律学>;诗律补正"",以为正文的补充.书稿曾是南京大学年度优秀博士论文,对前辈学者观点有不少修正,具有一定学术价值","否"
"1066131644","9787532587674,7532587673","鄂爾泰文學家族詩集","鄂尔泰, 1680-1745, author","2018","chi","Book","PrintBook","Di 1 ban",2,"上海古籍出版社","Shanghai","","本书收录了清代满族鄂尔泰家族诗歌作品, 包括: 鄂尔泰诗集""文蔚堂诗集"", ""八旗文经""的""圣驾东廵盛京恭谒祖陵大礼庆成颂"", ""平苗纪功铁柱铭""; 辑录其弟鄂尔奇的""河清颂""和""熙朝雅颂集""所收诗歌作品; 鄂尔泰长子鄂容安的""鄂刚烈诗""; 第五子鄂忻的""咏菊百絶句.""","否"
"1054391126","9787532588626,7532588629","忠正德文集","赵鼎, 1085-1147, author","2018","chi","Book","PrintBook","Di 1 ban",9,"上海古籍出版社","Shanghai","Zhao, Ding, 1085-1147 Criticism and interpretation,Zhong guo wen xue Gu dian wen xue Zuo pin zong he ji Nan song,Criticism, interpretation, etc","原""忠正德文集""已失传, 此乃""四库全书""编纂官主要根据""永乐大典""和""历代名臣奏议""裒缀, 共得奏议, 笔録, 古今体诗, 诗余等二百九十六篇","否"
"1261302059","9787532593187,7532593185","杜邻诗存注","黄稺荃, 1908-1993 author","2019","chi","Book","PrintBook","Di 1 ban",3,"上海古籍出版社","Shanghai","Huang, Zhiquan, 1908-1993 Criticism and interpretation,Chinese poetry 20th century Criticism and interpretation,Poésie chinoise 20e siècle Critique et interprétation,Chinese poetry,Criticism, interpretation, etc,1900-1999","","否"
"1159473628","9787532594948,7532594947","今詞七家說略","施議對, 1940- author","2020","chi","Book","PrintBook","Di 1 ban",2,"上海古籍出版社","Shanghai","Ci (Chinese poetry) History and criticism,Chinese poetry History and criticism,Ci (Poésie chinoise) Histoire et critique,Poésie chinoise Histoire et critique,Chinese poetry,Ci (Chinese poetry),Criticism, interpretation, etc","词学名家施议对先生评述现当代著名词家,多有会心之论","否"
"1233264644","9787532597819,7532597814","西游说唱集","胡胜","2020","chi","Book","PrintBook","Di 1 ban",2,"上海古籍出版社","Shanghai","Wu, Cheng'en, approximately 1500-approximately 1582,Xi you ji (Wu, Cheng'en),Chinese drama,Théâtre chinois","","否"
"1378913775","9787573202994,7573202997","簡帛為臣居官類文獻考論","王輝, 1985- author","2022","chi","Book","PrintBook","Di 1 ban",2,"上海古籍出版社","Shanghai Shi","Inscriptions, Chinese Officials and employees History and criticism,Manuscripts, Chinese Officials and employees History and criticism,Inscriptions chinoises Fonctionnaires Histoire et critique,China Politics and government History To 221 B.C. History and criticism,Chine Politique et gouvernement Histoire Jusqu'à 221 av. J.-C. Histoire et critique","","否"
"1306629858","9787532593200,7532593207","楚辭聽直","黄文焕, 1598-1667, author","2019","chi","Book","PrintBook","Di 1 ban",8,"上海古籍出版社","Shanghai","Chu ci (Ancient Chinese poems),Chinese poetry To 221 B.C. History and criticism,Chinese poetry Qin and Han dynasties, 221 B.C.-220 A.D. History and criticism,Poésie chinoise Jusqu'à 221 av. J.-C. Histoire et critique,Poésie chinoise 221 av. J.-C.-220 (Dynasties des Qin et des Han) Histoire et critique,Chu ci yan jiu,Chinese poetry,Chinese poetry Qin and Han dynasties,Criticism, interpretation, etc,To 220","","否"
"1371192839","9787573205131,7573205139","和亲诗与联姻传说综论","刘洁, author","2022","chi","Book","PrintBook","Di 1 ban",2,"上海古籍出版社","Shanghai Shi","Chinese literature China, Northwest History and criticism,Chinese literature Minority authors History and criticism,Marriages of royalty and nobility China History,Marriage China History,Littérature chinoise Chine (Nord-Ouest) Histoire et critique,Littérature chinoise Auteurs issus des minorités Histoire et critique,Mariages royaux et nobles Chine Histoire,Mariage Chine Histoire","和亲诗与联姻传说作为和亲文学与和亲文化的重要组成部分,在汉匈和亲,唐蕃和亲,满蒙联姻及多民族通婚结亲的诗歌与传说中得到集中的呈现.本书着眼于和亲诗与联姻传说,从文人墨客与百姓两个维度的文学创作出发,开展对和亲文学的研究.本书以历史学为基础,结合社会学和民族学,以文献学,民俗学及新兴的文学地理学为依托,运用文献考证,田野调研,文本细读和比较分析等方法,对和亲诗与联姻传说进行综合研究.结构上以时代为章,以民族和亲联姻为纲,通过雅俗文学的相互补充,较为完整地勾勒出和亲文学的发展主线,揭示其所蕴含的""和亲,和平,和睦,和谐""的文化内涵","否"
"1333588244","9787573200761,7573200765,9787573200778,7573200773","呂本中詩集箋注","祝尚书, author","2021","chi","Book","PrintBook","Di 1 ban",1,"上海古籍出版社","Shanghai Shi","Lü, Benzhong, jin shi 1136 Criticism and interpretation,Lü, Benzhong, jin shi 1136,Criticism, interpretation, etc","","否"
"1273767092","9787573200181,7573200188","曲律注釋","王骥德, -1623, author","2021","chi","Book","PrintBook","Xiu ding ben",4,"上海古籍出版社","Shanghai","Qu (Chinese literature) History and criticism,Qu (Littérature chinoise) Histoire et critique,Qu (Chinese literature),Criticism, interpretation, etc","","否"
"1285909068","9787532599608,7532599604","說文部首源流 : 字體演變與形義圖釋","陳建勝, 1983- author","2021","chi","Book","PrintBook","Di 1 ban",3,"上海古籍出版社","Shanghai","Xu, Shen, -120?,Shuo wen jie zi (Xu, Shen),Chinese language Etymology,Chinois (Langue) Étymologie","","否"
"1233264707","9787532597826,7532597822","中國古代散文發展史新編","刘振东 (College teacher) author","2020","chi","Book","PrintBook","Di 1 ban",2,"上海古籍出版社","Shanghai","Chinese essays History and criticism,Essais chinois Histoire et critique,Chinese essays,Criticism, interpretation, etc","","否"
"1103520983","9787532591527,7532591522","廣韻三家校勘記補釋","范祥雍, author","2019","chi","Book","PrintBook","Di 1 ban",5,"上海古籍出版社","Shanghai","Guang yun,Chinese language Phonology","本书以惠栋, 段玉裁, 顾广圻三家校本原稿为主, 参以其他材料, 凡引古籍111种, 对《廣韻》一书作了较详实的补释校勘考证. 其《自序》一篇对《广韵》的流传版本, 历代校勘情况, 校记的整理方法作了详细说明","否"
