"oclc编号 - oclcNumber","书号 - isbns","书名 - title","作者 - creator","出版日期 - publicationDate","语言 - catalogingLanguage","格式 - generalFormat","详细格式 - specificFormat","版本 - edition","总版本数 - totalEditions","出版社 - publisher","出版地 - publicationPlace","主题 - subjects","简介 - summaries","是否同行审阅 - peerReviewed"
"1306259860","9787573201973,7573201974","诚与真 : 陶渊明考论 = Sincerity and authenticity : textual researches and comments on Tao Yuanming","刘奕, 1978- author","2021","chi","Book","PrintBook","Di 1 ban",1,"上海古籍出版社","Shanghai Shi","Tao, Qian, 372?-427 Criticism and interpretation,Tao, Qian, 372?-427,Poets, Chinese Biography,Poètes chinois Biographies,Poets, Chinese,Biographies,Criticism, interpretation, etc","此书以""诚与真""为主要线索,就陶渊明的生平,作品,精神世界,文学风貌中""重要而又文献足征""的问题与话题,进行了全面而深入的探讨.全书分为上中下三编:上编""陶渊明的历史世界"",分为""生平六考""与""作品六考"",处理陶渊明生平,作品中一些最基本且重要的问题;中编""陶渊明的精神天地"",包括""笃意真古:自我与风度""和""诚之以求真:陶渊明的人生行思""两部分,讨论了陶渊明的自我认知,发展与展示,写作的真诚性,以及他的文化偶像,讨论魏晋玄学对陶渊明思想的影响,进一步分析陶渊明人生与文学的""真""之境界,并拈出""诚之以求真""一词,以此归纳陶渊明人生哲学与实践的独特面目;下编论""陶渊明的文学风貌""陶渊明的文学,包括""谁识弦上音:主题与风格""和""希声:陶诗的修辞"",就陶诗的""边境""主题,陶诗的力量立论,并在修辞学语境中分析陶诗的修辞方法与特色","否"
"1201200195","9787532591213,7532591212","楚辭今注","湯炳正","2019","chi","Book","PrintBook","Di 3 ban",12,"上海古籍出版社","Shanghai","Chu ci (Ancient Chinese poems),Chinese poetry To 221 B.C,Chinese poetry Qin and Han dynasties, 221 B.C.-220 A.D,Poésie chinoise Jusqu'à 221 av. J.-C,Poésie chinoise 221 av. J.-C.-220 (Dynasties des Qin et des Han),Chinese poetry,Chinese poetry Qin and Han dynasties,To 220","","否"
"1265915099","9787532587087,7532587088,9787532587070,753258707X","海浮山堂詞稿","馮惟敏, 1511-1580? author","2018","chi","Book","PrintBook","Di 2 ban",13,"上海古籍出版社","Shanghai","San qu,Sanqu","本书是明代冯惟敏的散曲集. 冯氏散曲题材广泛, 内容丰富, 语言通俗, 气韵生动, 有""曲中辛弃疾""之称. 本书根据郑振铎旧藏抄本标点整理","否"
"1110013756","9787532588367,753258836X","高适岑参诗选评","陈铁民, author","2018","chi","Book","PrintBook","Di 1 ban",6,"上海古籍出版社","Shanghai","Gao, Shi, 707-765 Criticism and interpretation,Cen, Shen, 715-770 Criticism and interpretation,Cen, Shen, 715-770,Gao, Shi, 707-765,Chinese poetry Tang dynasty, 618-907 History and criticism,Poésie chinoise 618-907 (Dynastie des Tang) Histoire et critique,Chinese poetry,Tang Dynasty (China),Criticism, interpretation, etc,618-907","","否"
"1134956559","9787532590995,7532590992,9787532590988,7532590984","珂雪齋集","袁中道, 1570-1623, author","2019","chi","Book","PrintBook","Di 2 ban",9,"上海古籍出版社","Shanghai","Zhong guo wen xue Gu dian wen xue Zuo pin zong he ji Ming dai","","否"
"1178927482","9787532592487,7532592480","岑参集校注","岑参 (约717-769)","2019","chi","Book","PrintBook","Di 1 ban",12,"上海古籍出版社","Shanghai","Tang shi Shi ji,Tang shi Zhu shi","本书共分五卷,卷一至卷四为编年诗,卷五为未编年诗,赋,文,铭.共收诗三七九目,三九五首,吸取了唐诗研究的最新成果,正其讹误,补其不足","否"
"1301903790","9787573202031,7573202032","經學通論箋注","皮錫瑞, 1850-1908, author","2021","chi","Book","PrintBook","Di 1 ban",1,"上海古籍出版社","Shanghai","Wu jing,Wu jing (Title)","本书是对""经学通论""整理,笺注之作.""经学通论""是皮锡瑞经学名著,从今文经学家的立场出发,对儒家经典的撰著流传,内容要义,以及历代考订注疏的得失,读者治学研究的门径等问题,作了扼要的阐述.无论对学者和专门研究者,皆有重要参考价值","否"
"1306629808","9787532591268,7532591263","楚辭燈","林雲銘, jin shi 1658, author","2019","chi","Book","PrintBook","Di 1 ban",14,"上海古籍出版社","Shanghai","Chu ci (Ancient Chinese poems),Chinese poetry To 221 B.C. History and criticism,Chinese poetry Qin and Han dynasties, 221 B.C.-220 A.D. History and criticism,Poésie chinoise Jusqu'à 221 av. J.-C. Histoire et critique,Poésie chinoise 221 av. J.-C.-220 (Dynasties des Qin et des Han) Histoire et critique,Chinese poetry,Chinese poetry Qin and Han dynasties,Criticism, interpretation, etc,To 220","","否"
"1371192983","9787573205490,757320549X","論語義疏校注","馬時芳, 1761-1837, author","2022","chi","Book","PrintBook","Di 1 ban",1,"上海古籍出版社","Shanghai Shi","Confucius","""论语义疏""二十卷,系清代学者马时芳所着,始作于乾隆五十八年(1793),成于道光三年(1823).本书着重在通过""论语""阐发作者思想,认为事功本于学术,欲明学术,则""论语""为本,故疏""论语""二十篇,或直言其指趣,或曲畅旁通,不拘旧说,以学问为根柢,以践行为目的,以矫后世儒术疏阔之病,无汉宋门戶之见,是一部较有特色的注解""论语""之作.郑州大学张艳副教授以1915年禹县存古学社石印""平泉遗书""本""论语义疏""为底本,对本书进行了标点,校注整理.此外,原书每章仅列""论语""原文首句,整理本则依据通行本,补足原文,更便于阅读","否"
"1166307962","9787532595372,7532595374","授堂金石三跋 : 附續跋","武億, 1745-1799, author","2020","chi","Book","PrintBook","Di 1 ban",2,"上海古籍出版社","Shanghai","Inscriptions, Chinese History and criticism,Epitaphs China,Inscriptions chinoises Histoire et critique,Épitaphes Chine,Epitaphs,Inscriptions, Chinese,China,Criticism, interpretation, etc","本书为清代金石学家武亿所撰,原本为""授堂金石三跋""十卷,""授堂金石续跋""十四卷,为金石学名著.作者武亿为清内著名考据学家,学识渊博,广泛收集金石碑刻文字,并进行认真研究,撰写跋语成书,于考古补史有重要的学术价值","否"
"1265985371","9787532591244,7532591247","陶淵明集校箋","陶潜, 372?-427, author","2019","chi","Book","PrintBook","Di 3 ban, xiu ding ben",22,"上海古籍出版社","Shanghai","Tao, Qian, 372?-427 Criticism and interpretation,Tao, Qian, 372?-427,Criticism, interpretation, etc","","否"
"1106792038","9787532591985,7532591980,9787532591992,7532591999","杜詩鏡銓","楊倫, 1747-1803, author","2019","chi","Book","PrintBook","2 ban",58,"上海古籍出版社","Shanghai","Du, Fu, 712-770 Criticism and interpretation,Du, Fu, 712-770,Criticism, interpretation, etc","","否"
"1237370576","9787532591541,7532591549","查慎行選集","查慎行, 1650-1727, author","2019","chi","Book","PrintBook","Di 2 ban",4,"上海古籍出版社","Shanghai","Gu dian shi ge Zhong guo Qing dai Shi ji,Ci (wen xue) Zuo pin ji Zhong guo Qing dai","Ben shu gong ru xuan cha shi er bai liu shi liu shou, ci er shi si que, wen shi pian, fen bie yue zhan qi shi ji de bai fen zhi wu, ci ji de bai fen zhi shi ji wen ji de bai fen zhi jiu. jiu shi er yan, xuan zhu shi zhu yi jian gu qi bu tong ti cai he feng ge, yi chong fen kao lü dao qi suo fan ying de bu tong nei rong. tong shi, zai ce zhong xuan qu qi qian qi zuo pin shi, yi zhu yi lin xuan chu bai qi ta ge ge shi qi de dai biao zuo pin, jin ke neng fan ying cha shi de zong ti feng mao he yi shu te zheng","否"
"1306632742","9787532593781,7532593789","楚辭釋","王闓運, 1833-1916, author","2019","chi","Book","PrintBook","Di 1 ban",7,"上海古籍出版社","Shanghai","Chu ci (Ancient Chinese poems),Chinese poetry To 221 B.C. History and criticism,Chinese poetry Qin and Han dynasties, 221 B.C.-220 A.D. History and criticism,Poésie chinoise Jusqu'à 221 av. J.-C. Histoire et critique,Poésie chinoise 221 av. J.-C.-220 (Dynasties des Qin et des Han) Histoire et critique,Chinese poetry,Chinese poetry Qin and Han dynasties,Criticism, interpretation, etc,To 220","","否"
"1162830273","9787532595358,7532595358","潜研堂金石文跋尾 : 附金石文字目录","钱大昕, 1728-1804, author","2020","chi","Book","PrintBook","Di 1 ban",1,"上海古籍出版社","Shanghai","Inscriptions, Chinese History and criticism,Epitaphs China,Inscriptions chinoises Histoire et critique,Épitaphes Chine,Epitaphs,Inscriptions, Chinese,China,Criticism, interpretation, etc","","否"
"1253471492","9787532587810,7532587819","聲類疏證","錢大昕, 1728-1804, author","2019","chi","Book","PrintBook","Di 1 ban",3,"上海古籍出版社","Shanghai","Qian, Daxin, 1728-1804,Chinese language Phonology","","否"
"1178838990","9787532593231,7532593231","绛云楼题跋","钱谦益 (1582-1664)","2019","chi","Book","PrintBook","Di 1 ban",9,"上海古籍出版社","Shanghai","Ti ba Zuo pin ji Zhong guo Qingdai","本书所收为钱谦益为藏书以及书画,碑帖撰写了众多题跋,涉及版本鉴定,校勘考订,书林掌故,接受源流,诗文人物品评,读书研史心得以及抒发个人心境诸多方面","否"
"1348592024","9787573202697,7573202695","讀易詳說","李光, 1078-1159, author","2022","chi","Book","PrintBook","Di 1 ban",2,"上海古籍出版社","Shanghai Shi","Yi jing","""读易详说""十卷,南宋李光撰.该书一扫象数易学的烦琐支离,也打破了理学家解易的迂腐刻板,转而以人事解""易"",追求以易学经世致用,故风格切实明快,如""四库提要""所云:""于当世之治乱,一身之进退,观象玩辞,恒三致意.""此书也开创了以史证易的先河,被后人推为易学""两派六宗""中""史事宗""的开山之作,在易学史上具有划时代的意义.该书清代已无传本,四库馆臣从""永乐大典""中辑出,仍分十卷,收入""四库全书"".本次整理即以""文渊阁四库全书""本为底本,校以""永乐大典""残卷","否"
"1105716752","9787532588947,7532588947","魏晋风度及其他","鲁迅, 1881-1936, author","2019","chi","Book","PrintBook","Di 1 ban",8,"上海古籍出版社","Shanghai","Chinese essays 20th century,Chinese literature History and criticism,Chinese language History and criticism,Translating and interpreting,Essais chinois 20e siècle,Littérature chinoise Histoire et critique,Chinois (Langue) Histoire et critique,Chinese essays,Chinese language,Chinese literature,Civilization,China Civilization,Chine Civilisation,China,Criticism, interpretation, etc,1900-1999","","否"
"1153951603","9787532594009,7532594009","陈寅恪文集","陈寅恪, 1890-1969, author","2020","chi","Book","PrintBook","Ji nian ban",1,"上海古籍出版社","Shanghai","Chinese literature,Littérature chinoise","","否"
"1191819864","9787532596287,7532596281","楚辭纂說","西村天囚","2020","jpn","Book","PrintBook","Dai 1-han",1,"上海古籍出版社","Shanhai","Qu, Yuan, approximately 343 B.C.-approximately 277 B.C. Criticism and interpretation,Qu, Yuan, approximately 343 B.C.-approximately 277 B.C,Chu ci (Ancient Chinese poems),Criticism, interpretation, etc","","否"
"1137322615","9787532587759,7532587754","出土文獻與古文字研究. 第七輯","復旦大學(Shanghai, Chian).","2018","chi","Book","PrintBook","Di 1 ban",1,"上海古籍出版社","Shanghai","Chinese language Etymology,Chinois (Langue) Étymologie,Antiquities,China Antiquities,Chine Antiquités,China","该稿属""出土文献与古文字研究""集刊之第七辑, 也是复旦大学出土文献与古文字研究中心成立十周年纪念文集. 书稿内容涵盖丰富, 涉及甲骨文, 金文, 楚简, 秦简, 汉简, 帛书, 石鼓文敦煌佛经等方面的字词考释与校读札记, 是出土文献与古文字领域的最新研究成果, 便于研究者得以接触学术界的研究前沿, 并促使研究的进一步深入","否"
"1311460808","9787573201713,7573201710","潘雨廷著作集","潘雨廷, author","2021","chi","Book","PrintBook","Dian cang ben, di 1 ban",1,"上海古籍出版社","Shanghai Shi","Yi jing,Buddhism,Taoism,Bouddhisme,Taoïsme,Philosophy, Chinese","Detailed summary in vernacular field","否"
"1264650376","9787532599639,7532599639","诗经译注","程俊英, annotator","2021","chi","Book","PrintBook","Cai tu zhen cang ben",21,"上海古籍出版社","Shanghai","Shi jing","","否"
"1081181203","9787532589821,753258982X","纳兰词笺注","纳兰性德, author","2018","chi","Book","PrintBook","Xiu ding ben",12,"上海古籍出版社","Shanghai","","清初词坛, 名家辈出. 其中较特出者, 当属纳兰性德. 况周颐""蕙风词话""尊他为"" 国初第一词人"" , 王国维在""人间词话""中对他更为赞赏, 称他为"" 北宋以来, 一人而已"" . 纳兰的身份高贵显赫, 却向往普通人平淡的生活, 这使得他的诗词具有鲜明的个性和艺术特色. 纳兰词以纯真深厚的情感,精致细腻的描写,浅白流畅的语句,哀婉凄艳的风格打动了后世无数读者, 数百年来广为流传, 纳兰性德生前曾把他的部分词作刊印为""侧帽词"", 后顾贞观把他的词与自己的词合刊为""弹指词侧帽词""合刊本. 康熙十七年, 顾贞观又与吴绮为他校定""饮水词"", 刊于吴中. 道光十二年, 汪珊渔根据顾贞观原辑本,杨蓉裳抄本,袁兰村刊本等书, 共辑得词三百余首, 分为五卷, 定名为""纳兰词"". 光绪六年, 许增在汪珊渔本的基础上又增加补遗二十一首, 共计三百四十二首, 成为比较完整的""纳兰词""","否"
"1105784466","9787532588855,7532588858","采菽堂古诗选","陈祚明","2019","chi","Book","PrintBook","Di 1 ban",5,"上海古籍出版社","Shanghai","古典诗歌 诗集 中国","此书共选入先秦至隋代的各类诗歌共4487首,其中正集4015首,补遗472首.诗后附有评点.评点分为两个部分:一是对诗人的总评,一是附在具体诗作篇什之后的分析,评论","否"
"1260285093","9787532599592,7532599590","战国文字通论 (订补)","何琳仪, 1943- author","2021","chi","Book","PrintBook","Di 1 ban",2,"上海古籍出版社","Shanghai","Chinese language Etymology,Chinois (Langue) Étymologie","""战国文字通论(订补)""属古文字学教材性质,是学习古文字学的必读书目.本书之前已分别在中华书局和江苏教育出版社出版过.本次出版在江苏教育版的基础上核对修订.战国古文字是衔接殷周甲骨文,金文与秦汉中古文字的中间环节,但形体较难识别,直到近现代,随着大量竹简帛书等的发现才取得了突破.本书通论战国文字的研究简史,介绍战国文字的研究方法,还提出了自己一整套战国文字的释读方法,因而既是一本入门书,又是一本重要的参考书.书后附有大量参考文献,便于读者深入研究时参考.因为本书填补了战国文字研究领域的空白,还荣获了国家图书奖二等奖","否"
"1178936221","9787532588930,7532588939","人间词话","王国维 (1877-1927)","2019","chi","Book","PrintBook","Di 1 ban",288,"上海古籍出版社","Shanghai","Ci(wen xue) Shi ci yan jiu Zhong guo Gudai","本书从美学的角度欣赏诗词,从艺术的角度品味人生,导引现代的读者通向古代的文学,结合西方之观念与中国传统之心智的一座重要桥梁","否"
"1336480329","9787573201447,7573201443","王逸《楚辭章句》新論","陳鴻圖, 1969- author","2021","chi","Book","PrintBook","Di 1 ban",2,"上海古籍出版社","Shanghai","Wang, Yi, active 89-158,Chu ci (Ancient Chinese poems),Chinese poetry To 221 B.C,Chinese poetry Qin and Han dynasties, 221 B.C.-220 A.D,Poésie chinoise Jusqu'à 221 av. J.-C,Poésie chinoise 221 av. J.-C.-220 (Dynasties des Qin et des Han),Chinese poetry,Chinese poetry Qin and Han dynasties,To 220","","否"
"1113860585","9787532589173,753258917X","中国中古文学史讲义","刘师培, 1884-1919, author","2019","chi","Book","PrintBook","Di 1 ban",33,"上海古籍出版社","Shanghai Shi","Chinese literature Qin and Han dynasties, 221 B.C.-220 A.D. History and criticism,Chinese literature 220-589 History and criticism,Chinese literature,Chinese literature Qin and Han dynasties,Criticism, interpretation, etc,221 B.C.-589 A.D","","否"
"1382682834","9787573205445,7573205449","尚書注 ; 尚書表注","金履祥, 1232-1303, author","2022","chi","Book","PrintBook","Di 1 ban",1,"上海古籍出版社","Shanghai","Shu jing","","否"
"1243222114","9787532593729,753259372X","唐贤三昧集译注","王士祯","2019","chi","Book","PrintBook","Di 1 ban",5,"上海古籍出版社","Shanghai","Tang shi Shi ji","本书以上海古籍出版社1993年11月出版的<四库文学总集选刊·唐贤三昧集>为底本,对<唐贤三昧集>进行译注.<唐贤三昧集>为唐诗读本,主要选取盛唐人诗作","否"
"1109956754","9787532588336,7532588335","黃庭坚诗词文选评","黃宝华, author","2018","chi","Book","PrintBook","Di 1 ban",14,"上海古籍出版社","Shanghai","Huang, Tingjian, 1045-1105 Criticism and interpretation,Huang, Tingjian, 1045-1105 Poetic works,Huang, Tingjian, 1045-1105,Poets, Chinese Song dynasty, 960-1279 Biography,Criticism and interpretation,Poets, Chinese,Song Dynasty (China),Biography,Biographies,Criticism, interpretation, etc,960-1279","Wang an shi shi qi de xin jiu dang zheng, qi shi jiu shi guan yu she hui fa zhan gai zou shen me yang de dao lu de lun zheng. da pi "" xue er you ze shi "" de du shu ren bei juan ru qi zhong, huang ting jian shi qi zhong de yi yuan. ben shu zhen shi di ji lu zhe huang ting jian ru shi yi hou suo jing li de xing shuai rong ru, ti xian le zhe yi duan li shi shi qi nei zhi shi fen zi de pu bian ming yun. dui huang ting jian de shi xue cheng jiu, shu zhong ye you xiang xi jie shao","否"
"1292446347","9787573201232,7573201230","陳獻章全集","陳獻章, 1428-1500, author","2021","chi","Book","PrintBook","Zeng ding ben, di 1 ban",4,"上海古籍出版社","Shanghai","","陈献章诗文有""白沙先生诗文""和""白沙子全集""多个刊本,这次整理,取清康熙四十九年(1710)何九畴编刻""白沙子全集""(香港:白沙文化教育基金会,一九六七年影印本)为底本,之前高简等人在明嘉靖十二年(1533)编刻的""白沙子""较为完善,何九畴的祖先何熊祥于明万历四十年(1516)在高简本基础上增加""补遗""一卷,后出转胜,何九畴在此基础上又远近搜访,重新编次,刊行面世,是诸本中最为完备的刻本.中华书局曾在一九八七年七月出版过""陈献章集"",收入其""理学丛书""中,所采用的底本也是何九畴康熙四十九年刻本","否"
"1162823128","9787532595334,7532595331","希古楼金石萃编","刘承幹, author","2020","chi","Book","PrintBook","Di 1 ban",5,"上海古籍出版社","Shanghai","","","否"
"1109957918","9787532588558,7532588556","桃花扇选评","翁敏华, author","2018","chi","Book","PrintBook","Di 1 ban",5,"上海古籍出版社","Shanghai","Kong, Shangren, 1648-1718. Criticism and interpretation,Tao hua shan (Kong, Shangren),Chinese drama Qing dynasty, 1644-1912 History and criticism,Théâtre chinois 1644-1912 (Dynastie des Qing) Histoire et critique,Chuan qi ju (xi qu) Xi ju yan jiu Zhong guo Ming dai,Chinese drama,Qing Dynasty (China),Criticism, interpretation, etc,1644-1912","","否"
"oclc编号 - oclcNumber","书号 - isbns","书名 - title","作者 - creator","出版日期 - publicationDate","语言 - catalogingLanguage","格式 - generalFormat","详细格式 - specificFormat","版本 - edition","总版本数 - totalEditions","出版社 - publisher","出版地 - publicationPlace","主题 - subjects","简介 - summaries","是否同行审阅 - peerReviewed"
"1109968355","9787532588299,7532588297","辛弃疾词选评","施议对, 1940- author","2018","chi","Book","PrintBook","Di 1 ban",6,"上海古籍出版社","Shanghai","Xin, Qiji, 1140-1207 Criticism and interpretation,Xin, Qiji, 1140-1207,Ci (Chinese poetry) History and criticism,Chinese poetry Song dynasty, 960-1279 History and criticism,Ci (Poésie chinoise) Histoire et critique,Poésie chinoise 960-1279 (Dynastie des Song) Histoire et critique,Chinese poetry,Ci (Chinese poetry),Song Dynasty (China),Criticism, interpretation, etc,960-1279","","否"
"1109956529","9787532588596,7532588599","西厢记选评","李梦生, author","2018","chi","Book","PrintBook","Di 1 ban",5,"上海古籍出版社","Shanghai","Wang, Shifu, 1260-1316,Wang, Shifu, 1260-1316 Criticism and interpretation,Xi xiang ji (Wang, Shifu),Chinese drama Yuan dynasty, 1260-1368,Théâtre chinois 1260-1368 (Dynastie des Yuan),Chinese drama,Yuan Dynasty (China),Criticism, interpretation, etc,1260-1368","","否"
"1056701661","9787532586844,7532586847","国际中国文学研究丛刊. 第五集, 写本学研究专号","王晓平","2018","chi","Book","PrintBook","Di 1 ban",2,"上海古籍出版社","Shanghai","Chinese literature History and criticism Periodicals,Littérature chinoise Histoire et critique Périodiques,Chinese literature,Criticism, interpretation, etc,Periodicals","","否"
"1106152593","9787532589869,7532589862","李清照集笺注","李淸照, 1081-approximately 1141, author","2018","chi","Book","PrintBook","Xiu ding ben, di 2 ban",13,"上海古籍出版社","Shanghai","Li, Qingzhao, 1081-approximately 1141 Criticism and interpretation,Li, Qingzhao, 1081-approximately 1141,Criticism, interpretation, etc","一代才女李清照, 因其不同寻常的经历和际遇, 创作出非凡卓异的文学作品, 百代流传, 千载景仰. 她是婉约词派的代表, 词风幽婉缠绵, 感情浓挚, 音律和谐. ""李清照集笺注""是著名学者徐培均先生倾力之作, 被海内外知名学者称为笺释李清照集的优秀著作. 徐培均先生广泛吸收前人对李清照的研究成果, 尤其是借鉴王仲闻的""李清照集校注""一书, 另外在版本, 考证, 编年, 补遗等方面下功夫, 重新辑校李清照的作品, 将她的诗, 词, 文汇成一书. 对于较负盛名的词作, 首次选用罕见的明汲古阁未刻词本作底本, 校本则采用同样罕见的清汪玢辑, 劳权手校本和清沈瑾钞本等. 同时对诗, 词, 文作品尽可能作了考证编年, 辨析原委, 理清脉络, 纠正讹误, 帮助读者准确理解原作. 书中还收录了历代对李清照的评论资料和新撰的 年谱. 本书以收罗完备, 笺证有据, 资料丰富著称, 极大地方便了读者","否"
"1201503642","9787532597048,7532597040","凌刻套印蘇長公小品","蘇軾, 1037-1101, author","2020","chi","Book","PrintBook","Di 1 ban",1,"上海古籍出版社","Shanghai","","","否"
"1109957803","9787532588541,7532588548","牡丹亭选评","赵山林, author","2018","chi","Book","PrintBook","Di 1 ban",5,"上海古籍出版社","Shanghai","Tang, Xianzu, 1550-1616,Mu dan ting (Tang, Xianzu),Chinese drama Ming dynasty, 1368-1644 History and criticism,Théâtre chinois 1368-1644 (Dynastie des Ming) Histoire et critique,Chinese drama Ming dynasty,Criticism, interpretation, etc,1368-1644","","否"
"1366228089","9787573201331,7573201338","情关西游 (增订本)","张怡微, 1987- author","2022","chi","Book","PrintBook","Di 1 ban",1,"上海古籍出版社","Shanghai","Wu, Cheng'en, approximately 1500-approximately 1582,Xi you ji (Wu, Cheng'en),Chinese fiction Ming dynasty, 1368-1644 History and criticism,Roman chinois 1368-1644 (Dynastie des Ming) Histoire et critique,Chinese fiction Ming dynasty,Criticism, interpretation, etc,1368-1644","","否"
"1082876573","9787532585571,7532585573","韩昌黎文集校注","马其昶, 1855-1930, author","2018","chi","Book","PrintBook","Di 1 ban",4,"上海古籍出版社","Shanghai","Han, Yu, 768-824 Criticism and interpretation,Han, Yu, 768-824,Criticism, interpretation, etc","本书以万历东雅堂本""昌黎先生集""为底本, 去诗存文, 并为文集八卷, 文外集二卷, 遗文一卷, 附录集外文三篇, 集传一卷. 桐城马氏搜罗文章全面完善, 校勘精深. 此'简体版'在保持繁体版的各项笺注释读内容, 专名线标点等基础上, 寄望于以较易进入阅读的简体横排形式, 使更多的读者接触到传统文化的正统解读, 领略其中的优质精髓所在","否"
"1178865757","9787532591381,7532591387","山带阁注楚辞","蒋骥.","2019","chi","Book","PrintBook","Di 1 ban",34,"上海古籍出版社","Shanghai","Chu ci Zhu shi,Gu dian shi ge Shi ji Zhong guo Zhanguo shi dai","本书包括注六卷(含屈原赋二十五篇),余论二卷,说韵一卷.本次整理以雍正五年蒋氏山带阁原刻本为底本,点校者于淑娟首次考证出本书所谓康熙本是流传中的误记.重加校雠,并加以现代标点","否"
"1236387058","9787532589043,7532589048","宋元戏曲史","王国维, 1877-1927, author","2019","chi","Book","PrintBook","Di 1 ban",108,"上海古籍出版社","Shanghai","Chinese drama Song dynasty, 960-1279 History and criticism,Chinese drama Yuan dynasty, 1260-1368 History and criticism,Théâtre chinois 960-1279 (Dynastie des Song) Histoire et critique,Théâtre chinois 1260-1368 (Dynastie des Yuan) Histoire et critique,Chinese drama,Song Dynasty (China),Yuan Dynasty (China),Criticism, interpretation, etc,960-1368","","否"
