"oclc编号 - oclcNumber","书号 - isbns","书名 - title","作者 - creator","出版日期 - publicationDate","语言 - catalogingLanguage","格式 - generalFormat","详细格式 - specificFormat","版本 - edition","总版本数 - totalEditions","出版社 - publisher","出版地 - publicationPlace","主题 - subjects","简介 - summaries","是否同行审阅 - peerReviewed"
"1201376886","9787532597499,7532597490","敦煌邈真赞与对应文献词汇研究","姚美玲, 1965- author","2020","chi","Book","PrintBook","Di 1 ban",1,"上海古籍出版社","Shanghai","Dunhuang manuscripts,Chinese language To 600 Vocabulary,Chinese language Ancient Chinese, 600-1200 Vocabulary,Chinese language Modern Chinese, 1919- Etymology,Epitaphs China,Buddhists Tombs China,Chinois (Langue) Jusqu'à 600 Vocabulaire,Chinois (Langue) 600-1200 (Chinois ancien) Vocabulaire,Chinois (Langue) 1919- (Chinois moderne) Étymologie,Épitaphes Chine,Bouddhistes Tombeaux Chine,Buddhists,Chinese language Etymology,Chinese language Semantics,China,History,618-960","","否"
"1107022162","9787532591190,7532591190","禅解红楼梦","陈嘉许, author","2019","chi","Book","PrintBook","Di 1 ban",2,"上海古籍出版社","Shanghai","Cao, Xueqin, approximately 1717-1763,Hong lou meng (Cao, Xueqin),Chan zong Guan xi ""hong lou meng "" Yan jiu","本书将""红楼梦""的人物和故事情节看作是传统文化人提升精神修养的象征和过程, 在序言部分对解读的思路作了总体介绍, 之后按照""红楼梦""的回目顺序进行具体详解","否"
"1103687109","9787532591473,7532591476","古词今语 : ""荀子""与杨倞注词汇比较研究","霍生玉, author","2019","chi","Book","PrintBook","Di 1 ban",2,"上海古籍出版社","Shanghai","Chinese language Etymology,Chinois (Langue) Étymologie","Detailed summary in vernacular field only,本书稿为训诂学, 汉语史研究著作, 重点是依据""荀子""和杨倞注中所表现的语言现象, 研究上古汉语词汇到唐代的发展变化.全书材料翔实, 以点带面, 研究方法科学可靠, 结论基本可信, 有不少创见, 应该说是当前""荀子""语言词汇研究的最新成果","否"
"1261458481","9787532599233,753259923X","杜清献公集","杜范, 1181-1244, author","2021","chi","Book","PrintBook","Di 1 ban",2,"上海古籍出版社","Shanghai","","《杜清献公集》收録杜范所撰诗歌,奏札,序记,题跋,祝文,传记等,是杜范政治主张,文化交游的集中体现,也反映了南宋晚期政治,军事,经济社会面貌.主要版本有明嘉靖刊本,清钞本,清《四库全书》本,同治戊辰(1868)孙熹九峰书院刊本等.同治间刊本凡二十卷,前附《四库提要》,黄震撰传,《宋史》本传等,卷末有清代台州学者王棻新辑诗文,所做校注以及年谱等文献,最爲完备.本次整理,即以同治间刊本爲底本,该本并以《四库全书》本,清钞本爲校本","否"
"1343106533","9787573202260,7573202261","吴絳雪集","吴絳雪, 1650-1674, author","2022","chi","Book","PrintBook","Di 1 ban",1,"上海古籍出版社","Shanghai Shi","Wu, Jiangxue, 1650-1674,Chinese poetry Qing dynasty, 1644-1912,Chinese literature Qing dynasty, 1644-1912,Poésie chinoise 1644-1912 (Dynastie des Qing),Littérature chinoise 1644-1912 (Dynastie des Qing)","吴绛雪,本名吴宗爱,后人著述中多称""徐烈妇"".生活在清初顺康年间.""清史稿,列传二九七列女""中,记载了她的事迹,是一位才女,烈女,美人,殁年仅二十五岁.著名回文诗""香莲碧水动风凉,水动风凉夏日长.长日夏凉风动水,凉风动水碧莲香""据说即清初大才女吴绛雪所作.道光年间吴廷康,黄燮清,俞樾等人对她大力褒奖,吹捧题咏,并以其生平创作了一些文学作品.本书收录吴绛雪诗稿二卷,同心栀子图一卷,以她的事迹为题材的传奇""桃溪雪""和弹词""同心栀"",及朝廷旌表之后徐氏祖祠为她建立的独立祠堂的规章管理制度.以及相关序跋题咏,白话文小说等","否"
"1197632343","9787532597161,7532597164","「中原文献南传」论稿","王建生, 1981- author","2020","chi","Book","PrintBook","Di 1 ban",2,"上海古籍出版社","Shanghai","Chinese literature Song dynasty, 960-1279 History and criticism,Littérature chinoise 960-1279 (Dynastie des Song) Histoire et critique,Chinese literature,Song Dynasty (China),Criticism, interpretation, etc,960-1279","","否"
"1090078636","9787532590728,7532590720","周易阶梯","郑吉雄, author","2018","chi","Book","PrintBook","Di 1 ban",2,"上海古籍出版社","Shanghai","Yi jing,Philosophy, Chinese,Philosophie chinoise","《周易》历来号称难读, 作者的目标, 就是把《周易》放下神坛, 真正客观平实地把《周易》当作一部普通人可以阅读并且能读懂的书来对待.作者是易学专家, 同时也擅长研究中国思想史和中国哲学.作者以精深的学术底蕴和广阔的学术视野, 在现代学术框架和条件下对《周易》进行剖析, 专门为普通读者撰写的具有指导意义的《周易》读物, 不故弄玄, ̌不故作高深, 持论平实, 言简意赅.全书共分十二章, 涉及《周易》经传的方方面面:《周易》'经''传'的文献形式和架构;读《易》方法;出土《周易》文献;'经' 与'传'的义理和哲学;'筮法'和《易》的义理;《易》学重要观念;《周易》在近世全球化的历程, 近代欧, 美, 日, 韩《易》学成就的梗概.最后附录三种, 一为英文序言;二为作者重新校勘标点《周易》经传白文, 代表了作者对于《周易》经传本身的理解;三为作者特意为初学者所撰之《推荐书目》, 公允而精审地评介重要易学研究著作18种, 既可指引门径, 又得登堂入室, 十分精彩.""","否"
"1134983853","9787532594207,7532594203","《文选集注》研究","王翠红, 1979- author","2019","chi","Book","PrintBook","Di 1 ban",2,"上海古籍出版社","Shanghai","Wen xuan,Chinese literature To 221 B.C. History and criticism,Chinese literature Qin and Han dynasties, 221 B.C.-220 A.D. History and criticism,Chinese literature 220-589 History and criticism,Littérature chinoise Jusqu'à 221 av. J.-C. Histoire et critique,Littérature chinoise 221 av. J.-C.-220 (Dynasties des Qin et des Han) Histoire et critique,Littérature chinoise 220-589 Histoire et critique,Chinese literature,Chinese literature Qin and Han dynasties,Criticism, interpretation, etc,To 589","古钞""文选集注""的发现与辑印, 是现代""文选""学研究史上非常重要的一环.本书为研究古钞本""文选集注""的优秀论著","否"
"1289884004","9787573201201,7573201206","回鹘文献梵语借词研究","朱国祥, 1972- author","2021","chi","Book","PrintBook","Di 1 ban",2,"上海古籍出版社","Shanghai Shi","Uighur language,Sanskrit language Foreign words and phrases,Ouïgour (Langue)","","否"
"1108789449","9787532587551,753258755X,9787532596942,753259694X","清詩話全編","張寅彭","2018","chi","Book","PrintBook","Di 1 ban",3,"上海古籍出版社","Shanghai","Chinese poetry Qing dynasty, 1644-1912 History and criticism,Poésie chinoise 1644-1912 (Dynastie des Qing) Histoire et critique,Shi hua Zhong guo Qing dai,Chinese poetry,Qing Dynasty (China),Criticism, interpretation, etc,1644-1912","","否"
"1257758890","9787532599417,7532599418","傳抄古文綜合研究","李春桃, active 2016, author","2021","chi","Book","PrintBook","Di 1 ban",1,"上海古籍出版社","Shanghai","Chinese characters,Chinois (Langue) Caractères","","否"
"1146560067","9787532594436,7532594432","古文獻語言研究","周玉秀, 1964- author","2019","chi","Book","PrintBook","Di 1 ban",3,"上海古籍出版社","Shanghai","Chinese language To 600,Chinois (Langue) Jusqu'à 600,Chinese language,To 600","","否"
"1159552616","9787532594931,7532594939","詞學科目述要","施議對, 1940- author","2020","chi","Book","PrintBook","Di 1 ban",2,"上海古籍出版社","Shanghai","Ci (Chinese poetry) History and criticism,Ci (Poésie chinoise) Histoire et critique,Ci (Chinese poetry),Criticism, interpretation, etc","本书从词体的发生发展, 文体特点以及词学的自觉, 独立, 沿革等方面, 系统论述词学学科的性质, 历史, 现状与未来, 提出""自觉的词学 "" , ""词学史上三座里程碑 "", ""二十世纪词学传人""等命题, 足供学界参考. 该书多数章节先前已在《文学评论》《文学遗产》《词学》等核心期刊发表","否"
"1374052017","9787573205100,7573205104","文徵明書畫資料匯編","文徴明, 1470-1559, author","2022","chi","Book","PrintBook","Di 1 ban",2,"上海古籍出版社","Shanghai","Wen, Zhengming, 1470-1559,Calligraphy, Chinese History Ming-Qing dynasties, 1368-1912,Painting, Chinese Ming-Qing dynasties, 1368-1912,Calligraphie chinoise Histoire 1368-1912 (Dynasties des Ming et des Qing),Peinture chinoise 1368-1912 (Dynasties des Ming et des Qing)","""文徵明书画资料汇编""是周道振先生就所知文徵明书画墨迹,碑帖,印本,网络传真,及明清以来诗文集,书画录,笔记及其他相关资料汇编而成的一部大书.全书以文徵明所制书画作品内容,分""书"",""画"",""书画扇""三大类十二卷,""书""中又分""自作诗文"",""非自作诗文""两类;每件作品记录其""作品名称""""内容及款识""""资料来源""""现存地点""及""编者按语及考证""五类;另有""评论文徵明书法"",""文徵明刻""停云馆帖""述评"",""文徵明书法故事"",""未经目丛帖中文徵明书法"",""文徵明书法作品年表""等五个附录,内容非常丰富,对于中国古代书画研究者和爱好者具有较高的参考价值","否"
"1158424262","9787532595891,7532595897","巴渝石刻文獻兩種合校","姚觐元, ju ren 1843, author","2020","chi","Book","PrintBook","Di 1 ban",1,"上海古籍出版社","Shanghai","Inscriptions, Chinese China Chongqing,Stone carving China Chongqing,Inscriptions chinoises Chine Chongqing,Sculpture en pierre Chine Chongqing,Inscriptions, Chinese,Stone carving,China Chongqing","","否"
"1107601471","9787532592210,7532592219","中國詩學之現代觀","陈伯海, author","2019","chi","Book","PrintBook","Di 1 ban",5,"上海古籍出版社","Shanghai","Chinese poetry History and criticism Theory, etc,Poetics,Poésie chinoise Histoire et critique Théorie, etc,Poétique,Shi ge li lun Yan jiu Zhong guo,Criticism, interpretation, etc","本书是对中国诗学的现代诠释.阐释了中国诗学的人学本原观, 审美体性观, 文学形体观.从特定范畴与命题切入, 通过追源溯流式的考察, 弄清其本来涵义及演化脉络, 再逐步提升到古今会通的理论观照点上来","否"
"1248916602","9787532598564,753259856X","追懷生命 : 中國歷史上的墓志銘 = Chinese funerary biographies","Patricia Buckley Ebrey","2021","chi","Book","PrintBook","Di 1 ban",1,"上海古籍出版社","Shanghai","Epitaphs China,Inscriptions, Chinese History and criticism,Épitaphes Chine,Inscriptions chinoises Histoire et critique,Epitaphs,Inscriptions, Chinese,China History,Chine Histoire,China,Criticism, interpretation, etc,History","","否"
"1356950435","9787573204134,7573204132","李梦阳 : 南北分野与明代学术 = Li Mengyang : the north-south divide, and literati learning in Ming China","王昌伟, 1970- author","2022","chi","Book","PrintBook","Di 1 ban",1,"上海古籍出版社","Shanghai Shi","Li, Mengyang, 1472-1529 Criticism and interpretation,Chinese literature Ming dynasty, 1368-1644 History and criticism,Littérature chinoise 1368-1644 (Dynastie des Ming) Histoire et critique,China Intellectual life 960-1644,Chine Vie intellectuelle 960-1644","李梦阳(1473-1530),一位文官和文人,在十六世纪发起了一场旨在恢复中国古代散文和诗歌风格的复古运动.以这一特殊人物为关注中心,作者注意到了与其生活时代相关的诸多重要议题,包括明代科举取士的名额,南北人官僚特色,北宋古文运动的原委,南宋道学及其诘难者和竞争学派的学说,等等.因此,该书从多方面叙述和解释了明代三次复古运动的原委始末,而重点关注所及,包括了明代(尤其中叶)的政治,思想,文化,文学上大议题,大事情以及文化传承上的重要人物,整体上反映了""士人""对于""文""""道""关系的不同观念与论辩要项.在这本书中,作者全面审视了李梦阳的知识结构,并将他对""士人之学""的重新定义置于宋代以来知识转型的大背景下,得出乃是他构建完美社会秩序的一种方式的结论.书中考察了李梦阳所处的独特历史关头,当时中国的文人文化存在着明显的地域分野.作者认为,这种地域分野现象以及明代文人划分学派的方式,对于理解李梦阳乃至有明一代士人的思想及其遗产至关重要","否"
"1297822837","9787573201102,7573201109","上海博物館藏戰國竹書楚辭箋註","曹錦炎, author","2021","chi","Book","PrintBook","Di 1 ban",2,"上海古籍出版社","Shanghai","Inscriptions, Chinese History and criticism,Wooden tablets China,Inscriptions chinoises Histoire et critique,Tablettes en bois Chine,Inscriptions, Chinese,Wooden tablets,China History Warring States, 403-221 B.C,Chine Histoire 403-221 av. J.-C. (Royaumes combattants),China,Criticism, interpretation, etc,History,403-221 B.C","上海博物馆藏战国楚竹书,经过整理,共发现五篇楚辞类作品:""凡物流形""""李赋""""兰赋""""有皇将起""""鶹[Li]"",已于""上海博物馆藏战国楚竹书""第七,八册公布,整理者即是曹锦炎先生.这五篇作品均不见于今本""楚辞"",从体裁和句式看,也比今本各篇显得更具原始性,这对研究楚辞这种诗体的形成很有帮助.本书将五篇楚辞集中在一起,结合学界最新研究成果和个人研究心得,对释文与注释做了细致的修订与增补.书中还附有简文摹本,可和释文注释对照阅读.相信本书的出版,会对楚辞研究,中国文学史,思想史的研究对大有裨益","否"
"1100250532","9787532587667,7532587665","丁澎文學家族詩集","丁澎, 1622-1686, author","2019","chi","Book","PrintBook","Di 1 ban",2,"上海古籍出版社","Shanghai","Gu dian shi ge Shi ji Zhong guo Qing dai","""丁澎文学家族诗集""收录清代回族丁氏家族诗歌作品, 包括:丁澎的""扶荔堂诗稿"", ""扶荔堂诗集选"", ""扶荔词"", 其婿顾永年""梅东草堂诗集"", 以及其弟丁潆""秉翟词.""","否"
"1226951857","9787532585892,7532585891","Ge-sar sgrung yig chen mo bzhugs so : a Collection of Books on Gesar Epic Studies = 格萨尔文庫","《格萨尔文库》编纂委员会","2018","tib","Book","PrintBook","Di 1 ban",1,"上海古籍出版社","Shanghai","Gesar (Legendary character),Gesar (Legendary character) Criticism, Textual,Criticism, interpretation, etc","Collection of episodes from the King Gesar epic cycle in the original Tibetan, Mongolian, phoneticized Monguor, and phoneticized Western Yugur(?) languages; also includes a Chinese translation for each episode with some annotation,本稿是迄今最权威,最全的格萨尔史诗发整理,汉译. 格萨尔王的传说源远流长, 形成了丰富而复杂的版本体系, 也有多语种的流传. 目前国内格萨尔的整理出版情况较不规范, 本稿提供了最权威的翻译整理,最齐备的多语种版本, 使得这一传统史诗瑰宝得以完善保存流传","否"
"1348276854","9787573201959,7573201958","近代日本中国俗文学研究史论","张真 (Writer on Chinese literature), author","2021","chi","Book","PrintBook","Di 1 ban",2,"上海古籍出版社","Shanghai Shi","Chinese literature Japan History and criticism,Folk literature, Chinese Japan,Littérature chinoise Japon Histoire et critique,Littérature populaire chinoise Japon,Zhong guo wen xue tong su zuo pin li shi yu pi ping,Chinese literature,Folk literature, Chinese,Japan,Criticism, interpretation, etc","作为日本汉学的重要组成部分,日本中国俗文学研究取得了较多的成就,但中国学界对其成就关注和再研究则少得多,且较为零碎而不成系统,无法厘清其自身的发展脉络与学术规律.尤其是到目前为止,尚未见有关中国古代俗文学在明治维新以来日本的传播与接受的专题研究.本书一定程度上填补了这一空白.本书主要从近代日本中国俗文学学科的生成背景,早稻田大学与中国俗文学学科的初创,近代日本中国俗文学研究重要学派,中国俗文学重要问题研究举隅等方面着手,对近代日本中国俗文学研究作系统梳理和研究.并编制""近代日本中国俗文学研究大事编年"",""近代日本中国俗文学研究著述目录""等,对学界多有参考之用","否"
"1237859962","9787532598021,7532598020","桃溪類稿","謝鐸, 1435-1510 author","2020","chi","Book","PrintBook","Di 1 ban",1,"上海古籍出版社","Shanghai","","","否"
"1081220707","9787532589838,7532589838,9787532589845,7532589846","李白集校注","瞿蛻園, 1892- author","2018","chi","Book","PrintBook","Di 2 ban",,"上海古籍出版社","Shanghai","Li, Bai, 701-762 Criticism and interpretation,Li, Bai, 701-762,Criticism, interpretation, etc","本书以清乾隆刊本王琦辑注""李太白文集""为底本, 并校以北京图书馆藏北宋本""李太白文集"", 日本京都大学影印宋刊""李太白文集""等十余种重要刊本和唐宋重要总集和选本. 注和评笺部分, 除以杨齐贤, 萧士赟, 胡震亨, 王琦四家为基础外, 又搜集唐宋以来诗话, 笔记, 考据材料, 以及同期研究成果, 加以笺释和考订, 并纠正了前人的一些错误","否"
"1082872145","9787532587827,7532587827","音韻學 : 方法和實踐","郑伟, 1979- author","2018","chi","Book","PrintBook","Di 1 ban",2,"上海古籍出版社","Shanghai","Chinese language Phonology","","否"
"1192562377","9787532595822,753259582X","新训诂学","蘇建洲, 1974- author","2020","chi","Book","PrintBook","Di 1 ban",13,"上海古籍出版社","Shanghai","Chinese language Semantics,Chinois (Langue) Sémantique","该书由作者根据学界较新的训诂学研究成果撰写, 适合中文系师生, 国学爱好者及研究者参考. 训诂学是一门综合文字学, 音韵学, 语法学, 校勘学, 语源学的学科, 为了让读者一窥训诂学的堂奥, 本书除了介绍最新的理论外, 还搭配了重要的训诂例证和学生常犯的错误, 力求理论与教学紧密结合. 为让学生了解""二重证据法 "" 的面貌, 同时对甲骨, 金文, 楚简, 秦简, 汉简的内容有初步认识, 书中例证包含很多出土文献, 每条例证都附上解释与翻译. 用语浅显平易, 清晰易懂, 引用典籍古文尽量附上翻译, 避免掉书袋. 本书除了可作为各大学讲授训诂学时的教材, 对于从事初高中语文教学的教师以及对国学感兴趣的读者, 都是案头必备的专业参考书籍","否"
"1350451285","9787573203496,7573203497","宋代巴蜀杜诗学文献研究 = A study of literature on Du Fu's poems in Ba-Shu in the Song dynasty","彭燕, author","2022","chi","Book","PrintBook","Di 1 ban",2,"上海古籍出版社","Shanghai Shi","Du, Fu, 712-770 Criticism and interpretation","","否"
"1373936137","9787573202406,7573202407","关山明月 : 古突厥回鹘碑志写本的历史语言研究","白玉冬, author","2022","chi","Book","PrintBook","Di 1 ban",1,"上海古籍出版社","Shanghai Shi","Inscriptions, Uighur,Uighur language History and criticism,Ouïgour (Langue) Histoire et critique","""关山明月:古突厥回鹘碑志写本的历史语言研究""是国家社科基金重大项目""北朝至隋唐民族碑志整理与研究-以胡语和境外汉语碑志为对象""(编号18ZDA177),中央高校基本科研业务费专项资金资助(Supported by the Fundamental Research Funds for the Central Universities)项目""胡语与境外汉语碑刻与唐代西北地区历史""(编号 2019jbkyta001)阶段性研究成果.""关山明月:古突厥回鹘碑志写本的历史语言研究""全书共十一章,分别为:""东突厥汗国的拓拔语佛教集团婆罗米文慧斯陶鲁盖碑文研究""""华夏称号""王""在暾欲谷碑中的出现""""鄂尔浑突厥鲁尼文碑铭的cUlgl(cUlgil)""""蒙古国回鹘四方墓出土鲁尼文刻铭释读-兼谈鲁尼文字形之演变""""米兰出土Or.821276鲁尼文军需文书研究""""突厥鲁尼文原字v的释音""""和田出土鲁尼文木牍文再研究""""吐鲁番雅尔湖石窟第5窟鲁尼文题记释读与研究""""有关回鹘改宗摩尼教的U72 U73,U206文书再释读""""有关高昌回鹘的-篇回鹘文文献一xj222 0661.9文书的历史学考释""""有关高昌回鹘历史的一方回鹘文墓碑-蒙古国出土乌兰浩木碑释读与研究"".著者白玉冬教授通过细心爬梳中古时期回鹘文,鲁尼文,突厥语等民族碑志写本,对中古时期北方少数民族的历史语言等进行考证研究,在国内外学者已往的解读的基础上,重新进行了整理,发覆和解读,以出土文献对中古时期北方少数民族的历史等进行探源揭秘,揭示了中古时期北方民族历史的诸多细节,展示了北方民族政治制度,经济文化,社会历史等方面的丰富性和复杂性,将相关研究推向新的高度","否"
"1083707968","9787532590407,7532590402,9787532590384,7532590380","譚元春集","譚元春, 1586-1637, author","2018","chi","Book","PrintBook","Di 2 ban",6,"上海古籍出版社","Shanghai","","Tan Yuanchun shi Jingling pai de dai biao zuo jia zhi yi. Ben shu hui ji duo zhong Ming ke ben Tan Yuanchun shi wen ji, ru ""Yu gui tang he ji"", ""Yu gui tang xin shi"", ""Yu gui tang wei ke shi"", ""Guwan ji"", ""Tan Youxia he ji"" deng, bing yi duo zhong Ming ke ben, Qing chu ke ben can jiao. Shu hou fu you guan Tan Yuanchun shi wen ji de xu ba, zhuan ji zi liao ji Jingling pai shi liao, wei zui wan shan de Tan Yuanchun shi wen quan ji","否"
"1052455880","9787532587735,7532587738","小罗浮草堂诗钞校注","李寅生, 1962- writer of added commentary","2018","chi","Book","PrintBook","Di 1 ban",1,"上海古籍出版社","Shanghai","Feng, Minchang, 1747-1806 Criticism and interpretation,Chinese poetry Qing dynasty, 1644-1912 History and criticism,Poésie chinoise 1644-1912 (Dynastie des Qing) Histoire et critique,Gu dian shi ge Zhu shi Zhong guo Qing dai,Chinese poetry,Qing Dynasty (China),Criticism, interpretation, etc,1644-1912","Ben shu yi jia qing shi si nian (1809 nian) "" xiao luo fu cao tang shi chao "" wei di ben, shou lu le feng min chang de shi ge zuo pin, bao gua "" yun cang jiu yong "" "" cun ju "" "" chun cao "" "" xiao fa jiang wu shen da "" deng,冯敏昌是清代中期粤地著名诗人, ""小罗浮草堂诗钞""涵盖其一生主要经历. 本书以嘉庆十四年""小罗浮草堂诗钞""为底本整理","否"
"1126343227","9787532593460,7532593460","离骚赋补注 屈赋微","朱駿聲, 1788-1858, author","2019","chi","Book","PrintBook","Di 1 ban",1,"上海古籍出版社","Shanghai","Qu, Yuan, approximately 343 B.C.-approximately 277 B.C,Chu ci (Ancient Chinese poems),Li sao (Qu, Yuan),Chinese poetry To 221 B.C. History and criticism,Chinese poetry Qin and Han dynasties, 221 B.C.-220 A.D. History and criticism,Poésie chinoise Jusqu'à 221 av. J.-C. Histoire et critique,Poésie chinoise 221 av. J.-C.-220 (Dynasties des Qin et des Han) Histoire et critique,Chinese poetry,Chinese poetry Qin and Han dynasties,Criticism, interpretation, etc,To 220","离骚赋补注'仿洪兴祖'楚辞补注'体例.作者精通说文之学, 长于音韵训诂, 对'离骚'句式作了分析与分类, 对'离骚'字词训释也产生许多独到精确的见解, 从语言文字学角度甚有价值.'屈赋微'分上下两卷, 采屈赋二十五篇之说, 被称为'清代说屈赋者之殿'","否"
"1096269031","9787532587322,7532587320","陈子展文存","陈子展, author","2018","chi","Book","PrintBook","Di 1 ban",2,"上海古籍出版社","Shanghai","Chinese literature History and criticism,Littérature chinoise Histoire et critique,Chinese literature,Criticism, interpretation, etc","本书为复旦大学中文系先哲陈子展先生散见各 处作品的汇编, 此书所收内容大多为1949年建国以前创作或发表, 尽量不与建国以来发表或刊行的作品重复","否"
