"oclc编号 - oclcNumber","书号 - isbns","书名 - title","作者 - creator","出版日期 - publicationDate","语言 - catalogingLanguage","格式 - generalFormat","详细格式 - specificFormat","版本 - edition","总版本数 - totalEditions","出版社 - publisher","出版地 - publicationPlace","主题 - subjects","简介 - summaries","是否同行审阅 - peerReviewed"
"1089174959","9787101132236,7101132235","叶嘉莹说汉魏六朝诗","叶嘉莹, author","2018","chi","Book","PrintBook","Beijing di 1 ban",7,"中华书局","Beijing Shi","Chinese poetry Qin and Han dynasties, 221 B.C.-220 A.D. History and criticism,Chinese poetry 220-589 History and criticism,Poésie chinoise 221 av. J.-C.-220 (Dynasties des Qin et des Han) Histoire et critique,Poésie chinoise 220-589 Histoire et critique,Gu dian shi ge Shi ge ping lun Zhong guo Han dai,Gu dian shi ge Shi ge ping lun Zhong guo Wei jin nan bei chao shi dai,Chinese poetry,Chinese poetry Qin and Han dynasties,Criticism, interpretation, etc,221 B.C.-589 A.D","","否"
"1081405312","9787101131758,7101131751","唐宋名家词选 : 全本","龙榆生, 1902-1966, editor","2018","chi","Book","PrintBook","Beijing di 1 ban",80,"中华书局","Beijing Shi","Ci (Chinese poetry),Chinese poetry Tang dynasty, 618-907,Chinese poetry Song dynasty, 960-1279,Ci (Poésie chinoise),Poésie chinoise 618-907 (Dynastie des Tang),Poésie chinoise 960-1279 (Dynastie des Song),Tang song ci Xuan ji,Chinese poetry,Song Dynasty (China),Tang Dynasty (China),618-1279","","否"
"1149539755","9787101132403,7101132405","孟子","钱逊, author","2018","chi","Book","PrintBook","Beijing di 1 ban",2,"中华书局","Beijing","Mencius,Mengzi (Mencius),Philosophy, Chinese To 221 B.C,Philosophie chinoise Jusqu'à 221 av. J.-C,Philosophy, Chinese,To 221 B.C","","否"
"1150888165","9787101131635,7101131638","论语","蔡尚思, 1905-2008, author","2018","chi","Book","PrintBook","Beijing di 1 ban",,"中华书局","Beijing","Confucius,Lun yu (Confucius)","","否"
"1091026027","9787101131970,7101131972","本来的孔子 : ""论语""新解","甘霖, author","2018","chi","Book","PrintBook","Beijing di 1 ban",2,"中华书局","Beijing Shi","Confucius,""Lun yu "" Yan jiu,Lun yu (Confucius),Ru jia","Ben shu zhu yao nei rong you : xue er pian di yi ; wei zheng pian di er ; li ren pian di si ; zi han pian di jiu ; xian jin pian di shi yi ; zi lu pian di shi san ; wei ling gong pian di shi wu deng","否"
"1096425435","9787101131802,7101131808","葉嘉莹说初盛唐诗 : 附音频","叶嘉莹, author","2018","chi","Book","PrintBook","Di 1 ban",7,"中华书局","Beijing Shi","Chinese poetry Tang dynasty, 618-907 History and criticism,Poets, Chinese Tang dynasty, 618-907,Poésie chinoise 618-907 (Dynastie des Tang) Histoire et critique,Poètes chinois 618-907 (Dynastie des Tang),Tang shi Shi ge ping lun,Chinese poetry,Poets, Chinese,Tang Dynasty (China),Criticism, interpretation, etc,618-907","","否"
"1226469060","9787101135015,7101135013","補過齋日記","杨增新, 1864-1928 author","2018","chi","Book","PrintBook","Beijing di 1 ban",1,"中華書局","Beijing Shi","Chinese classics History and criticism,Classiques (Littérature chinoise) Histoire et critique,Chinese classics,Criticism, interpretation, etc","","否"
"1096387548","9789888512973,9888512978","講開有段古 : 老餅潮語. IV","蘇萬興, author","2018","chi","Book","PrintBook","Chu ban",,"中華書局(香港)有限公司","Xianggang","Cantonese dialects China Hong Kong Slang,Chinese language Dialects China Hong Kong Slang,Cantonese dialects Etymology,Chinese language Dialects China Guangdong Sheng,Cantonais (Dialectes) Étymologie,Chinois (Langue) Dialectes Chine Guangdong (Sheng),Cantonese dialects Slang,Chinese language Dialects,China Guangdong Sheng,China Hong Kong","","否"
"1111685455","9787101135770,7101135773","孟子译注 : 简体精装本","杨伯峻, 1909-1992, writer of added commentary","2018","chi","Book","PrintBook","Beijing di 1 ban",2,"中华书局","Beijing","Mencius,Meng zi Yi wen,Meng zi Zhu shi,Mengzi (Mencius),Philosophy, Confucian,Philosophy, Chinese To 221 B.C,Philosophie confucéenne,Philosophie chinoise Jusqu'à 221 av. J.-C,Ru jia,Philosophy, Chinese,To 221 B.C","","否"
"1107700347","9787101134414,7101134416","小說旁證","孫楷第, 1899-1986, author","2018","chi","Book","PrintBook","Beijing di 1 ban",7,"中華書局","Beijing Shi","Chinese fiction History and criticism,Chinese literature History and criticism,Roman chinois Histoire et critique,Littérature chinoise Histoire et critique,Chinese fiction,Chinese literature,Criticism, interpretation, etc","","否"
"1223971154","9787101130294,7101130291","千家诗赏析","徐有富, 1943- author","2018","chi","Book","PrintBook","Beijing di 1 ban",4,"中华书局","Beijing","Qian jia shi,Chinese poetry Tang dynasty, 618-907 History and criticism,Chinese poetry Song dynasty, 960-1279 History and criticism,Poésie chinoise 618-907 (Dynastie des Tang) Histoire et critique,Poésie chinoise 960-1279 (Dynastie des Song) Histoire et critique,Chinese poetry,Song Dynasty (China),Tang Dynasty (China),Criticism, interpretation, etc,618-1279","","否"
"1104790868","9787101132939,7101132936","唐诗选注","葛兆光, 1950-, author","2018","chi","Book","PrintBook","Di 1 ban",11,"中华书局","Beijing","Chinese poetry Tang dynasty, 618-907 History and criticism,Poésie chinoise 618-907 (Dynastie des Tang) Histoire et critique,Tang Dynasty (China),Chinese poetry,Criticism, interpretation, etc,618-907","","否"
"oclc编号 - oclcNumber","书号 - isbns","书名 - title","作者 - creator","出版日期 - publicationDate","语言 - catalogingLanguage","格式 - generalFormat","详细格式 - specificFormat","版本 - edition","总版本数 - totalEditions","出版社 - publisher","出版地 - publicationPlace","主题 - subjects","简介 - summaries","是否同行审阅 - peerReviewed"
"1042277283","9787101128666,7101128661","康震讲诗仙李白","康震, author","2018","chi","Book","PrintBook","Di 1 ban",2,"中华书局","Beijing","Li, Bai, 701-762,Poets, Chinese Biography,Chinese poetry Tang dynasty, 618-907,Poètes chinois Biographies,Poésie chinoise 618-907 (Dynastie des Tang),Chinese poetry,Poets, Chinese,Tang Dynasty (China),Biography,Biographies,618-907","","否"
"1111685376","9787101135763,7101135765","论语译注 : 简体精装本","杨伯峻, 1909-1992, writer of added commentary","2018","chi","Book","PrintBook","Beijing di 1 ban",2,"中华书局","Beijing Shi","Confucius,Lun yu (Confucius)","","否"
"1042277314","9787101127201,7101127207","康震讲诗圣杜甫","康震, author","2018","chi","Book","PrintBook","Di 1 ban",1,"中华书局","Beijing","Du, Fu, 712-770,Dufu, (712-770) Renwuyanjiu,Poets, Chinese Tang dynasty, 618-907 Biography,Chinese poetry Tang dynasty, 618-907,Poètes chinois 618-907 (Dynastie des Tang) Biographies,Poésie chinoise 618-907 (Dynastie des Tang),Chinese poetry,Poets, Chinese,Tang Dynasty (China),Biography,Biographies,618-907","Ben shu zuo zhe kang zhen jiao shou gen ju qi zai "" bai jia jiang tan "" suo zuo jiang zuo zheng li zeng ding er cheng, shu zhong jian shi you guan du fu ji qi sheng huo shi dai de li shi sui pian, jie he shi ge zhong suo zhe she de du fu sheng huo de dian dian di di, jing cai cheng xian le du fu de cheng "" sheng "" zhi lu","否"
"1119722728","9789578595187,9578595182","蒲留仙松齡先生年譜","劉階平, author","2018","chi","Book","PrintBook","Zai ban",8,"中華書局","Taibei Shi","Pu, Songling, 1640-1715 Chronology,Pu, Songling, 1640-1715,Authors, Chinese Chronology,Écrivains chinois Chronologie,Authors, Chinese,Chronology,chronologies (lists),Chronologies","","否"
"1083151540","","全本周易导读本","寇方墀, author","2018","chi","Book","Digital","Beijing di 1 ban",3,"中華書局","Beijing","Yi jing","","否"
"1120771955","9787101135640,7101135641","亨利·雷马克与比较文学关系研究 = A study on the role of Henry H. H. Remak in comparative literature","姚连兵, 1975- author","2018","chi","Book","PrintBook","Beijing di 1 ban",2,"中華書局","Beijing","Remak, Henry H. H. 1916- Criticism and interpretation,Leimake, (Remark, Henry H. H. , 1916-2009) Bijiaowenxue Wenxuelilun Yanjiu,Remak, Henry H. H. 1916-,Comparative literature,Comparative literature Themes, motives,Littérature comparée Thèmes, motifs,Criticism, interpretation, etc","","否"
"1090053127","9787101134322,7101134327","客天下楹聯集錦","Ping Chen","2018","chi","Book","PrintBook","Di 1 ban",2,"中華書局","Bei Jing","Couplets, Chinese,Dui lian Zuo pin ji Zhong guo Dang dai","","否"
"1240440299","9787101132175,7101132170","叶嘉莹说诗讲稿 : (附音频)","叶嘉莹, author","2018","chi","Book","PrintBook","Di 1 ban",8,"中华书局","Beijing Shi","Chinese poetry History and criticism,Poésie chinoise Histoire et critique,Chinese poetry,Criticism, interpretation, etc","","否"
"1104391676","9787101134483,7101134483","文選李注義疏","高步瀛, 1873-1940, author","2018","chi","Book","PrintBook","Beijing di 2 ban",12,"中華書局","Beijing","Wen xuan,Wen xuan Gu dian wen xue yan jiu,Chinese literature To 221 B.C. History and criticism,Chinese literature Qin and Han dynasties, 221 B.C.-220 A.D. History and criticism,Chinese literature 220-589 History and criticism,Littérature chinoise Jusqu'à 221 av. J.-C. Histoire et critique,Littérature chinoise 221 av. J.-C.-220 (Dynasties des Qin et des Han) Histoire et critique,Littérature chinoise 220-589 Histoire et critique,Chinese literature,Chinese literature Qin and Han dynasties,Criticism, interpretation, etc,To 589","","否"
"1055556608","9787101128680,7101128688","宋词三百首","夏承焘","2018","chi","Book","PrintBook","Beijing di 1 ban",2,"中華書局","Beijing Shi","Ci (Chinese poetry) History and criticism,Chinese poetry Song dynasty, 960-1279 History and criticism,Ci (Poésie chinoise) Histoire et critique,Poésie chinoise 960-1279 (Dynastie des Song) Histoire et critique,Chinese poetry,Ci (Chinese poetry),Song Dynasty (China),Criticism, interpretation, etc,960-1279","","否"
"1139321097","9787101127782,7101127789","晚晴簃詩匯","徐世昌","2018","chi","Book","PrintBook","Di 2 ban",17,"中華書局","Beijing","Chinese poetry Qing dynasty, 1644-1912,Poésie chinoise 1644-1912 (Dynastie des Qing),Chinese poetry,Qing Dynasty (China),1644-1912","","否"
"1090300664","9787101131123,7101131123","春秋繁露義證","蘇輿, -1914, author","2018","chi","Book","PrintBook","Beijing di 1 ban",1,"中華書局","Beijing Shi","Dong, Zhongshu, active 2nd century B.C,Confucius,Chun qiu fan lu Xiao kan,Chun qiu (Confucius),Chun qiu fan lu (Dong, Zhongshu),Gu dian zhe xue Zhong guo Xi han shi dai","Ben shu shi wo guo gu ji de zhong yao zu cheng bu fen, zui zao de yi pi zi shu chan sheng zai chun qiu mo dao zhan guo shi qi de bai jia zheng ming zhong. xin bian zhu zi ji cheng suo shou zi shu yu jiu ben zhu zi ji cheng lue tong, shi yi ban yan jiu zhe jing chang yao yue du huo kao cha de shu. ben shu nei rong bao gua : shi xing di san shi liu ; wu xing dui di san shi ba ; wu xing xiang sheng di wu shi ba ; shun ming di qi shi deng","否"
"1340047014","9787101133653,7101133657","楚辞译注","李山.","2018","chi","Book","PrintBook","Di 1 ban",3,"中华书局","Beijing","Chinese poetry To 221 B.C,Chinese poetry Qin and Han dynasties, 221 B.C.-220 A.D,Poésie chinoise Jusqu'à 221 av. J.-C,Poésie chinoise 221 av. J.-C.-220 (Dynasties des Qin et des Han),Chinese poetry,Chinese poetry Qin and Han dynasties,To 220","","否"
"1042277396","9787101129694,7101129692","康震讲苏东坡","康震, author","2018","chi","Book","PrintBook","Di 1 ban",2,"中华书局","Beijing","Su, Shi, 1037-1101,Authors, Chinese Biography,Écrivains chinois Biographies,Authors, Chinese,Biography,Biographies","","否"
"1178842541","9787101136234,7101136230","花花草草 : 周瘦鹃自编小品文集","周瘦鹃 (1894-1968)","2018","chi","Book","PrintBook","Di 1 ban",12,"中华书局","Beijing","Xiao pin wen Zuo pin ji Zhong guo Dangdai","","否"
"1097890233","9787101007329,7101007325","唐诗三百首详析","喻守真 (1897-1949)","2005","chi","Book","PrintBook","Di 2 ban",89,"中华书局","Beijing","Tang shi Jian shang","本书收录了唐代著名诗歌近三百首,每首诗都提供了作者简介,注释,作意,作法和声调读法","否"
"1374188824","","紀聞輯校","牛肅, author","2018","chi","Book","Digital","Di 1 ban",1,"中華書局","Beijing Shi","Niu, Su,Niu, Su Criticism and interpretation,Criticism, interpretation, etc","","否"
"1375974275","","古今谭概","馮夢龍, 1574-1646, $eauthor","2018","chi","Book","Digital","Beijing di 2 ban, xiu ding ben",13,"中华书局","Beijing","","","否"
"1090288055","9787101131123,7101131123","孟子正義","焦循, 1763-1820, author","2018","chi","Book","PrintBook","Beijing di 1 ban",5,"中華書局","Beijing Shi","Mencius,Mengzi (Mencius)","","否"
"1090301323","9787101131123,7101131123","白虎通疏證","陳立, 1809-1869, author","2018","chi","Book","PrintBook","Beijing di 1 ban",1,"中華書局","Beijing Shi","Ban, Gu, 32-92,Bai hu tong (Ban, Gu),Chinese classics History and criticism,Classiques (Littérature chinoise) Histoire et critique,Chinese classics,Criticism, interpretation, etc","","否"
"1045433419","9789888512294,9888512293","孟子譯注","楊伯峻, 1909-1992, annotator","2018","chi","Book","PrintBook","Di 1 ban. Chong xiao ben",56,"中華書局","Xianggang","Mencius,Mengzi (Mencius),Philosophy, Confucian,Philosophy, Chinese To 221 B.C,Philosophie confucéenne,Philosophie chinoise Jusqu'à 221 av. J.-C,Philosophy, Chinese,To 221 B.C","","否"
"1090396462","9787101131123,7101131123","呂氏春秋集釋","許維遹, author","2018","chi","Book","PrintBook","Beijing di 1 ban",1,"中華書局","Beijing Shi","Lü shi chun qiu","","否"
"1112254148","9789578595415,9578595417","稼軒詞編年箋註","臺灣中華書局","2018","chi","Book","PrintBook","Tai qi ban",1,"中華書局","Taibei Shi","Xin, Qiji, 1140-1207 Criticism and interpretation,Xin, Qiji, 1140-1207,Ci (Chinese poetry),Ci (Poésie chinoise),Criticism, interpretation, etc","","否"
"1065520891","9787101125658,7101125654","全本周易精读本","寇方墀, author","2018","chi","Book","PrintBook","Beijing di 1 ban",2,"中華書局","Beijing Shi","Yi jing,Divination China,Divination Chine,Divination,China","","否"
"1266005363","9787101132632,7101132634","沉思录","(古罗马) 奥勒留, 马可.","2018","chi","Book","PrintBook","Di 1 ban",41,"中华书局","Beijing","Si duo ge pai Zhe xue li lun","","否"
"1141069615","9787101134575,7101134572","錢遵王詩集校箋","錢曾 1629-1701 Verfasser","2018","chi","Book","PrintBook","Bei jing di 1 ban",1,"中華書局","Bei jing Shi","","","否"
"1090286850","9787101131123,7101131123","論語集釋","程樹德, 1877-1944, author","2018","chi","Book","PrintBook","Beijing di 1 ban",1,"中華書局","Beijing Shi","Confucius,Lun yu (Confucius)","","否"
"1102427807","","《文選》與漢唐文化 : 第十一届《文選》學國際學術研討會論文集","劉志偉","2018","chi","Book","Digital",,1,"中华书局","Beijing","Wen xuan Congresses,Wen xuan,Conference papers and proceedings","","否"
"1057268953","9787101127584,7101127584","宋文鑑","呂祖謙","2018","chi","Book","PrintBook","Beijing di 2 ban",7,"中華書局","Beijing","Chinese literature Song dynasty, 960-1279,Littérature chinoise 960-1279 (Dynastie des Song),Chinese literature,Song Dynasty (China),China History Song dynasty, 960-1279 Sources,Chine Histoire 960-1279 (Dynastie des Song) Sources,China,History,Sources,960-1279","","否"
"1252064799","9789578595309,9578595301,9789578595309,9578595301","希臘羅馬名人傳","Plutarch","2018","chi","Book","PrintBook","7 ban",10,"國立編譯舘 ; 中華書局","Taibei","Plutarch Translations into Chinese,Plutarch,Greece Biography,Rome Biography,Grèce Biographies,Rome Biographies,Greece,Rome (Empire),collective biographies,Biographies,Translations","","否"
"oclc编号 - oclcNumber","书号 - isbns","书名 - title","作者 - creator","出版日期 - publicationDate","语言 - catalogingLanguage","格式 - generalFormat","详细格式 - specificFormat","版本 - edition","总版本数 - totalEditions","出版社 - publisher","出版地 - publicationPlace","主题 - subjects","简介 - summaries","是否同行审阅 - peerReviewed"
"1301392043","9787508540283,750854028X","Peach blooms painted with blood","孔尚任, 1648-1718, author","2019","eng","Book","Digital","Di 2 ban",2,"五洲传播出版社 : 中華書局","Beijing","Chinese drama Qing dynasty, 1644-1912,Théâtre chinois 1644-1912 (Dynastie des Qing),Chinese drama,Qing Dynasty (China),1644-1912","Ancient Chinese classic poems are exquisite works of art. As far as 2,000 years ago, Chinese poets composed the beautiful work Book of Poetry and Elegies of the South, Later, they created more splendid Tang poetry and Song lyrics. Such classic works as Thus Spoke the Master and Laws: Divine and Human were extremely significant in building and shaping the culture of the Chinese nation. These works are both a cultural bond linking the thoughts and affections of Chinese people and an important bridge for Chinese culture and the world. Mr. Xu Yuanchong has been engaged in translation for 70 years. In December 2010, he won the Lifetime Achievement Award in Translation conferred by the Translators Association of China (TAC). He is honored as the only expert who translates Chinese poems into both English and French. After his excellent interpretation, many Chinese classic poems have been further refined into perfect English and French rhymes. This collection of Classical Chinese Poetry and Prose gathers his most representative English translations. It includes the classic works Thus Spoke the Master, Laws: Divine and Human and dramas such as Romance of the Western Bower, Dream in Peony Pavilion, Love in Long-life Hall and Peach Blossom Painted with Blood. The largest part of the collection includes the translation of selected poems from different dynasties. The selection includes various types of poems, lyrics and Yuan, Ming and Qing dynasty songs. The selected works start from the pre-Qin era to the Qing Dynasty, covering almost the entire history of classic poems in China. Reading these works is like tasting ""living water from the source"" of Chinese culture. We hope this collection will help English readers ""know, love and appreciate"" Chinese classic poems, share the intelligence of Confucius and Lao Tzu, share the gracefulness of Tang Dynasty poems, Song lyrics and classic operas and songs and promote exchanges between Eastern and Western culture. This book is one of the 14 books of Classical Chinese Poetry and Prose, a translation of Confucian classics Thus Spoke the Master. 许渊冲--诗译英法唯一人 ，北京大学教授，翻译家。希望这套许氏译本能使英语读者对中国经典诗文也能""知之，好之，乐之""，能够分享孔子、老子的智慧，分享唐诗、宋词、中国古典戏曲的优美，并以此促进东西文化的交流。值得珍藏。许渊冲先生从事翻译工作70年，2010年12月荣获""中国翻译文化终身成就奖""。他被称为将中国诗词译成英法韵文的唯一专家，经他的妙手，许多中国经典诗文被译成出色的英文和法文韵语。这套""中国经典诗文集""就是由他所译，前半部分是英文，后半部分是中文。","否"
"1146544338","9787508540290,7508540298","Love in long-life hall","洪昇, 1645-1704, author","2019","eng","Book","PrintBook","Di 2 ban",2,"五洲传播出版社 : 中華書局","Beijing","","","否"
"1126337443","9787101140415,7101140416","清代戲曲中的明史再現","華瑋, author","2019","chi","Book","PrintBook","Beijing di 1 ban",2,"中華書局","Beijing Shi","Chinese drama Qing dynasty, 1644-1912 History and criticism,Théâtre chinois 1644-1912 (Dynastie des Qing) Histoire et critique,Gu dai xi qu Yan jiu Zhong guo Qing dai,Chinese drama,Qing Dynasty (China),China History Ming dynasty, 1368-1644,Chine Histoire 1368-1644 (Dynastie des Ming),China,Criticism, interpretation, etc,History,1368-1912","有清一代, 文人编撰历史剧蔚然成风, 其中关于明史的古典戏曲现存170种左右.本书即以此为研究范围, 旨在探析, 呈现清代戏曲如何展演明代历史事件和人物, 涉及美学, 表演, 记忆, 社会变迁和政治等方面.全书分为上下编, 上编为专题论文, 收录作者近年发表之相关论文六篇, 下编为涉及明代历史事件人物之今存清代戏曲剧目提要","否"
"1246574399","","杜甫诗今译","杜甫, author","2019","chi","Book","Digital","Beijing di 1 ban",7,"中华书局","Beijing","","本书精选杜甫诗歌中的经典作品112首,每一首均由四个板块组成:1.相关背景、典故的简要介绍.2.诗歌原文.3.晓畅易懂的白话翻译,与原文逐句对应,极便理解.4.重点字词注释.同时,书前有专家撰写之长篇导读,综合介绍杜甫的生平和成就,使读者得到宏观而全面的了解.书后附杜甫年谱简编,便于查找.全书深入浅出,雅俗共赏,是学习、欣赏杜甫诗歌上好的入门著作","否"
"1126341353","9787101139471,7101139477","諦聽雜音 : 報紙副刊與香港文學生產, (1930-1960年代)","樊善標, author","2019","chi","Book","PrintBook","Beijing di 1 ban",4,"中華書局","Beijing Shi","Chinese literature China Hong Kong History and criticism,Chinese literature 20th century History and criticism,Chinese newspapers China Hong Kong,Littérature chinoise Chine Hongkong Histoire et critique,Littérature chinoise 20e siècle Histoire et critique,Journaux chinois Chine Hongkong,Chinese literature,Chinese newspapers,China Hong Kong,Criticism, interpretation, etc,1900-1999","本书共分三辑.第一辑:1930年代'南来文人'的角色和贡献;第二辑:1940,1950年代之交'青年文化教养'的成效;第三辑:1950,1960年代'香港的自我论述'.作者从报纸副刊入手, 从以上三个阶段详细探讨了香港文学的生产, 发展以及个性, 涉及'大公报·文艺', '立报·言林', '星岛日报', '新生晚报·新趣'等不同时期具有代表性的报纸副刊以及众多的香港作家","否"
"1109226634","9787101136937,7101136931","吕本中全集","吕本中, jin shi 1136, author","2019","chi","Book","PrintBook","Beijing di 1 ban",2,"中华书局","Beijing Shi","Lü, Benzhong, jin shi 1136,Za zhu Zhong guo Song dai","""吕本中全集"",吕本中撰,韩酉山辑校.吕本中是两宋之交的著名道学家,诗人和诗论家,在思想史,文化史和诗歌史上具有重要的地位.南宋学者称其""亲受中原文献之传"",是两宋之交思想文化的重要传承者.然迄无全集整理问世,不少著作淹没不存,单行于世者亦往往误为他人著作.此次整理吕本中全集,举凡吕氏之著作,细大不捐,尽皆收录.含""吕本中诗集"",""吕本中佚文集"",""师友杂志"",""童蒙训"",""官箴"",""紫微杂说"",""紫微诗话"",""轩渠录"",""紫微杂记"",""痛定录"",""春秋集解"",""吕氏大学解""等凡十二种","否"
"1112360585","9787101139204,7101139205","《四书章句集注》引文考证","申淑华, author","2019","chi","Book","PrintBook","Beijing di 1 ban",3,"中华书局","Beijing Shi","Zhu, Xi, 1130-1200,Si shu,Si shu ji zhu (Zhu, Xi)","""四书章句集注""(以下简称""集注"")是理学家朱熹的代表作.朱熹用了四十多年时间给""四书""做注释,对以往学者的注释进行了深入研究,并在""集注""中大量征引.不过对于所引征者,朱子多称'某氏','某子',只有少数人物称字,名,封号,职位等等,这给阅读,理解和研究带来了极大的不便.本书按照引文先后顺序,以(引文),(原文),(出处)的格式,对朱熹""集注""引文进行了上溯原文的系统考证,对于研读""集注""本身以","否"
"1125025162","9787101140422,7101140424","中國早期小說生成史論","陈洪, 1959- author","2019","chi","Book","PrintBook","Beijing di 1 ban",3,"中华书局","Beijing Shi","Chinese fiction History and criticism,Roman chinois Histoire et critique,Chinese fiction,Criticism, interpretation, etc","早期小说, 学术界通常用来指唐代以前的文言小说. 作者以出土和传世文献为据, 从生成史视角, 考论中国早期小说的创作主体, 文体特点, 存在形态, 历史文化背景等若干问题, 提出一系列较有说服力的观点, 如汉代以前的子书, 巫史之中即有小说, 其基本形态是""譬喻故事+议论"", 故事只是小说生成的母体, 议论才是小说的核心追求等. 这些研究和观点, 是早期小说史研究领域的重要成果, 值得学界充分关注","否"
