"oclc编号 - oclcNumber","书号 - isbns","书名 - title","作者 - creator","出版日期 - publicationDate","语言 - catalogingLanguage","格式 - generalFormat","详细格式 - specificFormat","版本 - edition","总版本数 - totalEditions","出版社 - publisher","出版地 - publicationPlace","主题 - subjects","简介 - summaries","是否同行审阅 - peerReviewed"
"1111718360","9789888366453,9888366459","出入文史天地間 : 胡詠超老師講義選輯","胡詠超, 1933-2005, author","2019","chi","Book","PrintBook","Chu ban",2,"中華書局 (香港) 有限公司","Xianggang","Chinese literature History and criticism,Chinese language,Littérature chinoise Histoire et critique,Chinois (Langue),Chinese literature,China History,Chine Histoire,China,Criticism, interpretation, etc,History","","否"
"1119697896","9789888572984,9888572989","怎樣讀經典","王寧, 1936- author","2019","chi","Book","PrintBook","Chu ban",6,"中華書局","Xianggang","Chinese classics History and criticism,Classiques (Littérature chinoise) Histoire et critique,Chinese classics,Criticism, interpretation, etc","","否"
"1272074065","","滄洲夢 風雨晴","鄺龑子, author","2019","chi","Book","Digital","Chu ban",2,"中華書局(香港)有限公司","Xianggang","Chinese poetry 21st century,Poésie chinoise 21e siècle,Chinese poetry,2000-2099","","否"
"1141048909","7101137237,9787101137231","邇言等五種","錢大昭","2019","chi","Book","PrintBook","Beijing di 1 ban",6,"中華書局","Beijing","Chinese language Terms and phrases,Chinese language Etymology,Chinois (Langue) Étymologie,Han yu Gu ci yu,Chinese language,Dictionaries","","否"
"1178825850","9787101138283,7101138284","文坛佛影","孙昌武.","2019","chi","Book","PrintBook","Di 1 ban",5,"中华书局","Beijing","Fo jiao Guan xi Zhong guo wen xue Gu dian wen xue Wen ji","Ben shu nei rong bao kuo:fo dian fan yi wen xue,Dong jin ming shi yu ming seng,Guan yin xin yang yu guan yin chuan shuo,Di yu xun you yu mu lian jiu mu,""xing xiang""yu""guan nian"",Lu shan hui yuan yu""lian she""chuan shuo,""xi di xue shi""yu""jing bei xin sheng"",Shan wen xian yu shan wen xue,""jiang zuo shi seng""he zhong tang shi tan,""yi zi shi""yu""ju zhong yan""","否"
"1134993615","9787101136821,7101136826","迦陵讲赋","Chia-ying Yeh","2019","chi","Book","PrintBook","Beijing di 1 ban",3,"中華書局","Beijing Shi","Fu History and criticism,Chinese poetry History and criticism,Fu Histoire et critique,Poésie chinoise Histoire et critique,Fu,Chinese poetry,Criticism, interpretation, etc","","否"
"1114893377","9787101138900,710113890X","道教与唐代文学","孙昌武, author","2019","chi","Book","PrintBook","Beijing di 1 ban",1,"中华书局","Beijing","Chinese literature Tang dynasty, 618-907 History and criticism,Chinese literature Taoist influences,Taoism in literature,Littérature chinoise 618-907 (Dynastie des Tang) Histoire et critique,Littérature chinoise Influence taoïste,Taoïsme dans la littérature,Dao jiao Ying xiang Zhong guo wen xue Gu dian wen xue yan jiu Tang dai,Chinese literature,Tang Dynasty (China),Criticism, interpretation, etc,618-907","","否"
"1131908079","9789888573264,9888573268","日日植物日 = Plant day everyday","畢培曦, author","2019","chi","Book","PrintBook","Chu ban",3,"中華書局","Xianggang","Plants in literature,Plantes dans la littérature,essays,Essays,Essais","","否"
"1141890878","9789888573172,9888573179","我問人, 人問我 = I ask u : u ask I","甘國亮, author","2019","chi","Book","PrintBook","Chu ban",2,"中華書局(香港)有限公司","Xianggang","Actors China Hong Kong Anecdotes,Actresses China Hong Kong Anecdotes,Entertainers China Hong Kong Anecdotes,Acteurs Chine Hongkong Anecdotes,Actrices Chine Hongkong Anecdotes,Artistes du spectacle Chine Hongkong Anecdotes,Actors,Actresses,Entertainers,China Hong Kong,Anecdotes","","否"
"1090477992","9787101136234,7101136230","花花草草 : 周瘦鹃自编小品文集","周瘦鹃, author","2019","chi","Book","PrintBook","Di 1 ban",12,"中华书局","Beijing Shi","Xiao pin wen Zuo pin ji Zhong guo Dang dai","","否"
"1112283758","9789888572885,9888572881,9789888572892,988857289X","國粹札記 : 當代大家讀國史讀人世","王充閭, 1935- author","2019","chi","Book","PrintBook","Chu ban",4,"中華書局","Xianggang","Philosophy, Chinese,Philosophie chinoise,Civilization,Intellectual life,China Civilization,China Intellectual life,Chine Civilisation,Chine Vie intellectuelle,China","","否"
"1109750985","9789888572649,9888572644","聽車廬詩草三集","董就雄, author","2019","chi","Book","PrintBook","Chu ban",4,"中華書局(香港)有限公司","Xianggang","Chinese poetry 21st century,Poésie chinoise 21e siècle,Chinese poetry,poetry,Poetry,Poésie,2000-2099","","否"
"1150885740","9787101135046,7101135048","论语译注","杨伯峻, 1909-1992, author","2019","chi","Book","PrintBook","Di 1 ban",75,"中華書局","Beijing","Confucius,Lun yu Yi wen,Lun yu Zhu shi,Lun yu (Confucius),Ru jia","","否"
"1224904862","9789578595668,9578595662","玉谿生年譜會箋","張爾田, 1874-1945, author","2019","chi","Book","PrintBook","Tai san ban",21,"中華書局","Taibei Shi","Li, Shangyin, 813-858 Chronology,Li, Shangyin, 813-858,Chronology,chronologies (lists),Chronologies","","否"
"1345548195","9789578595651,9578595654","詞曲研究","廬冀野","2019","chi","Book","PrintBook","Tai si ban",32,"中華書局","Taibei Shi","Ci (Chinese poetry) History and criticism,Qu (Chinese literature) History and criticism,Chinese poetry History and criticism,Ci (Poésie chinoise) Histoire et critique,Qu (Littérature chinoise) Histoire et critique,Poésie chinoise Histoire et critique,Chinese poetry,Ci (Chinese poetry),Qu (Chinese literature),Criticism, interpretation, etc","","否"
"1183726709","9789888674398,9888674390","我畫文人故居","羅雪村, author","2019","chi","Book","PrintBook","Chu ban",3,"中華書局(香港)有限公司","Xianggang","Intellectuals Homes and haunts,Authors, Chinese 20th century Biography,Intellectuels Résidences et lieux familiers,Écrivains chinois 20e siècle Biographies,Authors, Chinese,Biographies,1900-1999","","否"
"1111653796","9787101116533,7101116531","陶渊明集译注","孟二冬, author","2019","chi","Book","PrintBook","Beijing di 1 ban",1,"中华书局","Beijing Shi","Tao, Qian, 372?-427 Criticism and interpretation,Tao, Qian, 372?-427,Poetry,Essay,poetry,essays,Criticism, interpretation, etc,Essays,Poésie,Essais","","否"
"1225176390","9787101137446,710113744X","读""诗经""","张炜, 1956 November 7- author","2019","chi","Book","PrintBook","Beijing di 1 ban",2,"中華書局","Beijing Shi","Shi jing","","否"
"1156805278","9787101139662,7101139663","大邦之风 : 李山讲《诗经》","李山 (Professor of Chinese literature), author","2019","chi","Book","PrintBook","Beijing di 1 ban",3,"中華書局","Beijing","Shi jing,Shi jing Shi ge yan jiu","","否"
"1200779428","9787101128581,7101128580","说文解字十二讲","万献初, author","2019","chi","Book","PrintBook","Di 1 ban",1,"中华书局","Beijing","""Shuo wen "",Chinese language Etymology,Chinese characters History,Chinois (Langue) Étymologie,Chinois (Langue) Caractères Histoire,Chinese characters,History","","否"
"1265967707","9787101127560,7101127568","全清詞鈔","葉恭綽","2019","chi","Book","PrintBook","Beijing di 2 ban",3,"中華書局","Beijing","Ci (Chinese poetry),Chinese poetry Qing dynasty, 1644-1912,Ci (Poésie chinoise),Poésie chinoise 1644-1912 (Dynastie des Qing)","","否"
"1285957689","9787101137347,7101137342","诗以言志 : 沈鹏读鲁迅小说二十四首品鉴","沈鹏, 1931- author","2019","chi","Book","PrintBook","Beijing di 1 ban",2,"中华书局","Beijing","Lu, Xun, 1881-1936 Fictional works Criticism and interpretation,Shen, Peng, 1931- Poetic works Criticism and interpretation,Lu, Xun, 1881-1936,Shen, Peng, 1931-,Criticism and interpretation,Criticism, interpretation, etc","","否"
"1127906117","9789578595828,9789578595828,9578595824","新曲苑","任訥","2019","chi","Book","PrintBook","Tai er ban",7,"中華書局","Tai bei shi","Qu ping","","否"
"1265991311","9787101133646,7101133649","经典常谈","朱自清.","2019","chi","Book","PrintBook","Di 1 ban",228,"中华书局","Beijing","She hui ke xue Gu ji Jie shao Zhong guo","","否"
"1374188546","","尹洙集编年校注 = The collation, annotation and chronology of Yin Zhu's works","时国强.","2019","chi","Book","Digital","Beijing di 1 ban",1,"中華書局","Beijing Shi","Yin, Zhu, 1001-1046 Criticism and interpretation,Criticism, interpretation, etc","","否"
"1374188741","","蘇轍詩編年箋注 = The collation, annotation and chronology of Su Zhe's poems","蔣宗許, 1949- author","2019","chi","Book","Digital","Di 1 ban",1,"中華書局","Beijing Shi","Su, Zhe, 1039-1112 Criticism and interpretation,Su, Zhe, 1039-1112,Chinese poetry Song dynasty, 960-1279 History and criticism,Poésie chinoise 960-1279 (Dynastie des Song) Histoire et critique,Chinese poetry,Song Dynasty (China),Criticism, interpretation, etc,960-1279","","否"
"1375974277","","廣雅疏證","王念孫, 1744-1832, author","2019","chi","Book","Digital","Di 1 ban",4,"中华书局","Beijing","Zhang, Yi, active 5th century,Guang ya (Zhang, Yi),Chinese language Lexicography,Chinois (Langue) Lexicographie","","否"
"1374188749","","周易集注","來知德, 1525-1604, author","2019","chi","Book","Digital","Beijing di 1 ban",3,"中華書局","Beijing Shi","Yi jing","","否"
"1266120563","9787101138078,7101138071","唐诗三百首","蘅塘退士.","2019","chi","Book","PrintBook","Di 1 ban",553,"中华书局","Beijing","Tang shi Shi ji","","否"
"1144166735","9789888573677,9888573675,9789888573677","說文解字 : 附檢字","許慎","2019[民108]","chi","Book","PrintBook","再版",17,"中華書局出版 : 香港聯合書刊物流公司發行","香港","說文解字","","否"
"1319082306","9787101141795,710114179X","天夫诗联赋","张天夫, author","2019","chi","Book","PrintBook","Di 1 ban",1,"中华书局","Beijing","Chinese literature,Littérature chinoise","","否"
"1129942340","","柳宗元传论","孙昌武, author","2019","chi","Book","Digital","Beijing di 1 ban",,"中华书局","Beijing","Liu, Zongyuan, 773-819,Authors, Chinese Biography,Écrivains chinois Biographies,Authors, Chinese,Biography,Biographies","柳宗元是唐代著名的文学家, 思想家, 是代表有唐一代思想学术成就的杰出人物之一.本书在简单介绍柳宗元所处的时代背景的基础上, 以年代为序, 详细论述了他一生坎坷的仕宦游历轨迹, 主要思想主张及其在文学上的创作和贡献","否"
"oclc编号 - oclcNumber","书号 - isbns","书名 - title","作者 - creator","出版日期 - publicationDate","语言 - catalogingLanguage","格式 - generalFormat","详细格式 - specificFormat","版本 - edition","总版本数 - totalEditions","出版社 - publisher","出版地 - publicationPlace","主题 - subjects","简介 - summaries","是否同行审阅 - peerReviewed"
"1380934722","9787508542065,7508542061","300 Yuan songs / 元曲三百首 / 许渊冲译","许渊冲","2020","eng","Book","PrintBook","2 ban",1,"五洲传播出版社 : 中華書局","Beijing","Qu (Chinese literature) Yuan dynasty, 1260-1368 Translations into English,Chinese poetry Yuan dynasty, 1260-1368 Translations into English","","否"
"1380936509","9787508542072,750854207X","Selected lyrics of Tang and five dynasties / 唐五代词选 / 许渊冲译","许渊冲","2020","eng","Book","PrintBook","Di 2 ban",2,"五洲传播出版社 : 中華書局","Beijing","Ci (Chinese poetry) Tang-Five dynasty, 618-907 Translations into English,Ci (Chinese poetry) Five dynasties and the Ten kingdoms, 907-979 Translations into English,Chinese poetry Tang dynasty, 618-907 Translations into English,Chinese poetry Five dynasties and the Ten kingdoms, 907-979 Translations into English","","否"
"1151886022","9787101143072,7101143075","槐聚心史 : 钱锺书的自我及其微世界","汪荣祖, 1940- author","2020","chi","Book","PrintBook","Beijing di 1 ban",4,"中华书局","Beijing Shi","Qian, Zhongshu, 1910-1998 Criticism and interpretation,Qian, Zhongshu, 1910-1998,Criticism, interpretation, etc","本书结合钱锺书的生平, 著作, 以及作者与其多年交往论学的过程, 尝试解读钱锺书的生活世界和学术世界. 全书分为内外两篇: 内篇论述""钱锺书的自我"", 参考心理学理论, 阐释钱氏之自我意识, 自我认同, 自我剖析, 忧患意识, 以及内心的价值观; 外篇从哲学, 文学, 诗学, 史学分论""钱氏学术境界"", 或称之为""微世界"". 作者以史家笔法, 探究钱氏其人其学, 深度与立体地揭示了一代学人钱锺书的精神世界与学术思想","否"
"1228646960","","周策纵论学书信集","周策纵, 1916-2007, author","2020","chi","Book","Digital","Beijing di 1 ban",3,"中华书局","Beijing Shi","Zhou, Cezong, 1916-2007,周策纵, 1916-2007 Correspondence,Chinese classics History and criticism,Chinese literature History and criticism,Classiques (Littérature chinoise) Histoire et critique,Littérature chinoise Histoire et critique,Chinese classics,Chinese literature,Criticism, interpretation, etc,Personal correspondence","本书收录国际著名汉学家周策纵与150余位学者、作家、画家、书法家等学术文化界人士或文化单位的通信342封,时间横跨半个多世纪,总计50余万字,所论多为学术上的热点问题,兼及名人往来事迹.由于周策纵在学术界颇有地位和声望,故这些论学书信对了解周策纵及相关学界和文化界具有较高价值,对于推进相关人物和学术史的研究也颇有助益","否"
"1244621395","","王安石","石继航, author","2020","chi","Book","Digital","Di 1 ban",2,"中华书局","Beijing","Wang, Anshi, 1021-1086,Statesmen China Biography,Hommes d'État Chine Biographies,Statesmen,China,Biography,Biographies","王安石""不畏天变, 不法祖先, 不恤人言"", 主导了宋代的熙宁变法. 王安石名列""唐宋八大家"", 在文学上成就很高, 留下许多散文, 诗歌名作. 本书选取王安石在鄞县, 舒州等地实践政治构想, 主导熙宁变法, 两次入阁, 两度罢相, 归隐钟山等经历, 为读者展示了王安石文学上的成就和忧国忧民, 变革创新的精神品格","否"
"1178252001","9787101145618,7101145612","孤本说唱词话《云门传》研究","吴真, author","2020","chi","Book","PrintBook","Beijing di 1 ban",2,"中華書局","Beijing Shi","Yun men zhuan,Chinese drama Ming dynasty, 1368-1644 History and criticism,Chinese literature Ming dynasty, 1368-1644 History and criticism,Théâtre chinois 1368-1644 (Dynastie des Ming) Histoire et critique,Littérature chinoise 1368-1644 (Dynastie des Ming) Histoire et critique,Chinese drama Ming dynasty,Chinese literature Ming dynasty,Criticism, interpretation, etc,1368-1644","『孤本《云门传》是明代民间白话说唱的实物刊本，讲述的是隋代青州染坊商人李清缒入云门山洞穴求道最终拒皇诏而尸解成仙的故事。该故事取材于《太平广记·李清》，《云门传》说白文字又几为《醒世恒言》照录，显示了说唱文学在文言小说向白话小说转变演进过程中发挥的关键作用。《云门传》上承元明词话，下开清代鼓词，连接起俗文学史的若干个断链处，为我们研究词话、道情、弹词、鼓词的承接和转变提供了新的文本依据.』","否"
"1197554327","9787101145700,7101145701","柳宗元儒佛道三教观新论","张勇, 1970- author","2020","chi","Book","PrintBook","Beijing di 1 ban",4,"中华书局","Beijing","Liu, Zongyuan, 773-819 Philosophy,Liu, Zongyuan, 773-819,Philosophy, Confucian,Buddhism,Taoism,Philosophie confucéenne,Bouddhisme,Taoïsme,Philosophy","本书是安徽师范大学诗学研究中心""中国诗学研究专刊""之一种, 以柳宗元眼中的儒, 佛, 道及其关系为对象, 分析柳宗元对儒家之""道""与""统""内涵的独特理解, 对禅宗, 天台宗, 净土宗, 律宗等佛教宗派的理解与评价, 对道家, 道教的批评, 改造与吸收, 揭示柳宗元的三教融合观及其在三教关系张力下宇宙论与心性论的独特内容, 重估柳宗元在中国佛教史, 三教关系史, 及中国哲学史上的独特地位, 并通过这一窗口, 透析中唐思想文化的转型及宋学的源头情况.基本观点上, 本书认为:柳宗元是唐代三教融合思潮中的儒家代表, 他与佛教的宗密, 道教的杜光庭并列为三, 分别代表了各自立场之上三教融合的方向.文献资料上, 本书从佛教""大藏经""中发掘大量有关柳宗元的资料, 这些资料是以往""柳学""界很少使用的.组织架构上, 本书以问题为中心, 每章节都有明确的问题指向, 都在解决具体问题, 各章节内容, 分读之皆可独立成篇, 合读之则环环相扣, 浑然一体","否"
"1233265162","9787101141344,710114134X","重訪中國現代文學 : 細讀·數據·接受","何杏楓, author","2020","chi","Book","PrintBook","Beijing di 1 ban",3,"中華書局","Beijing Shi","Chinese literature 20th century History and criticism,Chinese literature China Hong Kong History and criticism,Littérature chinoise 20e siècle Histoire et critique,Littérature chinoise Chine Hongkong Histoire et critique,Chinese literature,China Hong Kong,Criticism, interpretation, etc,1900-1999","『本稿將碑誌文批評置於中國古代文學批評的歷史長河中，對其產生、發展、演進的歷程進行深入剖析，力求客觀、公允地梳理出一部碑誌文批評發展的歷史. 在研究過程中，不僅注重既有的理論批評資料，還深入、細緻地從作家創作本身挖掘其文體主張與理論；不僅注重那些知名的學者，還發現了以往不被批評史研究關注的學者，如孫琮、儲欣、林雲銘等，以及一些以曲論、詩論、詞論等名世的學者，如李開先、沈德潛、譚獻等，發掘他們獨到的文章觀念. 因此，本稿不僅補充了中國碑誌文批評史研究的空白，還對中國古代文學批評、中國古代文化研究有重要的補充作用.』","否"
"1202460776","9787101143966,7101143962","格言联璧","马天祥.","2020","chi","Book","Digital","Beijing di 1 ban",69,"中華書局","Beijing","Jin, Lansheng, active 19th century,Quotations, Chinese,Citations chinoises","《格言联璧》是清代金缨编纂的一部格言集成. 共分为学问, 存养, 持躬, 摄生, 敦品, 处事, 接物, 齐家, 从政, 惠言, 悖凶十一类, 内容广博, 语言精练, 意蕴深厚, 涵盖了社会人生的各方面和传统中国社会各个时代的思想精髓. 《格言联璧》的篇章编排也体现着一定的内在逻辑和顺序. 大体上遵循着宋代以来君子""格物""""致知""""诚意""""正心""""修身""""齐家""""治国""""平天下""的思想脉络. 每类的首要思想都是告诫人们要立德为先, 修身为要, 也就是说无论做什么事, 先要做一个堂堂正正的人. 而这种立德修身又不是靠空谈得来的, 是在现实生活中通过不断约束改进自己来实现的. 《格言联璧》虽然成书于清朝中晚期, 但因书中的许多格言侧重生活实际, 所以今天读起来仍不失实用意义. ""摄生类""中的格言都有着中医理论依据, 对当下人的身体保养仍大有裨益. ""敦品类""""处事类""""接物类""等章在为人处世方面的指导和告诫, 对现在人们的交往仍有着一定的指导意义","否"
"1256977414","","范文澜《文心雕龙注》研究","李平, 1962 February- author","2020","chi","Book","Digital","Di 1 ban",2,"中华书局","Beijing","Fan, Wenlan, 1891-1969,Chinese literature History and criticism Theory, etc,Littérature chinoise Histoire et critique Théorie, etc,Criticism, interpretation, etc","","否"
"1246574907","","王昌龄诗集","李云逸, author","2020","chi","Book","Digital","Beijing di 1 ban",1,"中华书局","Beijing Shi","","中华经典指掌文库本《王昌龄诗集》,是在老辈学人李云逸《王昌龄诗注》的基础上修订而成的。王昌龄是盛唐著名诗人,在边塞、闺怨、送别等类型的题材方面,多有名篇佳句,七绝的创作成就尤为突出,被誉为""七绝圣手""。全书分为四卷,收录王昌龄存世近180首完整诗篇及若干残句,书稿以《全唐诗》所收王昌龄诗为底本,又利用存世其他版本的王昌龄诗集对诗篇原文做了精细的校勘、甄别、辑补,并对诗篇涉及的字词典故做了精准的注释,并搜罗前人品评王昌龄诗的评笺近百条,分别附在诗末,堪称一个""小而全""且""小而美""的《王昌龄诗集》校注本。","否"
"1202468189","","陶庵梦忆","苗怀明, author","2020","chi","Book","Digital","Beijing di 1 ban",1,"中华书局","Beijing Shi","Zhang, Dai, 1597-1679,Chinese essays Ming dynasty, 1368-1644,Essais chinois 1368-1644 (Dynastie des Ming),Chinese essays Ming dynasty,Manners and customs,China Social life and customs 960-1644,Chine Mœurs et coutumes 960-1644,China,960-1644","汉学家史景迁说:""明朝灭亡时, 张岱四十八岁, 尔后他得去面对一个残酷的事实:让他活得多姿多彩的辉煌明朝, 被各种竞逐的残暴, 野心, 绝望, 贪婪力量所撕裂, 土崩瓦解, 蒙羞以终. 他反复追思回想, 事情愈是清晰, 如迷雾笼罩的路径, 于眼前重现, 诸多遗忘的嘈嘈低语, 也咆哮起来 ... ""嘈嘈低语, 是张岱娓娓展开的叙事方式;咆哮, 是文字背后痛定思痛后的心情. ""繁华靡丽, 过眼皆空"", 作者在《陶庵梦忆》的自序里, 一句苍凉的低吟奠定了全书的基调. 但是八卷本的《陶庵梦忆》作者写到的则都是自己往昔快乐的经历, 品茗, 赏花, 观剧, 访古, 宴饮, 雅集 ... 奢华而不失优雅的场景, 将种种世相展现在人们面前, 往事并不如烟, 张岱在娓娓的叙述中, 寄托了自己的家园之悲, 故国之痛","否"
"1235852096","9787101148848,7101148840","賈島集校注","齊文榜, writer of added commentary","2020","chi","Book","PrintBook","Di 1 ban",,"中华书局","Beijing","Jia, Dao, 779-843,","""贾岛集校注""十卷,唐贾岛撰,齐文榜校注.贾岛(779-843),晚唐苦吟诗人的代表,也是著名""推敲""典故的主人公,名句有""秋风吹渭水,落叶满长安"",""只在此山中,云深不知处""等.诗歌内容写科考碰壁的失意和怨愤,贫苦窘困生活的哀叹,清寂之境和佛禅境界的感受等,吟咏日常感受以及与亲友唱和.风格清新奇僻,峭直刻深,""沧浪诗话""称之为""贾浪仙体"".贾岛存诗约400首,因贾岛曾官长江主簿,故其集多称""长江集"",宋明清三代刊刻传抄较多,版本众多,而以安愚道人抄,毛晋父子所藏本最善.齐文榜先生""贾岛集校注""即以毛抄本为底本,在文字校勘,文句校注方面较为精审,又广辑诸家评论,后附""贾岛年谱""","否"
"1180292845","9787101145359,7101145353","吴梅村詩集箋注","楊學沆, active 18th century, author","2020","chi","Book","PrintBook","Beijing di 1 ban",2,"中華書局","Beijing Shi","Wu, Weiye, 1609-1672 Criticism and interpretation,Wu, Weiye, 1609-1672,Chinese poetry Qing dynasty, 1644-1912 History and criticism,Poésie chinoise 1644-1912 (Dynastie des Qing) Histoire et critique,Chinese poetry,Qing Dynasty (China),Criticism, interpretation, etc,1644-1912","吴伟业,字骏公,晚号梅村,江苏太仓人,明末清初著名诗人,""江左三大家""之一.所撰""梅村集""著录于""四库全书"",为清人别集之冠.他的诗早年才华艳发,清丽芊眠;晚年遭逢丧乱,激越苍凉.不少作品脍炙人口,在文学史上有着很高的地位.惟吴氏生逢易代,其诗多吟咏时事,又喜用典,若无笺注,很难获解,故自""梅村集""梓行后,即陆续有人为之笺注,其中清程穆衡笺,杨学沆补注的版本被公认为最佳.本次整理,即以清保蕴楼抄程笺杨补本为底本,以黄丕烈士礼居抄本为校本,诗歌部分并校以""梅村家藏稿"",标点排印,以飨读者","否"
"1164724431","9787101143706,7101143709","中国古典学. 第一卷","杜晓勤","2020","chi","Book","PrintBook","Beijing di 1 ban",1,"中华书局","Beijing","Chinese literature History and criticism,Philosophy China History and criticism,Chinese classics History and criticism,Littérature chinoise Histoire et critique,Philosophie Chine Histoire et critique,Classiques (Littérature chinoise) Histoire et critique,Chinese classics,Chinese literature,Philosophy,China,Criticism, interpretation, etc","""中国古典学""强调由古典语文切入,以文本考察为核心,其研究内容包括三个方面:一是中国古典语文学,对中国古代人文经典著作中的文字,音韵,训诂,语法,格律等各方面展开基础训练和系统研究;二是中国古典文献学,包括对中国古代人文经典著作进行版本,目录,校勘,辨伪等方面的研究;三是中国古典文献研究,主要是对古典文学经典作品进行艺术分析与思想阐释.""中国古典学""即着眼于以上三方面,旨在弘扬古典人文精神,推动中国古典学的发展.本书为""中国古典学""第一卷,主题为""观念与方法""","否"
