"oclc编号 - oclcNumber","书号 - isbns","书名 - title","作者 - creator","出版日期 - publicationDate","语言 - catalogingLanguage","格式 - generalFormat","详细格式 - specificFormat","版本 - edition","总版本数 - totalEditions","出版社 - publisher","出版地 - publicationPlace","主题 - subjects","简介 - summaries","是否同行审阅 - peerReviewed"
"1051290578","9787101122848,7101122841","尚書注疏彙校","孔穎達, 574-648","2018","chi","Book","PrintBook","Beijing di 1 ban",3,"中華書局","Beijing Shi","Shu jing","","否"
"1135287940","9787101124651,7101124658","廖季平先生年譜長編","王承军 (Biographer), author","2019","chi","Book","PrintBook","Beijing di 1 ban",3,"中華書局","Beijing Shi","Liao, Ping, 1852-1932 Chronology,Liao, Ping, 1852-1932,Philologists China Biography,Philologues Chine Biographies,Philologists,China,collective biographies,chronologies (lists),Chronologies,Biographies","","否"
"1246727044","9787101149357,7101149359","歷代散見《楚辭》資料輯錄","王偉 (Writer on Chinese poetry), compiler","2020","chi","Book","PrintBook","Beijing di 1 ban",2,"中華書局","Beijing","Chu ci (Ancient Chinese poems),Chinese poetry To 221 B.C. History and criticism,Chinese poetry Qin and Han dynasties, 221 B.C.-220 A.D. History and criticism,Poésie chinoise Jusqu'à 221 av. J.-C. Histoire et critique,Poésie chinoise 221 av. J.-C.-220 (Dynasties des Qin et des Han) Histoire et critique,Chinese poetry,Chinese poetry Qin and Han dynasties,Criticism, interpretation, etc,To 220","王伟""历代散见〈楚辞〉资料辑录"",分为三编,从经学,史书,类书,小学,笔记等上百种典籍中辑录历代有关""楚辞""的评论和笺注,为""楚辞""研究专著和校注之外的集成性的评论辑录.所辑著作略依年代先后排序,出处均标注原文及著作通行版本的页码,方便检阅.涉及楚辞的词句亦列出完整句子,方便读者对比勘校","否"
"1119919534","9787101139006,7101139000","秦漢魏晉篆隸字形表","徐無聞","2019","chi","Book","PrintBook","Beijing di 1 ban",5,"中華書局","Beijing Shi","Chinese language Writing Seal style,Chinese language Writing Li style,Paleography, Chinese","""秦汉魏晋篆隶字形表""为书法篆刻名家徐无闻先生主编, 是""汉语古文字字形表""的姊妹篇.我们知道, 秦以前流传下来的篆文体系的文字, 我们称之为古文字;我们今天通行的正体字称为楷书, 是从魏晋南北朝开始发展, 到隋唐时繁荣极盛.秦汉魏晋是小篆和隶书盛行的时期, 也是汉字从古文字发展演变为今天通行正体字的关键时期. 本书较为全面地收录了从秦代至西晋的篆书和隶书字形, 字形材料来自帛书, 竹简, 木牍, 碑刻以及铜器, 玺印","否"
"1079011149","9787101134452,7101134459","西南联大文学社团研究","李光荣, 1958- author","2018","chi","Book","PrintBook","Zeng ding di 1 ban",3,"中华书局","Beijing Shi","Xi nan lian he da xue (Kunming Shi, China) History,Xi nan lian he da xue (Kunming Shi, China),Chinese literature Societies, etc,Chinese literature 20th century History and criticism,Littérature chinoise Associations,Littérature chinoise 20e siècle Histoire et critique,Chinese literature,Criticism, interpretation, etc,History,1900-1999","","否"
"1200688032","9789888675623,9888675621","經學、教育與香港大學 : 二十世紀的足跡","許振興 (Professor of Chinese history), author","2020","chi","Book","PrintBook","Chu ban",2,"中華書局 (香港) 有限公司","Xianggang","University of Hong Kong. School of Chinese History,University of Hong Kong. School of Chinese,Chinese classics Study and teaching China Hong Kong History,Chinese classics History and criticism,Classiques (Littérature chinoise) Étude et enseignement Chine Hongkong Histoire,Classiques (Littérature chinoise) Histoire et critique,Chinese classics,Chinese classics Study and teaching,China Hong Kong,Criticism, interpretation, etc,History","","否"
"oclc编号 - oclcNumber","书号 - isbns","书名 - title","作者 - creator","出版日期 - publicationDate","语言 - catalogingLanguage","格式 - generalFormat","详细格式 - specificFormat","版本 - edition","总版本数 - totalEditions","出版社 - publisher","出版地 - publicationPlace","主题 - subjects","简介 - summaries","是否同行审阅 - peerReviewed"
"1083597732","9787101133516,7101133517","宋代志怪傳奇叙錄","李劍國, 1943- author","2018","chi","Book","PrintBook","Zeng ding ben, Beijing di 1 ban",8,"中華書局","Beijing","Fantasy fiction, Chinese Bibliography,Ghost stories, Chinese Bibliography,Chinese fiction Song dynasty, 960-1279 Bibliography,Histoires de fantômes chinoises Bibliographie,Roman chinois 960-1279 (Dynastie des Song) Bibliographie,Chinese fiction,Fantasy fiction, Chinese,Ghost stories, Chinese,Song Dynasty (China),Bibliographies,960-1279","本书所叙者包括两宋传奇文与志怪传奇小说集, 小说集以志怪传奇为主兼有杂事者亦收录. 本书的增订主要有以下几项: 其一, 增加了一些新篇目; 其二, 考定作者; 其三, 对作品产生时代重作考证; 其四, 绝大部分叙录内容作了重要修改, 或补充资料, 或修正讹误, 或充实内容; 其五, 在正文和注释中大量征引今人论述; 其六, 所征引文献尽量利用较好版本核对原文; 其七, 除前言后记, 改用浅近文言; 其八, 全书改用繁体字; 其九, 增加""引用书目"", 凡一千馀种","否"
"1237716265","9789888676262,9888676261","繁華落盡見真淳 ： 王安憶城市小說書寫研究","葛亮, 1978- author","2020","chi","Book","PrintBook","Di 1 ban",3,"中華書局(香港)有限公司","Xianggang","Wang, Anyi, 1954- Criticism and interpretation,Wang, Anyi, 1954-,Chinese fiction 20th century History and criticism,Roman chinois 20e siècle Histoire et critique,Chinese fiction,Criticism, interpretation, etc,1900-1999","","否"
"1083646426","9787101129243,7101129242","北宋詞譜","田玉琪, author","2018","chi","Book","PrintBook","Beijing di 1 ban",3,"中華書局","Beijing Shi","Ci (Chinese poetry) History and criticism,Chinese poetry Song dynasty, 960-1279 History and criticism,Chinese language Rhythm,Ci (Poésie chinoise) Histoire et critique,Poésie chinoise 960-1279 (Dynastie des Song) Histoire et critique,Chinois (Langue) Rythme,Chinese poetry,Ci (Chinese poetry),Song Dynasty (China),Criticism, interpretation, etc,960-1279","","否"
"1048285310","9787101130676,7101130674","甲骨軍事刻辭整理與研究","李發 (Linguist), author","2018","chi","Book","PrintBook","Beijing di 1 ban",2,"中華書局","Beijing Shi","Inscriptions, Chinese,Oracle bones,Inscriptions chinoises,Os divinatoires,Jia gu wen Ji lu Jun shi shi Shang dai Yan jiu,China History, Military To 221 B.C. Sources,Chine Histoire militaire Jusqu'à 221 av. J.-C. Sources,China,Military history,Sources,To 221 B.C","本书主要研究了甲骨军事刻辞中的几个重要问题: 一, 甲骨军事刻辞反映的商代战争. 二, 甲骨军事刻辞反映的商代军事人物. 三, 甲骨军事刻辞反映的商代军事组织"" 师"" "" 族"" "" 旅"" 三种. 四, 甲骨军事刻辞反映的商代军礼: 校阅礼, 战争礼. 五, 甲骨军事刻辞所用行为动词. 六, 甲骨军事刻辞所用句型. 七, 甲骨军事刻辞所涉语义角色: 施事, 受事, 与事, 原因, 对象(目标), 时间, 空间","否"
"1048250507","9787101128260,7101128262","魏晋经学与诗学","刘运好, author","2018","chi","Book","PrintBook","Di 1 ban",1,"中华书局","Beijing Shi","Chinese literature Three kingdoms, 220-265 History and criticism,Chinese literature Jin dynasty, 265-419 History and criticism,Chinese poetry Three kingdoms, 220-265 History and criticism,Chinese poetry Jin dynasty, 265-419 History and criticism,Chinese classics History and criticism,Littérature chinoise 220-265 (Trois Royaumes) Histoire et critique,Littérature chinoise 265-419 (Dynastie des Jin) Histoire et critique,Poésie chinoise 220-265 (Trois Royaumes) Histoire et critique,Poésie chinoise 265-419 (Dynastie des Jin) Histoire et critique,Classiques (Littérature chinoise) Histoire et critique,Chinese classics,Chinese literature,Chinese literature Three kingdoms,Chinese poetry,Chinese poetry Three kingdoms,Jin Dynasty (China : 265-419),Criticism, interpretation, etc,220-419","本书是国家社科基金项目"" 魏晋经学与诗学关系研究"" (08BZW032)的最终成果的修订稿","否"
"1046518936","7101125433,9787101125436","中国文学家大辞典. 明代卷","李时人, author","2018","chi","Book","PrintBook","Beijing di 1 ban",2,"中华书局","Beijing Shi","Authors, Chinese Biography Dictionaries Chinese,Chinese literature Ming dynasty, 1368-1644 History and criticism,Littérature chinoise 1368-1644 (Dynastie des Ming) Histoire et critique,Authors, Chinese,Chinese literature Ming dynasty,Biography,Dictionaries,Biographies,Criticism, interpretation, etc,1368-1644","","否"
"1111660765","9787101138924,7101138926","汉唐小说文体研究","何亮, author","2019","chi","Book","PrintBook","Beijing di 1 ban",4,"中华书局","Beijing Shi","Chinese fiction 221 B.C.-960 A.D. History and criticism,Roman chinois 221 av. J.-C.-960 Histoire et critique,Chinese fiction,Criticism, interpretation, etc,221 B.C.-960 A.D","","否"
"1229025577","9787101148183,7101148182","乾隆朝文人戏曲研究","王汉民, 1964- author","2020","chi","Book","PrintBook","Beijing di 1 ban",1,"中华书局","Beijing Shi","Chinese drama Qing dynasty, 1644-1912 History and criticism,Théâtre chinois 1644-1912 (Dynastie des Qing) Histoire et critique,Chinese drama,Qing Dynasty (China),Criticism, interpretation, etc,1644-1912","","否"
"1158442413","9787101145557,7101145558","中国文学叙事传统视阈中的唐代辞赋研究","周兴泰, 1978- author","2020","chi","Book","PrintBook","Beijing di 1 ban",3,"中华书局","Beijing Shi","Chinese poetry Tang dynasty, 618-907 History and criticism,Poésie chinoise 618-907 (Dynastie des Tang) Histoire et critique,Chinese poetry,Tang Dynasty (China),Criticism, interpretation, etc,618-907","","否"
"1112364811","9787101139679,7101139671","二条十年, 1955-1964","赵珩, 1948- author","2019","chi","Book","PrintBook","Beijing di 1 ban",3,"中华书局","Beijing Shi","Zhao, Heng, 1948-,Editors China Biography,Éditeurs Chine Biographies,Editors,China,Autobiography,Biography,autobiographies (literary works),Autobiographies,Biographies","本书是赵珩先生的最新作品. 作者首次集中笔墨, 追忆上世纪五六十年代居住于东四二条时期的生活, 以记叙人物为主, 兼及社会见闻与北京风物, 具有深厚的生活气息和人情味, 也自有一种社会风俗史的价值. 全书20万字, 分为上下两篇, 上篇主要写家事, 从曾祖一辈到祖父定居北京讲起, 回忆家中老辈亲人, 个人少年时光以及周围的生活场景(隆福寺, 王府井, 东安市场等).下篇主要描写家中往来的亲友, 学界师友(如宋云彬, 贺次君等)","否"
"1081151298","9787101130287,7101130283","唐代碑志文研究 = A study on monumental inscriptions of the Tang dynasty","徐海容, 1976- author","2018","chi","Book","PrintBook","Beijing di 1 ban",2,"中华书局","Beijing","Inscriptions, Chinese,Epitaphs China,Inscriptions chinoises,Épitaphes Chine,Bei wen Yan jiu Zhong guo Tang dai,Epitaphs,Tang Dynasty (China),China History Tang dynasty, 618-907,Chine Histoire 618-907 (Dynastie des Tang),China,History,618-907","碑志文是我国古代一种重要文体, 其发源于先秦, 兴起于汉, 此后历经演变. 唐代碑志文创作尤为兴盛, 其中碑志名家辈出, 作品质优量丰, 成为中华民族宝贵文化遗产的重要组成. 本书以唐代碑志文为选题, 结合具体的历史文化背景和文人创作心理, 立足于 ""全唐文"" 等书籍的基本阅读, 结合相关文献, 对唐代碑志文进行系统性比较研究, 特别注重对新出土碑志资料及研究成果的应用, 通过研讨其文体形态, 时代特征及思想内容, 就其艺术成就作出综合性分析总结, 从传承与革新角度出发, 研究还原其发生的基本语境, 分析其发展演变的内在规律及创作走向","否"
"1281997532","9787101153378,7101153372","历代楚辞图像文献研究","罗建新, 1979- author","2021","chi","Book","PrintBook","Beijing di 1 ban",2,"中华书局","Beijing Shi","Chu ci (Ancient Chinese poems),Chinese poetry To 221 B.C. History and criticism,Chinese poetry Qin and Han dynasties, 221 B.C.-220 A.D. History and criticism,Poésie chinoise Jusqu'à 221 av. J.-C. Histoire et critique,Poésie chinoise 221 av. J.-C.-220 (Dynasties des Qin et des Han) Histoire et critique,Chinese poetry,Chinese poetry Qin and Han dynasties,Criticism, interpretation, etc,To 220","","否"
"1097972561","9787101132397,7101132391","群音類選校箋","李志遠, 1974- annotator","2018","chi","Book","PrintBook","Beijing di 1 ban",3,"中華書局","Beijing","Qun yin lei xuan Criticism, Textual,San qu,Qu (Chinese literature),Chinese drama,Folk drama, Chinese,Qu (Littérature chinoise),Théâtre chinois,Théâtre populaire chinois,Gu dai xi qu Ju ben Zuo pin ji Zhong guo,Criticism, interpretation, etc","本书收录剧作凡一百五十七种, 散曲二百二十九套, 小令三百二十三首.今李志远博士以南京图书馆和首都图书馆藏原刻本为底本, 校以中华书局影印本.书中所收散出曲, 原作有全本传世者, 选择较易见者对校.其笺释内容, 主要涉及作者, 剧名, 出目, 题名, 版本, 并略述故事梗概","否"
"1044783184","9787101130300,7101130305","中国文学中的印度形象研究 = The image of India in Chinese literature","王汝良, 1973- author","2018","chi","Book","PrintBook","Beijing di 1 ban",4,"中华书局","Beijing","Chinese literature Indian influences,Chinese literature History and criticism,Littérature chinoise Influence des Peuples autochtones,Littérature chinoise Histoire et critique,Zhong guo wen xue Wen xue yan jiu,Zhong yin guan xi Wen hua jiao liu Wen hua shi Yan jiu,Chinese literature,Civilization,Diplomatic relations,India Civilization,China Foreign relations India History,India Foreign relations China History,Inde Civilisation,Chine Relations extérieures Inde Histoire,Inde Relations extérieures Chine Histoire,China,India,Criticism, interpretation, etc,History","In Chinese field only,本书是一部印度形象史, 一部中国文人对印度文化的接受史, 一部新视角下的中印文化交流史. 采用文史互证,形象学等研究方法, 对中国典籍中涉及印度形象的资料进行系统发掘,整理和研究, 使原本以隐性状态存在的片断的,不连贯的印度形象得到清晰,明朗的展示. 对印度文化进行了纵向勾勒和全景式观照的同时, 突显了中国文化自身的特征. 对中国和印度这两个东方大国两千多年来的友好交往进行了历史回顾, 又为新时期的中印关系提供启示与思考. 本书视野开阔, 探讨严谨, 文风朴实. 作为首部运用形象学视角对中国文学中的印度形象进行整体,系统研究的学术著作","否"
"1088927025","9787101135688,7101135684","甲骨文常用字字典","劉釗","2019","chi","Book","PrintBook","Beijing di 1 ban",4,"中華書局","Beijing","Inscriptions, Chinese Dictionaries,Oracle bones China Dictionaries,Chinese language Writing Jia gu style Dictionaries,Chinese language Etymology,Chinois (Langue) Étymologie,Jia gu wen Chang yong zi Zi dian,Chinese language Writing Jia gu style,Inscriptions, Chinese,Oracle bones,China,Dictionaries","本书以刘钊教授 ""新甲骨文编 (增订本)"" 为主要依据, 收录甲骨文中已释的常用字. 字典以释字(现通行汉字)为单位, 一个字头下, 收录对应的多个甲骨文, 同时指出这些字在书法书写中可以通用的字, 并标明出处(详见样稿), 因而无论是学术检索, 还是书法家参照字型, 都便捷而可靠. 书前有体例严谨, 要言不烦的编写说明, 以及拼音, 笔画两种检索方式. 末有刘钊教授所撰后记. 双色印刷, 拟设计为与 ""汉字之美日历"" 一致的小开本, 既别致美观, 又便于携带使用. 希望为学界, 书法界, 以及对甲骨文有兴趣的大众读者提供一目了然, 便于使用, 经典可靠的文本","否"
"1126338792","9787101140880,7101140882","宋代文學論考","張健, 1964 January- author","2019","chi","Book","PrintBook","Beijing di 1 ban",2,"中華書局","Beijing Shi","Chinese literature Song dynasty, 960-1279 History and criticism,Chinese literature,Song Dynasty (China),Criticism, interpretation, etc,960-1279","严羽将宋诗分为袭唐,变唐到复唐三个阶段,从诗学思想史层面上说这就是从继承抒情传统到建立知识传统再到重建抒情传统的过程.整个宋代诗歌史,诗学史的核心问题就是抒情与知识的关系问题.在诗歌史上,这两种取向形成了唐诗与宋诗两种诗歌传统;在诗学史上,形成了抒情与知识两种诗学论述.两种传统,两种论述有时对立,但两者的统一则是很多诗人的目标","否"
"1274196157","9787101152555,7101152554","《太平广记》与汉唐小说研究","熊明, 1970- author","2021","chi","Book","PrintBook","Beijing di 1 ban",3,"中华书局","Beijing","Taiping guang ji,Chinese fiction 221 B.C.-960 A.D. History and criticism,Roman chinois 221 av. J.-C.-960 Histoire et critique,Chinese fiction,Criticism, interpretation, etc,221 B.C.-960 A.D","本书在中国古代小说发展史的宏观视阈下,以对""太平广记""及其相关文献的细致爬梳与深入解读为基础,细致辨析""太平广记""的汉唐小说认知,探究""太平广记""对汉唐小说的确认与搜集,揭示""太平广记""总结汉唐小说发展的客观事实;以对""太平广记""在宋元明清以来抄刻情况的细致考察为基础,梳理""太平广记""保存与传播汉唐小说的途径,方式和效果,探寻""太平广记""在保存,传播,整理与研究汉唐小说中的作用,地位与影响,客观评价""太平广记""的小说史贡献","否"
"1153195925","9787101143133,710114313X","中国古代屈原及其作品图像研究","何继恒, author","2019","chi","Book","PrintBook","Beijing di 1 ban",3,"中华书局","Beijing","Qu, Yuan, approximately 343 B.C.-approximately 277 B.C. Criticism and interpretation,Qu, Yuan, approximately 343 B.C.-approximately 277 B.C,Criticism, interpretation, etc","本书以中国古代屈原图像和屈原作品图像为研究对象,选取七大专题,深入探讨图像与屈原及其作品之间的关系.将图像与诗歌,史传文学相观照,通过图像与文本的互证,尽力还原历史中屈原的真实形象.细致梳理屈原作品图像的发展脉络,结合社会生活,历史文化,审美思潮等因素,阐释图像与文本之间的关系,揭示图像的历史发展规律.本书对历代屈原及其作品图像的叙录,具有一定的文献学价值","否"
"1134985843","9787101141849,7101141846","两汉语类文献生成及文体研究","夏德靠, author","2019","chi","Book","PrintBook","Beijing di 1 ban",3,"中华书局","Beijing Shi","Chinese language To 600,Chinese language To 600 Grammar,Typology (Linguistics),Chinois (Langue) Jusqu'à 600,Chinois (Langue) Jusqu'à 600 Grammaire,Typologie (Linguistique),Chinese language,Chinese language Grammar,To 600","","否"
"1190654177","9787101145496,7101145493","漢字古音表稿","郭錫良, author","2020","chi","Book","PrintBook","Beijing di 1 ban",2,"中华书局","Beijing Shi","Chinese language To 600 Phonology,Chinese language Ancient Chinese, 600-1200 Phonology,Chinese language Ancient Chinese Phonology,Chinese language Phonology,To 600","","否"
"1077293863","9787101134339,7101134335","东北文学通史","何青志","2018","chi","Book","PrintBook","Beijing di 1 ban",1,"中华书局","Beijing Shi","Chinese literature China Manchuria History and criticism,Littérature chinoise Chine Mandchourie Histoire et critique,Di fang wen xue shi Dong bei di qu,Chinese literature,China Manchuria,Criticism, interpretation, etc","Ben shu shang su xian qin shi qi de shang gu shen hua yu ying xiong shi shi, xia zhi jie fang zhan zheng shi qi de dong bei wen xue huo dong. dui dong bei gu dai wen xue jin xing le shu li yu jie ding, dui ge ge shi qi wen xue de jie gou yu jiao dian zuo le xi zhi de miao shu, chan yang le dong bei qu yu wen xue de jing shen wen hua jia zhi","否"
"1201376431","9787101146028,7101146023","建构""小说"" : 中国古体小说观念流变","郝敬 (Associate professor of literature), author","2020","chi","Book","PrintBook","Beijing di 1 ban",3,"中华书局","Beijing Shi","Chinese fiction History and criticism,Roman chinois Histoire et critique,Chinese fiction,Criticism, interpretation, etc","","否"
"1204342968","9787101146837,710114683X","漢碑文字通釋","王立軍, 1965- author","2020","chi","Book","PrintBook","Beijing di 1 ban",2,"中華書局","Beijing Shi","Chinese language Etymology,Inscriptions, Chinese History and criticism,Chinois (Langue) Étymologie,Inscriptions chinoises Histoire et critique,Inscriptions, Chinese,Criticism, interpretation, etc","","否"
"1137079619","9787101142761,7101142761","明代文话研究","龚宗杰, 1986- author","2019","chi","Book","PrintBook","Beijing di 1 ban",2,"中華書局","Beijing Shi","Chinese literature Ming dynasty, 1368-1644 History and criticism,Littérature chinoise 1368-1644 (Dynastie des Ming) Histoire et critique,Chinese literature Ming dynasty,Criticism, interpretation, etc,1368-1644","","否"
"1263287128","9787101140804,7101140807","晚明公安派及其现代回响","周质平, 1947- author","2021","chi","Book","PrintBook","Beijing di 1 ban",3,"中华书局","Beijing","Yuan, Hongdao, 1568-1610 Criticism and interpretation,Yuan, Hongdao, 1568-1610,Chinese literature Ming dynasty, 1368-1644 History and criticism,Littérature chinoise 1368-1644 (Dynastie des Ming) Histoire et critique,Chinese literature Ming dynasty,Criticism, interpretation, etc,1368-1644","本书内容包括:仕隐之间的徘徊-袁宏道的生平;瓶花与匕首-袁宏道的个性,行操及思想;是真情直语还是""亡国之音""-袁宏道的诗;闲适小品与名士风流-袁宏道的文章及其再发现等","否"
"1227077878","9787101147346,7101147348","宋代筆記錄考","顧宏義, author","2021","chi","Book","PrintBook","Beijing di 1 ban",3,"中華書局","Beijing Shi","Chinese prose literature Song dynasty, 960-1279 Bibliography,Song Dynasty (China),Chinese prose literature,Bibliographies,960-1279","","否"
"1085972613","9787101135695,7101135692","古籍校勘方法論","王瑞来, author","2019","chi","Book","PrintBook","Beijing di 1 ban",3,"中华书局","Beijing","Criticism, Textual,Chinese classics Criticism, Textual,Chinese literature Criticism, Textual,Gu ji Xiao kan Fang fa lun,Chinese classics,Chinese literature,Criticism, interpretation, etc","本书是宋史专家, 文献学者王瑞来先生所写关于古籍校勘的方法论之作. 本书分综论, 方法, 辅助知识和案例四部分, 凡收文八十篇, 以类相从. 综论部分主要讲校勘底本的选择及校勘四法及其反思; 方法部分主要讲校勘原则, 校勘范围, 出校等问题. 辅助知识篇主要讲典章制度, 历史地理, 年代, 语言文字与校勘的关系. 案例部分主要讲古籍中具体问题的校勘问题","否"
"1178259057","9787101142341,7101142346","中国古代小说中的""史传""传统及其历史变迁","何悦玲, author","2020","chi","Book","PrintBook","Beijing di 1 ban",4,"中華書局","Beijing Shi","Chinese fiction History and criticism,Literature and history China,Biography as a literary form,Roman chinois Histoire et critique,Littérature et histoire Chine,Biographie (Genre littéraire),biography (general genre),Literature and history,Chinese fiction,China,Criticism, interpretation, etc","","否"
"1102025655","9787101129212,7101129218","中州集校注","元好問","2018","chi","Book","PrintBook","Beijing di 1 ban",3,"中華書局","Beijing Shi","Chinese poetry Jin dynasty, 1115-1234,Poésie chinoise 1115-1234 (Dynastie des Jin),Chinese poetry,Jin Dynasty (China : 1115-1234),1115-1234","","否"
"1080428030","9787101134209,7101134203","《禮記》版本研究","王鍔, 1965- author","2018","chi","Book","PrintBook","Beijing di 1 ban",3,"中華書局","Beijing Shi","Li ji Criticism, Textual,Li ji Ban ben Yan jiu,Li ji (Title),Criticism, interpretation, etc","南京师范大学王锷先生覃心研礼, 成就斐然. 王先生积数十年之功, 爬梳""礼记""文献源流, 广罗众本, 字字比勘, 已有""礼记郑校汇校"",""礼记注""等整理成果问世, 又将于校勘过程中之心得体会, 勒成文字, 得数十篇, 今合称""礼记版本研究"", 交中华书局出版, 用飨读者","否"
"1289883822","9787101154023,7101154026","明中叶唐顺之的史学世界 = Tang Shunzhi's historical world in the Mid Ming dynasty","李德锋, 1980- author","2021","chi","Book","PrintBook","Beijing di 1 ban",3,"中华书局","Beijing Shi","Tang, Shunzhi, 1507-1560 Criticism and interpretation,Tang, Shunzhi, 1507-1560,Historiography China History,Historiographie Chine Histoire,Historiography,China,History,Criticism, interpretation, etc","","否"
